==== maxcut TT-IPM Batch Run Started at Thu Jun  5 03:06:28 PM BST 2025 ====

▶ Running dim=7 with config=configs/maxcut_7.yaml at Thu Jun  5 03:06:28 PM BST 2025
Seed:  5

Results of iteration 0:
Finishing up: False
Inequality active: not in use
Is central: False, Is primal feasible:  False, Is dual feasible: False
Using AHO-Direction: False
Centrality Error: 1.1195992179751186
Primal-Dual Error: (np.float64(63.49999945662183), np.float64(64.44309952848971))
Sigma: 0.5
Ranks X_tt: [1, 1, 1, 1, 1, 1], Z_tt: [1, 1, 1, 1, 1, 1], 
      Y_tt: [1, 1, 1, 1, 1, 1], T_tt: None 


--- Predictor  step ---

	---Starting Block-ALS---
	Starting Sweep: 0
	Direction 1
	Residual inf
	TT-sol rank: [3, 3, 3, 3, 3, 3]
	Starting Sweep: 1
	Direction -1
	Residual 168405.6135634581
	TT-sol rank: [1, 1, 1, 2, 2, 2]
	Starting Sweep: 2
	Direction 1
	Residual 0.0005792758249622443
	TT-sol rank: [2, 2, 2, 3, 2, 1]
	Starting Sweep: 3
	Direction -1
	Residual 5.4173881699829674e-05
	TT-sol rank: [1, 2, 2, 3, 2, 2]

	---Results---
	Solution rank is [1 2 2 3 2 2]
	Residual  5.4173881699829674e-05
	Number of sweeps 4
	Time:  0.18719911575317383
	Time per sweep:  0.046801209449768066

Starting Eigen solve with:
 	 0.00022500000000000002 
 	 sweeps: 10
	Starting Sweep: 0
	Step size: 1.000000
	Direction: -1
	Residual inf
	TT-sol rank: [4, 4, 4, 4, 4, 2]
	Starting Sweep: 0
	Step size: 1.000000
	Direction: 1
	Residual 0
	TT-sol rank: [2, 4, 4, 6, 4, 3]
	 -----
	 Solution rank is [1 2 2 3 2 1]
	 Step size: 1.000000
	 Residual 0
	 Number of sweeps 2
	 Time:  0.03810381889343262
	 Time per sweep:  0.01905536651611328

Starting Eigen solve with:
 	 0.00022500000000000002 
 	 sweeps: 10
	Starting Sweep: 0
	Step size: 1.000000
	Direction: -1
	Residual inf
	TT-sol rank: [4, 4, 4, 4, 4, 2]
	Starting Sweep: 0
	Step size: 1.000000
	Direction: 1
	Residual 0
	TT-sol rank: [2, 4, 4, 4, 3, 3]
	 -----
	 Solution rank is [1 1 1 2 1 1]
	 Step size: 1.000000
	 Residual 0
	 Number of sweeps 2
	 Time:  0.019749879837036133
	 Time per sweep:  0.009877920150756836

--- Centering-Corrector  step ---

	---Starting Block-ALS---
	Starting Sweep: 0
	Direction 1
	Residual inf
	TT-sol rank: [3, 6, 6, 9, 5, 2]
	Starting Sweep: 1
	Direction -1
	Residual 1458.4151483655564
	TT-sol rank: [1, 3, 3, 3, 3, 3]
	Starting Sweep: 2
	Direction 1
	Residual 5.334834081055511e-05
	TT-sol rank: [3, 4, 4, 4, 3, 2]
	Starting Sweep: 3
	Direction -1
	Residual 3.368618526462468e-05
	TT-sol rank: [2, 3, 3, 3, 3, 3]

	---Results---
	Solution rank is [2 3 3 3 3 3]
	Residual  3.368618526462468e-05
	Number of sweeps 4
	Time:  0.20952534675598145
	Time per sweep:  0.05238240957260132

Starting Eigen solve with:
 	 0.00022500000000000002 
 	 sweeps: 10
	Starting Sweep: 0
	Step size: 1.000000
	Direction: -1
	Residual inf
	TT-sol rank: [3, 4, 4, 5, 4, 2]
	Starting Sweep: 0
	Step size: 0.501822
	Direction: 1
	Residual 0
	TT-sol rank: [2, 4, 4, 5, 4, 3]
	Starting Sweep: 1
	Step size: 0.501822
	Direction: -1
	Residual 0
	TT-sol rank: [3, 4, 4, 5, 4, 2]
	 -----
	 Solution rank is [1 2 2 3 2 1]
	 Step size: 0.501822
	 Residual 0
	 Number of sweeps 2
	 Time:  0.0360562801361084
	 Time per sweep:  0.018030643463134766

Starting Eigen solve with:
 	 0.00022500000000000002 
 	 sweeps: 10
	Starting Sweep: 0
	Step size: 1.000000
	Direction: -1
	Residual inf
	TT-sol rank: [3, 3, 3, 4, 3, 2]
	Starting Sweep: 0
	Step size: 1.000000
	Direction: 1
	Residual 0
	TT-sol rank: [2, 4, 4, 5, 4, 3]
	 -----
	 Solution rank is [1 2 2 3 2 1]
	 Step size: 1.000000
	 Residual 0
	 Number of sweeps 2
	 Time:  0.02025318145751953
	 Time per sweep:  0.01012873649597168
--- Step 1 ---
Step sizes: 0.4642308061120031, 1.0

Results of iteration 1:
Finishing up: False
Inequality active: not in use
Is central: False, Is primal feasible:  False, Is dual feasible: False
Using AHO-Direction: False
Centrality Error: 0.9914110509231644
Primal-Dual Error: (np.float64(4.542714543541536), np.float64(64.4430658809689))
Sigma: 4.6575053516587555e-07
Ranks X_tt: [3, 4, 4, 5, 4, 3], Z_tt: [3, 4, 4, 4, 4, 3], 
      Y_tt: [1, 2, 2, 3, 2, 1], T_tt: None 


--- Predictor  step ---

	---Starting Block-ALS---
	Starting Sweep: 0
	Direction 1
	Residual inf
	TT-sol rank: [6, 9, 9, 9, 6, 2]
	Starting Sweep: 1
	Direction -1
	Residual 1416.0519874809609
	TT-sol rank: [2, 4, 6, 6, 6, 5]
	Starting Sweep: 2
	Direction 1
	Residual 7.648577944401268e-05
	TT-sol rank: [5, 9, 10, 8, 6, 2]
	Starting Sweep: 3
	Direction -1
	Residual 2.075822534823397e-05
	TT-sol rank: [2, 5, 6, 6, 6, 5]

	---Results---
	Solution rank is [2 5 6 6 6 5]
	Residual  2.075822534823397e-05
	Number of sweeps 4
	Time:  0.11899137496948242
	Time per sweep:  0.029748380184173584

Starting Eigen solve with:
 	 0.00022500000000000002 
 	 sweeps: 10
	Starting Sweep: 0
	Step size: 1.000000
	Direction: -1
	Residual inf
	TT-sol rank: [3, 4, 4, 5, 4, 2]
	Starting Sweep: 0
	Step size: 1.000000
	Direction: 1
	Residual 0
	TT-sol rank: [2, 4, 4, 5, 4, 3]
	 -----
	 Solution rank is [1 2 2 3 2 1]
	 Step size: 1.000000
	 Residual 0
	 Number of sweeps 2
	 Time:  0.01883697509765625
	 Time per sweep:  0.009419679641723633

Starting Eigen solve with:
 	 0.00022500000000000002 
 	 sweeps: 10
	Starting Sweep: 0
	Step size: 1.000000
	Direction: -1
	Residual inf
	TT-sol rank: [3, 4, 4, 5, 4, 2]
	Starting Sweep: 0
	Step size: 1.000000
	Direction: 1
	Residual 0
	TT-sol rank: [2, 4, 4, 5, 4, 3]
	 -----
	 Solution rank is [1 2 2 3 2 1]
	 Step size: 1.000000
	 Residual 0
	 Number of sweeps 2
	 Time:  0.014913797378540039
	 Time per sweep:  0.007459402084350586

--- Centering-Corrector  step ---

	---Starting Block-ALS---
	Starting Sweep: 0
	Direction 1
	Residual inf
	TT-sol rank: [6, 13, 12, 11, 6, 2]
	Starting Sweep: 1
	Direction -1
	Residual 169.6242738272082
	TT-sol rank: [2, 5, 6, 6, 6, 5]
	Starting Sweep: 2
	Direction 1
	Residual 4.951482273351045e-05
	TT-sol rank: [5, 9, 9, 7, 6, 2]
	Starting Sweep: 3
	Direction -1
	Residual 4.951482273351045e-05
	TT-sol rank: [2, 5, 6, 6, 6, 5]

	---Results---
	Solution rank is [2 5 6 6 6 5]
	Residual  4.951482273351045e-05
	Number of sweeps 4
	Time:  0.11153769493103027
	Time per sweep:  0.027885019779205322

Starting Eigen solve with:
 	 0.00022500000000000002 
 	 sweeps: 10
	Starting Sweep: 0
	Step size: 1.000000
	Direction: -1
	Residual inf
	TT-sol rank: [3, 4, 4, 5, 4, 2]
	Starting Sweep: 0
	Step size: 0.554468
	Direction: 1
	Residual 0
	TT-sol rank: [2, 4, 4, 6, 4, 3]
	 -----
	 Solution rank is [1 2 2 4 2 1]
	 Step size: 0.554468
	 Residual 0
	 Number of sweeps 2
	 Time:  0.01856088638305664
	 Time per sweep:  0.009281635284423828

Starting Eigen solve with:
 	 0.00022500000000000002 
 	 sweeps: 10
	Starting Sweep: 0
	Step size: 1.000000
	Direction: -1
	Residual inf
	TT-sol rank: [3, 4, 4, 5, 4, 2]
	Starting Sweep: 0
	Step size: 1.000000
	Direction: 1
	Residual 0
	TT-sol rank: [2, 4, 4, 5, 4, 3]
	 -----
	 Solution rank is [1 2 2 3 2 1]
	 Step size: 1.000000
	 Residual 0
	 Number of sweeps 2
	 Time:  0.012108802795410156
	 Time per sweep:  0.006055593490600586
--- Step 2 ---
Step sizes: 0.51439263993066, 1.0

Results of iteration 2:
Finishing up: False
Inequality active: not in use
Is central: False, Is primal feasible:  False, Is dual feasible: False
Using AHO-Direction: False
Centrality Error: 0.31092304327095277
Primal-Dual Error: (np.float64(0.13063826132195544), np.float64(64.44310635475293))
Sigma: 0.0007126366226928335
Ranks X_tt: [3, 7, 7, 7, 6, 3], Z_tt: [3, 6, 6, 5, 5, 3], 
      Y_tt: [1, 2, 2, 3, 2, 1], T_tt: None 


--- Predictor  step ---

	---Starting Block-ALS---
	Starting Sweep: 0
	Direction 1
	Residual inf
	TT-sol rank: [6, 13, 12, 11, 6, 2]
	Starting Sweep: 1
	Direction -1
	Residual 149.30624753547488
	TT-sol rank: [2, 5, 6, 6, 6, 4]
	Starting Sweep: 2
	Direction 1
	Residual 2.1074196795494595e-05
	TT-sol rank: [4, 8, 8, 7, 5, 2]
	Starting Sweep: 3
	Direction -1
	Residual 2.1074196795494595e-05
	TT-sol rank: [2, 5, 6, 6, 6, 4]

	---Results---
	Solution rank is [2 5 6 6 6 4]
	Residual  2.1074196795494595e-05
	Number of sweeps 4
	Time:  0.1304483413696289
	Time per sweep:  0.03261256217956543

Starting Eigen solve with:
 	 0.00022500000000000002 
 	 sweeps: 10
	Starting Sweep: 0
	Step size: 1.000000
	Direction: -1
	Residual inf
	TT-sol rank: [3, 4, 4, 6, 4, 2]
	Starting Sweep: 0
	Step size: 1.000000
	Direction: 1
	Residual 0
	TT-sol rank: [2, 4, 4, 5, 4, 3]
	 -----
	 Solution rank is [1 2 2 3 2 1]
	 Step size: 1.000000
	 Residual 0
	 Number of sweeps 2
	 Time:  0.013444662094116211
	 Time per sweep:  0.006723165512084961

Starting Eigen solve with:
 	 0.00022500000000000002 
 	 sweeps: 10
	Starting Sweep: 0
	Step size: 1.000000
	Direction: -1
	Residual inf
	TT-sol rank: [3, 4, 4, 5, 4, 2]
	Starting Sweep: 0
	Step size: 0.735576
	Direction: 1
	Residual 0
	TT-sol rank: [2, 4, 4, 6, 4, 3]
	Starting Sweep: 1
	Step size: 0.735576
	Direction: -1
	Residual 0
	TT-sol rank: [3, 4, 4, 6, 4, 2]
	 -----
	 Solution rank is [1 2 2 4 2 1]
	 Step size: 0.735576
	 Residual 0
	 Number of sweeps 2
	 Time:  0.020801544189453125
	 Time per sweep:  0.01040184497833252

--- Centering-Corrector  step ---

	---Starting Block-ALS---
	Starting Sweep: 0
	Direction 1
	Residual inf
	TT-sol rank: [6, 13, 16, 14, 6, 2]
	Starting Sweep: 1
	Direction -1
	Residual 128.01783624532644
	TT-sol rank: [2, 5, 6, 6, 6, 4]
	Starting Sweep: 2
	Direction 1
	Residual 1.9104258836746414e-05
	TT-sol rank: [4, 8, 8, 7, 5, 2]
	Starting Sweep: 3
	Direction -1
	Residual 1.9104258836746414e-05
	TT-sol rank: [2, 5, 6, 6, 6, 4]

	---Results---
	Solution rank is [2 5 6 6 6 4]
	Residual  1.9104258836746414e-05
	Number of sweeps 4
	Time:  0.14328789710998535
	Time per sweep:  0.03582262992858887

Starting Eigen solve with:
 	 0.00022500000000000002 
 	 sweeps: 10
	Starting Sweep: 0
	Step size: 1.000000
	Direction: -1
	Residual inf
	TT-sol rank: [3, 4, 4, 5, 4, 2]
	Starting Sweep: 0
	Step size: 1.000000
	Direction: 1
	Residual 0
	TT-sol rank: [2, 4, 4, 5, 4, 3]
	 -----
	 Solution rank is [1 2 2 3 2 1]
	 Step size: 1.000000
	 Residual 0
	 Number of sweeps 2
	 Time:  0.01149296760559082
	 Time per sweep:  0.0057479143142700195

Starting Eigen solve with:
 	 0.00022500000000000002 
 	 sweeps: 10
	Starting Sweep: 0
	Step size: 1.000000
	Direction: -1
	Residual inf
	TT-sol rank: [3, 4, 4, 6, 4, 2]
	Starting Sweep: 0
	Step size: 0.372338
	Direction: 1
	Residual 0
	TT-sol rank: [2, 4, 4, 6, 4, 3]
	 -----
	 Solution rank is [1 2 2 4 2 1]
	 Step size: 0.372338
	 Residual 0
	 Number of sweeps 2
	 Time:  0.013123273849487305
	 Time per sweep:  0.006562590599060059
--- Step 3 ---
Step sizes: 1.0, 0.34203576216130893

Results of iteration 3:
Finishing up: False
Inequality active: not in use
Is central: False, Is primal feasible:  False, Is dual feasible: False
Using AHO-Direction: True
Centrality Error: 0.035487432405564484
Primal-Dual Error: (np.float64(0.13072468052128008), np.float64(20.359444513188805))
Sigma: 0.03308077252169865
Ranks X_tt: [3, 6, 7, 7, 7, 3], Z_tt: [3, 6, 7, 7, 6, 3], 
      Y_tt: [1, 2, 2, 3, 2, 1], T_tt: None 


--- Predictor  step ---

	---Starting Block-ALS---
	Starting Sweep: 0
	Direction 1
	Residual inf
	TT-sol rank: [6, 13, 16, 14, 6, 2]
	Starting Sweep: 1
	Direction -1
	Residual 128.5384330429914
	TT-sol rank: [2, 5, 6, 7, 8, 5]
	Starting Sweep: 2
	Direction 1
	Residual 7.557326537369057e-06
	TT-sol rank: [5, 9, 9, 8, 6, 2]
	Starting Sweep: 3
	Direction -1
	Residual 7.220938146251381e-06
	TT-sol rank: [2, 5, 7, 7, 8, 5]

	---Results---
	Solution rank is [2 5 7 7 8 5]
	Residual  7.220938146251381e-06
	Number of sweeps 4
	Time:  0.10876846313476562
	Time per sweep:  0.02719271183013916

Starting Eigen solve with:
 	 0.00022500000000000002 
 	 sweeps: 10
	Starting Sweep: 0
	Step size: 1.000000
	Direction: -1
	Residual inf
	TT-sol rank: [3, 4, 4, 5, 4, 2]
	Starting Sweep: 0
	Step size: 1.000000
	Direction: 1
	Residual 0
	TT-sol rank: [2, 4, 4, 5, 4, 3]
	 -----
	 Solution rank is [1 2 2 3 2 1]
	 Step size: 1.000000
	 Residual 0
	 Number of sweeps 2
	 Time:  0.010413885116577148
	 Time per sweep:  0.0052078962326049805

Starting Eigen solve with:
 	 0.00022500000000000002 
 	 sweeps: 10
	Starting Sweep: 0
	Step size: 1.000000
	Direction: -1
	Residual inf
	TT-sol rank: [3, 4, 4, 6, 4, 2]
	Starting Sweep: 0
	Step size: 1.000000
	Direction: 1
	Residual 0
	TT-sol rank: [2, 4, 4, 6, 4, 3]
	 -----
	 Solution rank is [1 2 2 4 2 1]
	 Step size: 1.000000
	 Residual 0
	 Number of sweeps 2
	 Time:  0.008707284927368164
	 Time per sweep:  0.004354357719421387

--- Centering-Corrector  step ---

	---Starting Block-ALS---
	Starting Sweep: 0
	Direction 1
	Residual inf
	TT-sol rank: [6, 13, 16, 14, 6, 2]
	Starting Sweep: 1
	Direction -1
	Residual 39.72861404883356
	TT-sol rank: [2, 5, 7, 7, 8, 5]
	Starting Sweep: 2
	Direction 1
	Residual 7.0660554452847065e-06
	TT-sol rank: [5, 9, 9, 8, 6, 2]
	Starting Sweep: 3
	Direction -1
	Residual 7.0660554452847065e-06
	TT-sol rank: [2, 5, 7, 7, 8, 5]

	---Results---
	Solution rank is [2 5 7 7 8 5]
	Residual  7.0660554452847065e-06
	Number of sweeps 4
	Time:  0.10260176658630371
	Time per sweep:  0.02565091848373413

Starting Eigen solve with:
 	 0.00022500000000000002 
 	 sweeps: 10
	Starting Sweep: 0
	Step size: 1.000000
	Direction: -1
	Residual inf
	TT-sol rank: [3, 4, 4, 5, 4, 2]
	Starting Sweep: 0
	Step size: 1.000000
	Direction: 1
	Residual 0
	TT-sol rank: [2, 4, 4, 5, 4, 3]
	 -----
	 Solution rank is [1 2 2 3 2 1]
	 Step size: 1.000000
	 Residual 0
	 Number of sweeps 2
	 Time:  0.01080632209777832
	 Time per sweep:  0.005403995513916016

Starting Eigen solve with:
 	 0.00022500000000000002 
 	 sweeps: 10
	Starting Sweep: 0
	Step size: 1.000000
	Direction: -1
	Residual inf
	TT-sol rank: [3, 4, 4, 6, 4, 2]
	Starting Sweep: 0
	Step size: 0.542833
	Direction: 1
	Residual 0
	TT-sol rank: [2, 4, 4, 6, 4, 3]
	 -----
	 Solution rank is [1 2 2 3 2 1]
	 Step size: 0.542833
	 Residual 0
	 Number of sweeps 2
	 Time:  0.01190948486328125
	 Time per sweep:  0.005955934524536133
--- Step 4 ---
Step sizes: 1.0, 0.5032832805869035

Results of iteration 4:
Finishing up: False
Inequality active: not in use
Is central: False, Is primal feasible:  False, Is dual feasible: False
Using AHO-Direction: True
Centrality Error: 0.0032181442569024993
Primal-Dual Error: (np.float64(0.13060625547372573), np.float64(0.13359771081406677))
Sigma: 0.004441896557672967
Ranks X_tt: [3, 6, 8, 8, 7, 3], Z_tt: [3, 6, 7, 8, 6, 3], 
      Y_tt: [1, 2, 2, 3, 2, 1], T_tt: None 


--- Predictor  step ---

	---Starting Block-ALS---
	Starting Sweep: 0
	Direction 1
	Residual inf
	TT-sol rank: [6, 13, 16, 14, 6, 2]
	Starting Sweep: 1
	Direction -1
	Residual 41.437379986623384
	TT-sol rank: [2, 6, 12, 16, 13, 5]
	Starting Sweep: 2
	Direction 1
	Residual 1.5237088087908892e-05
	TT-sol rank: [5, 13, 16, 16, 6, 2]
	Starting Sweep: 3
	Direction -1
	Residual 1.5237088087908892e-05
	TT-sol rank: [2, 6, 12, 16, 13, 5]

	---Results---
	Solution rank is [ 2  6 12 16 13  5]
	Residual  1.5237088087908892e-05
	Number of sweeps 4
	Time:  0.3340127468109131
	Time per sweep:  0.08350372314453125

Starting Eigen solve with:
 	 0.00022500000000000002 
 	 sweeps: 10
	Starting Sweep: 0
	Step size: 1.000000
	Direction: -1
	Residual inf
	TT-sol rank: [3, 4, 4, 5, 4, 2]
	Starting Sweep: 0
	Step size: 1.000000
	Direction: 1
	Residual 0
	TT-sol rank: [2, 4, 4, 5, 4, 3]
	 -----
	 Solution rank is [1 2 2 3 2 1]
	 Step size: 1.000000
	 Residual 0
	 Number of sweeps 2
	 Time:  0.01579570770263672
	 Time per sweep:  0.007899165153503418

Starting Eigen solve with:
 	 0.00022500000000000002 
 	 sweeps: 10
	Starting Sweep: 0
	Step size: 1.000000
	Direction: -1
	Residual inf
	TT-sol rank: [3, 4, 4, 5, 4, 2]
	Starting Sweep: 0
	Step size: 0.425409
	Direction: 1
	Residual 0
	TT-sol rank: [2, 4, 4, 6, 4, 3]
	Starting Sweep: 1
	Step size: 0.425409
	Direction: -1
	Residual 0
	TT-sol rank: [3, 4, 4, 5, 4, 2]
	 -----
	 Solution rank is [1 2 2 3 2 1]
	 Step size: 0.425409
	 Residual 0
	 Number of sweeps 2
	 Time:  0.05206179618835449
	 Time per sweep:  0.026034116744995117

--- Centering-Corrector  step ---

	---Starting Block-ALS---
	Starting Sweep: 0
	Direction 1
	Residual inf
	TT-sol rank: [5, 12, 16, 15, 6, 2]
	Starting Sweep: 1
	Direction -1
	Residual 0.6245260542909062
	TT-sol rank: [2, 6, 12, 16, 13, 5]
	Starting Sweep: 2
	Direction 1
	Residual 0.0005487236769581682
	TT-sol rank: [5, 13, 16, 16, 6, 2]
	Starting Sweep: 3
	Direction -1
	Residual 0.0005487236769581682
	TT-sol rank: [2, 7, 13, 16, 13, 5]

	---Results---
	Solution rank is [ 2  7 13 16 13  5]
	Residual  0.0005487236769581682
	Number of sweeps 4
	Time:  0.34552931785583496
	Time per sweep:  0.08638352155685425

Starting Eigen solve with:
 	 0.00022500000000000002 
 	 sweeps: 10
	Starting Sweep: 0
	Step size: 1.000000
	Direction: -1
	Residual inf
	TT-sol rank: [3, 4, 4, 5, 4, 2]
	Starting Sweep: 0
	Step size: 1.000000
	Direction: 1
	Residual 0
	TT-sol rank: [2, 4, 4, 5, 4, 3]
	 -----
	 Solution rank is [1 2 2 3 2 1]
	 Step size: 1.000000
	 Residual 0
	 Number of sweeps 2
	 Time:  0.019121885299682617
	 Time per sweep:  0.009563803672790527

Starting Eigen solve with:
 	 0.00022500000000000002 
 	 sweeps: 10
	Starting Sweep: 0
	Step size: 1.000000
	Direction: -1
	Residual inf
	TT-sol rank: [3, 4, 4, 5, 4, 2]
	Starting Sweep: 0
	Step size: 0.277448
	Direction: 1
	Residual 0
	TT-sol rank: [2, 4, 4, 6, 4, 3]
	Starting Sweep: 1
	Step size: 0.277448
	Direction: -1
	Residual 0
	TT-sol rank: [3, 4, 4, 5, 4, 2]
	 -----
	 Solution rank is [1 2 2 3 2 1]
	 Step size: 0.277448
	 Residual 0
	 Number of sweeps 2
	 Time:  0.06235170364379883
	 Time per sweep:  0.031179189682006836
--- Step 5 ---
Step sizes: 1.0, 0.2535521900967544

Results of iteration 5:
Finishing up: False
Inequality active: not in use
Is central: False, Is primal feasible:  False, Is dual feasible: False
Using AHO-Direction: True
Centrality Error: 0.0019741573792032333
Primal-Dual Error: (np.float64(0.13073539949456156), np.float64(0.06581373021725898))
Sigma: 0.6283769535306292
Ranks X_tt: [3, 7, 11, 14, 7, 3], Z_tt: [3, 6, 7, 8, 6, 3], 
      Y_tt: [1, 2, 2, 3, 2, 1], T_tt: None 


--- Predictor  step ---

	---Starting Block-ALS---
	Starting Sweep: 0
	Direction 1
	Residual inf
	TT-sol rank: [5, 13, 16, 16, 6, 2]
	Starting Sweep: 1
	Direction -1
	Residual 1.1606645319946136
	TT-sol rank: [2, 7, 14, 16, 13, 5]
	Starting Sweep: 2
	Direction 1
	Residual 0.00791319281197439
	TT-sol rank: [5, 14, 16, 16, 8, 2]
	Starting Sweep: 3
	Direction -1
	Residual 0.00043952860857203577
	TT-sol rank: [2, 7, 14, 16, 15, 5]

	---Results---
	Solution rank is [ 2  7 14 16 15  5]
	Residual  0.00043952860857203577
	Number of sweeps 4
	Time:  1.593428373336792
	Time per sweep:  0.39835768938064575

Starting Eigen solve with:
 	 0.00022500000000000002 
 	 sweeps: 10
	Starting Sweep: 0
	Step size: 1.000000
	Direction: -1
	Residual inf
	TT-sol rank: [3, 4, 4, 5, 4, 2]
	Starting Sweep: 0
	Step size: 1.000000
	Direction: 1
	Residual 0
	TT-sol rank: [2, 4, 4, 5, 4, 3]
	 -----
	 Solution rank is [1 2 2 3 2 1]
	 Step size: 1.000000
	 Residual 0
	 Number of sweeps 2
	 Time:  0.014655590057373047
	 Time per sweep:  0.007329106330871582

Starting Eigen solve with:
 	 0.00022500000000000002 
 	 sweeps: 10
	Starting Sweep: 0
	Step size: 1.000000
	Direction: -1
	Residual inf
	TT-sol rank: [3, 4, 4, 5, 4, 2]
	Starting Sweep: 0
	Step size: 0.175771
	Direction: 1
	Residual 0
	TT-sol rank: [2, 4, 4, 6, 4, 3]
	Starting Sweep: 1
	Step size: 0.175771
	Direction: -1
	Residual 0
	TT-sol rank: [3, 4, 4, 5, 4, 2]
	 -----
	 Solution rank is [1 2 2 3 2 1]
	 Step size: 0.175771
	 Residual 0
	 Number of sweeps 2
	 Time:  0.01885056495666504
	 Time per sweep:  0.009426474571228027

--- Centering-Corrector  step ---

	---Starting Block-ALS---
	Starting Sweep: 0
	Direction 1
	Residual inf
	TT-sol rank: [6, 15, 16, 16, 8, 2]
	Starting Sweep: 1
	Direction -1
	Residual 0.7074754689591496
	TT-sol rank: [2, 7, 14, 16, 15, 5]
	Starting Sweep: 2
	Direction 1
	Residual 0.0012470885260143637
	TT-sol rank: [5, 14, 16, 16, 8, 2]
	Starting Sweep: 3
	Direction -1
	Residual 0.0012470885260143637
	TT-sol rank: [2, 7, 14, 16, 15, 5]

	---Results---
	Solution rank is [ 2  7 14 16 15  5]
	Residual  0.0012470885260143637
	Number of sweeps 4
	Time:  1.1674895286560059
	Time per sweep:  0.2918736934661865

Starting Eigen solve with:
 	 0.00022500000000000002 
 	 sweeps: 10
	Starting Sweep: 0
	Step size: 1.000000
	Direction: -1
	Residual inf
	TT-sol rank: [3, 4, 4, 5, 4, 2]
	Starting Sweep: 0
	Step size: 0.503818
	Direction: 1
	Residual 0
	TT-sol rank: [2, 4, 4, 6, 4, 3]
	Starting Sweep: 1
	Step size: 0.503818
	Direction: -1
	Residual 0
	TT-sol rank: [3, 3, 3, 4, 4, 2]
	 -----
	 Solution rank is [1 1 1 2 2 1]
	 Step size: 0.503818
	 Residual 0
	 Number of sweeps 2
	 Time:  0.03675651550292969
	 Time per sweep:  0.018380284309387207

Starting Eigen solve with:
 	 0.00022500000000000002 
 	 sweeps: 10
	Starting Sweep: 0
	Step size: 1.000000
	Direction: -1
	Residual inf
	TT-sol rank: [3, 4, 4, 5, 4, 2]
	Starting Sweep: 0
	Step size: 0.432621
	Direction: 1
	Residual 0
	TT-sol rank: [2, 4, 4, 6, 4, 3]
	Starting Sweep: 1
	Step size: 0.432621
	Direction: -1
	Residual 0
	TT-sol rank: [3, 4, 4, 5, 4, 2]
	 -----
	 Solution rank is [1 2 2 3 2 1]
	 Step size: 0.432621
	 Residual 0
	 Number of sweeps 2
	 Time:  0.033034324645996094
	 Time per sweep:  0.016520023345947266
--- Step 6 ---
Step sizes: 0.4643344287638317, 0.39871659007887805

Results of iteration 6:
Finishing up: False
Inequality active: not in use
Is central: False, Is primal feasible:  False, Is dual feasible: False
Using AHO-Direction: True
Centrality Error: 0.0006397412608175429
Primal-Dual Error: (np.float64(0.009470106657775253), np.float64(0.013238631624693872))
Sigma: 0.550692752445867
Ranks X_tt: [3, 7, 12, 18, 9, 3], Z_tt: [3, 8, 11, 7, 6, 3], 
      Y_tt: [1, 2, 2, 3, 2, 1], T_tt: None 


--- Predictor  step ---

	---Starting Block-ALS---
	Starting Sweep: 0
	Direction 1
	Residual inf
	TT-sol rank: [6, 16, 16, 16, 8, 2]
	Starting Sweep: 1
	Direction -1
	Residual 1.1762353281225864
	TT-sol rank: [2, 7, 14, 16, 15, 5]
	Starting Sweep: 2
	Direction 1
	Residual 0.009052732098727142
	TT-sol rank: [5, 16, 16, 16, 8, 2]
	Starting Sweep: 3
	Direction -1
	Residual 0.009052732098727142
	TT-sol rank: [2, 7, 14, 16, 15, 5]

	---Results---
	Solution rank is [ 2  7 14 16 15  5]
	Residual  0.009052732098727142
	Number of sweeps 4
	Time:  2.738945722579956
	Time per sweep:  0.6847372651100159

Starting Eigen solve with:
 	 0.00022500000000000002 
 	 sweeps: 10
	Starting Sweep: 0
	Step size: 1.000000
	Direction: -1
	Residual inf
	TT-sol rank: [3, 3, 3, 4, 4, 2]
	Starting Sweep: 0
	Step size: 0.980374
	Direction: 1
	Residual 0
	TT-sol rank: [2, 4, 4, 6, 6, 4]
	Starting Sweep: 1
	Step size: 0.854131
	Direction: -1
	Residual 0
	TT-sol rank: [3, 4, 4, 6, 4, 2]
	Starting Sweep: 1
	Step size: 0.779332
	Direction: 1
	Residual 0
	TT-sol rank: [2, 4, 4, 6, 4, 3]
	Starting Sweep: 2
	Step size: 0.779332
	Direction: -1
	Residual 0
	TT-sol rank: [3, 4, 4, 5, 4, 2]
	 -----
	 Solution rank is [1 2 2 3 2 1]
	 Step size: 0.779332
	 Residual 0
	 Number of sweeps 3
	 Time:  0.11612796783447266
	 Time per sweep:  0.03871075312296549

Starting Eigen solve with:
 	 0.00022500000000000002 
 	 sweeps: 10
	Starting Sweep: 0
	Step size: 1.000000
	Direction: -1
	Residual inf
	TT-sol rank: [3, 4, 4, 5, 4, 2]
	Starting Sweep: 0
	Step size: 0.443423
	Direction: 1
	Residual 0
	TT-sol rank: [2, 4, 4, 6, 4, 3]
	Starting Sweep: 1
	Step size: 0.443423
	Direction: -1
	Residual 0
	TT-sol rank: [3, 4, 4, 5, 4, 2]
	 -----
	 Solution rank is [1 2 2 3 2 1]
	 Step size: 0.443423
	 Residual 0
	 Number of sweeps 2
	 Time:  0.02979874610900879
	 Time per sweep:  0.014901280403137207

--- Centering-Corrector  step ---

	---Starting Block-ALS---
	Starting Sweep: 0
	Direction 1
	Residual inf
	TT-sol rank: [6, 14, 16, 16, 8, 2]
	Starting Sweep: 1
	Direction -1
	Residual 0.9606181879461374
	TT-sol rank: [2, 7, 14, 16, 16, 5]
	Starting Sweep: 2
	Direction 1
	Residual 0.005138136543902602
	TT-sol rank: [5, 16, 16, 16, 8, 2]
	Starting Sweep: 3
	Direction -1
	Residual 0.005138136543902602
	TT-sol rank: [2, 7, 14, 16, 16, 5]

	---Results---
	Solution rank is [ 2  7 14 16 16  5]
	Residual  0.005138136543902602
	Number of sweeps 4
	Time:  4.7644712924957275
	Time per sweep:  1.1911189556121826

Starting Eigen solve with:
 	 0.00022500000000000002 
 	 sweeps: 10
	Starting Sweep: 0
	Step size: 1.000000
	Direction: -1
	Residual inf
	TT-sol rank: [3, 4, 4, 5, 4, 2]
	Starting Sweep: 0
	Step size: 0.449426
	Direction: 1
	Residual 0
	TT-sol rank: [2, 4, 4, 6, 4, 3]
	Starting Sweep: 1
	Step size: 0.449426
	Direction: -1
	Residual 0
	TT-sol rank: [3, 4, 4, 6, 4, 2]
	 -----
	 Solution rank is [1 2 2 4 2 1]
	 Step size: 0.449426
	 Residual 0
	 Number of sweeps 2
	 Time:  0.07318592071533203
	 Time per sweep:  0.036595940589904785

Starting Eigen solve with:
 	 0.00022500000000000002 
 	 sweeps: 10
	Starting Sweep: 0
	Step size: 1.000000
	Direction: -1
	Residual inf
	TT-sol rank: [3, 4, 4, 5, 4, 2]
	Starting Sweep: 0
	Step size: 0.374358
	Direction: 1
	Residual 0
	TT-sol rank: [2, 4, 4, 6, 4, 3]
	Starting Sweep: 1
	Step size: 0.374358
	Direction: -1
	Residual 0
	TT-sol rank: [3, 4, 4, 5, 4, 2]
	 -----
	 Solution rank is [1 2 2 3 2 1]
	 Step size: 0.374358
	 Residual 0
	 Number of sweeps 2
	 Time:  0.04241824150085449
	 Time per sweep:  0.021211743354797363
--- Step 7 ---
Step sizes: 0.41289596030863523, 0.34392942889529726

Results of iteration 7:
Finishing up: False
Inequality active: not in use
Is central: False, Is primal feasible:  False, Is dual feasible: False
Using AHO-Direction: True
Centrality Error: 0.00020921934201620826
Primal-Dual Error: (np.float64(0.0017958986047436293), np.float64(0.0040343117901190904))
Sigma: 0.3482300447492187
Ranks X_tt: [3, 7, 11, 18, 9, 3], Z_tt: [3, 8, 10, 7, 6, 3], 
      Y_tt: [1, 2, 2, 3, 2, 1], T_tt: None 


--- Predictor  step ---

	---Starting Block-ALS---
	Starting Sweep: 0
	Direction 1
	Residual inf
	TT-sol rank: [6, 16, 16, 16, 8, 2]
	Starting Sweep: 1
	Direction -1
	Residual 0.9664751265813363
	TT-sol rank: [2, 7, 14, 16, 16, 5]
	Starting Sweep: 2
	Direction 1
	Residual 0.02411797106710279
	TT-sol rank: [5, 16, 16, 16, 8, 2]
	Starting Sweep: 3
	Direction -1
	Residual 0.02411797106710279
	TT-sol rank: [2, 7, 14, 16, 16, 5]

	---Results---
	Solution rank is [ 2  7 14 16 16  5]
	Residual  0.02411797106710279
	Number of sweeps 4
	Time:  3.5344924926757812
	Time per sweep:  0.8836244344711304

Starting Eigen solve with:
 	 0.00022500000000000002 
 	 sweeps: 10
	Starting Sweep: 0
	Step size: 1.000000
	Direction: -1
	Residual inf
	TT-sol rank: [3, 4, 4, 6, 4, 2]
	Starting Sweep: 0
	Step size: 0.649801
	Direction: 1
	Residual 0
	TT-sol rank: [2, 4, 4, 6, 4, 3]
	Starting Sweep: 1
	Step size: 0.649801
	Direction: -1
	Residual 0
	TT-sol rank: [3, 4, 4, 6, 4, 2]
	 -----
	 Solution rank is [1 2 2 4 2 1]
	 Step size: 0.649801
	 Residual 0
	 Number of sweeps 2
	 Time:  0.028125286102294922
	 Time per sweep:  0.014065384864807129

Starting Eigen solve with:
 	 0.00022500000000000002 
 	 sweeps: 10
	Starting Sweep: 0
	Step size: 1.000000
	Direction: -1
	Residual inf
	TT-sol rank: [3, 4, 4, 5, 4, 2]
	Starting Sweep: 0
	Step size: 0.457623
	Direction: 1
	Residual 0
	TT-sol rank: [2, 4, 4, 6, 4, 3]
	Starting Sweep: 1
	Step size: 0.457623
	Direction: -1
	Residual 0
	TT-sol rank: [3, 4, 4, 5, 4, 2]
	 -----
	 Solution rank is [1 2 2 3 2 1]
	 Step size: 0.457623
	 Residual 0
	 Number of sweeps 2
	 Time:  0.032183170318603516
	 Time per sweep:  0.016094207763671875

--- Centering-Corrector  step ---

	---Starting Block-ALS---
	Starting Sweep: 0
	Direction 1
	Residual inf
	TT-sol rank: [6, 14, 16, 16, 8, 2]
	Starting Sweep: 1
	Direction -1
	Residual 0.9894234457316214
	TT-sol rank: [2, 7, 14, 16, 16, 5]
	Starting Sweep: 2
	Direction 1
	Residual 0.029264272496936215
	TT-sol rank: [5, 16, 16, 16, 8, 2]
	Starting Sweep: 3
	Direction -1
	Residual 0.029264272496936215
	TT-sol rank: [2, 7, 14, 16, 16, 5]

	---Results---
	Solution rank is [ 2  7 14 16 16  5]
	Residual  0.029264272496936215
	Number of sweeps 4
	Time:  3.500866651535034
	Time per sweep:  0.875217616558075

Starting Eigen solve with:
 	 0.00022500000000000002 
 	 sweeps: 10
	Starting Sweep: 0
	Step size: 1.000000
	Direction: -1
	Residual inf
	TT-sol rank: [3, 4, 4, 5, 4, 2]
	Starting Sweep: 0
	Step size: 0.457944
	Direction: 1
	Residual 0
	TT-sol rank: [2, 4, 4, 6, 4, 3]
	Starting Sweep: 1
	Step size: 0.457944
	Direction: -1
	Residual 0
	TT-sol rank: [3, 4, 4, 6, 4, 2]
	 -----
	 Solution rank is [1 2 2 4 2 1]
	 Step size: 0.457944
	 Residual 0
	 Number of sweeps 2
	 Time:  0.04341721534729004
	 Time per sweep:  0.02171146869659424

Starting Eigen solve with:
 	 0.00022500000000000002 
 	 sweeps: 10
	Starting Sweep: 0
	Step size: 1.000000
	Direction: -1
	Residual inf
	TT-sol rank: [3, 4, 4, 5, 4, 2]
	Starting Sweep: 0
	Step size: 0.475258
	Direction: 1
	Residual 0
	TT-sol rank: [2, 4, 4, 6, 4, 3]
	Starting Sweep: 1
	Step size: 0.475258
	Direction: -1
	Residual 0
	TT-sol rank: [3, 4, 4, 6, 4, 2]
	 -----
	 Solution rank is [1 2 2 4 2 1]
	 Step size: 0.475258
	 Residual 0
	 Number of sweeps 2
	 Time:  0.05641031265258789
	 Time per sweep:  0.028208255767822266
--- Step 8 ---
Step sizes: 0.42263486861886457, 0.43861398333189017

Results of iteration 8:
Finishing up: False
Inequality active: not in use
Is central: True, Is primal feasible:  True, Is dual feasible: False
Using AHO-Direction: True
Centrality Error: 6.848170741252538e-05
Primal-Dual Error: (np.float64(0.00033383638976308304), np.float64(0.0004527216544224571))
Sigma: 0.4192533138386424
Ranks X_tt: [3, 7, 11, 18, 9, 3], Z_tt: [3, 8, 12, 8, 6, 3], 
      Y_tt: [1, 2, 2, 3, 2, 1], T_tt: None 


--- Predictor  step ---

	---Starting Block-ALS---
	Starting Sweep: 0
	Direction 1
	Residual inf
	TT-sol rank: [6, 16, 16, 16, 8, 2]
	Starting Sweep: 1
	Direction -1
	Residual 0.9919290425351412
	TT-sol rank: [2, 8, 15, 16, 16, 5]
	Starting Sweep: 2
	Direction 1
	Residual 0.03276189297764014
	TT-sol rank: [5, 16, 16, 16, 8, 2]
	Starting Sweep: 3
	Direction -1
	Residual 0.012630253249302932
	TT-sol rank: [2, 8, 16, 16, 16, 5]

	---Results---
	Solution rank is [ 2  8 16 16 16  5]
	Residual  0.012630253249302932
	Number of sweeps 4
	Time:  5.244991302490234
	Time per sweep:  1.3112489581108093

Starting Eigen solve with:
 	 0.00022500000000000002 
 	 sweeps: 10
	Starting Sweep: 0
	Step size: 1.000000
	Direction: -1
	Residual inf
	TT-sol rank: [3, 4, 4, 6, 4, 2]
	Starting Sweep: 0
	Step size: 1.000000
	Direction: 1
	Residual 0
	TT-sol rank: [2, 4, 4, 6, 4, 3]
	 -----
	 Solution rank is [1 2 2 4 2 1]
	 Step size: 1.000000
	 Residual 0
	 Number of sweeps 2
	 Time:  0.02326822280883789
	 Time per sweep:  0.011636137962341309

Starting Eigen solve with:
 	 0.00022500000000000002 
 	 sweeps: 10
	Starting Sweep: 0
	Step size: 1.000000
	Direction: -1
	Residual inf
	TT-sol rank: [3, 4, 4, 6, 4, 2]
	Starting Sweep: 0
	Step size: 1.000000
	Direction: 1
	Residual 0
	TT-sol rank: [2, 4, 4, 6, 4, 3]
	 -----
	 Solution rank is [1 2 2 4 2 1]
	 Step size: 1.000000
	 Residual 0
	 Number of sweeps 2
	 Time:  0.02412557601928711
	 Time per sweep:  0.012064814567565918
--- Step 9 ---
Step sizes: 1.0, 1.0

Results of iteration 9:
Finishing up: True
Inequality active: not in use
Is central: True, Is primal feasible:  True, Is dual feasible: True
Using AHO-Direction: True
Centrality Error: 6.945299169603055e-05
Primal-Dual Error: (np.float64(0.00043811354266865346), np.float64(0.00010103174540835871))
Sigma: 0
Ranks X_tt: [3, 7, 11, 18, 9, 3], Z_tt: [3, 6, 6, 6, 5, 3], 
      Y_tt: [1, 2, 2, 3, 2, 1], T_tt: None 


--- Predictor  step ---

	---Starting Block-ALS---
	Starting Sweep: 0
	Direction 1
	Residual inf
	TT-sol rank: [5, 13, 16, 14, 6, 2]
	Starting Sweep: 1
	Direction -1
	Residual 10.106581959299298
	TT-sol rank: [2, 7, 14, 16, 12, 5]
	Starting Sweep: 2
	Direction 1
	Residual 0.08399813045427339
	TT-sol rank: [5, 15, 16, 16, 7, 2]
	Starting Sweep: 3
	Direction -1
	Residual 0.024265461320988394
	TT-sol rank: [2, 7, 14, 16, 13, 5]

	---Results---
	Solution rank is [ 2  7 14 16 13  5]
	Residual  0.024265461320988394
	Number of sweeps 4
	Time:  5.085189580917358
	Time per sweep:  1.2712984681129456

Starting Eigen solve with:
 	 0.00022500000000000002 
 	 sweeps: 10
	Starting Sweep: 0
	Step size: 1.000000
	Direction: -1
	Residual inf
	TT-sol rank: [3, 4, 4, 6, 4, 2]
	Starting Sweep: 0
	Step size: 1.000000
	Direction: 1
	Residual 0
	TT-sol rank: [2, 4, 4, 6, 4, 3]
	 -----
	 Solution rank is [1 2 2 4 2 1]
	 Step size: 1.000000
	 Residual 0
	 Number of sweeps 2
	 Time:  0.05367851257324219
	 Time per sweep:  0.02684175968170166

Starting Eigen solve with:
 	 0.00022500000000000002 
 	 sweeps: 10
	Starting Sweep: 0
	Step size: 1.000000
	Direction: -1
	Residual inf
	TT-sol rank: [3, 4, 4, 6, 4, 2]
	Starting Sweep: 0
	Step size: 1.000000
	Direction: 1
	Residual 0
	TT-sol rank: [2, 4, 4, 6, 4, 3]
	 -----
	 Solution rank is [1 2 2 4 2 1]
	 Step size: 1.000000
	 Residual 0
	 Number of sweeps 2
	 Time:  0.04248523712158203
	 Time per sweep:  0.02124500274658203
--- Step 10 ---
Step sizes: 1.0, 1.0

Results of iteration 10:
Finishing up: True
Inequality active: not in use
Is central: True, Is primal feasible:  True, Is dual feasible: True
Using AHO-Direction: True
Centrality Error: 3.085595924571154e-08
Primal-Dual Error: (np.float64(0.00010257475134776128), np.float64(7.687040806958328e-06))
Sigma: 0
Ranks X_tt: [2, 5, 8, 14, 8, 2], Z_tt: [2, 5, 5, 5, 4, 2], 
      Y_tt: [1, 2, 2, 3, 2, 1], T_tt: None 


--- Predictor  step ---

	---Starting Block-ALS---
	Starting Sweep: 0
	Direction 1
	Residual inf
	TT-sol rank: [5, 10, 15, 16, 7, 2]
	Starting Sweep: 1
	Direction -1
	Residual 1.6529637899637544
	TT-sol rank: [2, 8, 15, 16, 14, 5]
	Starting Sweep: 2
	Direction 1
	Residual 0.06741137665905822
	TT-sol rank: [5, 16, 16, 16, 7, 2]
	Starting Sweep: 3
	Direction -1
	Residual 0.038508845060827045
	TT-sol rank: [2, 8, 14, 16, 14, 5]

	---Results---
	Solution rank is [ 2  8 14 16 14  5]
	Residual  0.038508845060827045
	Number of sweeps 4
	Time:  3.8128020763397217
	Time per sweep:  0.9532020092010498

Starting Eigen solve with:
 	 0.00022500000000000002 
 	 sweeps: 10
	Starting Sweep: 0
	Step size: 1.000000
	Direction: -1
	Residual inf
	TT-sol rank: [3, 4, 4, 6, 4, 2]
	Starting Sweep: 0
	Step size: 1.000000
	Direction: 1
	Residual 0
	TT-sol rank: [2, 4, 4, 4, 4, 3]
	 -----
	 Solution rank is [1 2 2 4 2 1]
	 Step size: 1.000000
	 Residual 0
	 Number of sweeps 2
	 Time:  0.023822307586669922
	 Time per sweep:  0.011912941932678223

Starting Eigen solve with:
 	 0.00022500000000000002 
 	 sweeps: 10
	Starting Sweep: 0
	Step size: 1.000000
	Direction: -1
	Residual inf
	TT-sol rank: [3, 4, 4, 6, 4, 2]
	Starting Sweep: 0
	Step size: 1.000000
	Direction: 1
	Residual 0
	TT-sol rank: [2, 4, 4, 6, 4, 3]
	 -----
	 Solution rank is [1 2 2 4 2 1]
	 Step size: 1.000000
	 Residual 0
	 Number of sweeps 2
	 Time:  0.024152755737304688
	 Time per sweep:  0.012078523635864258
--- Step 11 ---
Step sizes: 1.0, 1.0
---Terminated---
Converged in 11 iterations.
Ranks X_tt: [1, 4, 7, 13, 7, 2], Z_tt: [2, 5, 5, 5, 4, 2], 
      Y_tt: [1, 2, 2, 3, 2, 1], T_tt: None 

Converged after 11.0 iterations
Problem created in 0.003s
Problem solved in 40.961s
Complementary Slackness: 7.047083977368528e-06
Total feasibility error: 1.607665040978178e-09
--- Run Summary ---
Converged after avg 11.0 iterations
Problem created in avg 0.003s
Problem solved in avg 40.961s
Complementary Slackness avg: 7.047083977368528e-06
Total feasibility error avg: 1.607665040978178e-09
✅ Completed dim=7 successfully

==== All runs completed at Thu Jun  5 03:07:10 PM BST 2025 ====
