==== maxcut TT-IPM Batch Run Started at Wed May 21 12:20:17 PM BST 2025 ====

▶ Running dim=7 with config=configs/maxcut_7.yaml at Wed May 21 12:20:17 PM BST 2025
Seed:  5

Results of iteration 0:
Finishing up: False
Is central: False, Is primal feasible:  False, Is dual feasible: False
Using AHO-Direction: True
Centrality Error: 1.1195992179751186
Primal-Dual Error: (np.float64(9.47612892736652), np.float64(64.44309769676643))
Sigma: 0.5
Ranks X_tt: [1, 1, 1, 1, 1, 1], Z_tt: [1, 1, 1, 1, 1, 1], 
      Y_tt: [1, 1, 1, 1, 1, 1], T_tt: None 

--- Step 1 ---
--- Predictor  step ---
	Starting Sweep:
	Max num of sweeps: 0
	Direction 1
	Residual inf
	TT-sol rank: [3, 3, 3, 3, 3, 3]
	Starting Sweep:
	Max num of sweeps: 1
	Direction -1
	Residual 1.025025148110485
	TT-sol rank: [2, 2, 2, 2, 2, 2]
	Starting Sweep:
	Max num of sweeps: 2
	Direction 1
	Residual 4.555238793174324e-05
	TT-sol rank: [2, 3, 3, 3, 2, 2]

	---Results---
	Solution rank is [2 3 3 3 2 2]
	Residual  4.555238793174324e-05
	Number of sweeps 3
	Time:  0.10919785499572754
	Time per sweep:  0.036400397618611656

Starting Eigen solve with:
 	 0.00030000000000000003 
 	 sweeps: 10
	Starting Sweep: 0
	Step size: 1.000000
	Direction: -1
	Residual inf
	TT-sol rank: [4, 6, 10, 8, 4, 2]
	 -----
	 Solution rank is [1 2 2 3 2 1]
	 Step size: 1.000000
	 Residual 0
	 Number of sweeps 1
	 Time:  0.016998291015625
	 Time per sweep:  0.017001628875732422

Starting Eigen solve with:
 	 0.00030000000000000003 
 	 sweeps: 10
	Starting Sweep: 0
	Step size: 1.000000
	Direction: -1
	Residual inf
	TT-sol rank: [4, 6, 10, 8, 4, 2]
	 -----
	 Solution rank is [1 2 2 3 2 1]
	 Step size: 1.000000
	 Residual 0
	 Number of sweeps 1
	 Time:  0.010344505310058594
	 Time per sweep:  0.010347843170166016

--- Centering-Corrector  step ---
	Starting Sweep:
	Max num of sweeps: 0
	Direction -1
	Residual inf
	TT-sol rank: [4, 9, 9, 9, 6, 6]
	Starting Sweep:
	Max num of sweeps: 1
	Direction 1
	Residual 20.559140707016283
	TT-sol rank: [3, 3, 3, 3, 3, 2]
	Starting Sweep:
	Max num of sweeps: 2
	Direction -1
	Residual 4.9261445441221365e-05
	TT-sol rank: [2, 3, 3, 3, 3, 3]

	---Results---
	Solution rank is [2 3 3 3 3 3]
	Residual  4.9261445441221365e-05
	Number of sweeps 3
	Time:  0.15992188453674316
	Time per sweep:  0.053308725357055664

Starting Eigen solve with:
 	 0.00030000000000000003 
 	 sweeps: 10
	Starting Sweep: 0
	Step size: 1.000000
	Direction: -1
	Residual inf
	TT-sol rank: [3, 4, 4, 5, 4, 2]
	 -----
	 Solution rank is [1 2 2 3 2 1]
	 Step size: 0.545951
	 Residual 0
	 Number of sweeps 1
	 Time:  0.02089238166809082
	 Time per sweep:  0.020898103713989258

Starting Eigen solve with:
 	 0.00030000000000000003 
 	 sweeps: 10
	Starting Sweep: 0
	Step size: 1.000000
	Direction: -1
	Residual inf
	TT-sol rank: [3, 4, 4, 5, 4, 2]
	 -----
	 Solution rank is [1 2 2 2 2 1]
	 Step size: 1.000000
	 Residual 0
	 Number of sweeps 1
	 Time:  0.011197090148925781
	 Time per sweep:  0.011209726333618164
Step sizes: 0.5062594738835883, 1.0

Results of iteration 1:
Finishing up: False
Is central: False, Is primal feasible:  False, Is dual feasible: False
Using AHO-Direction: False
Centrality Error: 0.7525952232883599
Primal-Dual Error: (np.float64(0.1185752101788912), np.float64(64.44269426635435))
Sigma: 0.0005231360786196221
Ranks X_tt: [3, 5, 5, 4, 4, 3], Z_tt: [3, 3, 3, 3, 3, 3], 
      Y_tt: [1, 2, 2, 2, 2, 1], T_tt: None 

--- Step 2 ---
--- Predictor  step ---
	Starting Sweep:
	Max num of sweeps: 0
	Direction 1
	Residual inf
	TT-sol rank: [3, 5, 4, 4, 3, 2]
	Starting Sweep:
	Max num of sweeps: 1
	Direction -1
	Residual 6.264530747668582
	TT-sol rank: [2, 3, 3, 4, 3, 3]
	Starting Sweep:
	Max num of sweeps: 2
	Direction 1
	Residual 8.340238270247754e-05
	TT-sol rank: [3, 4, 4, 4, 3, 2]

	---Results---
	Solution rank is [3 4 4 4 3 2]
	Residual  8.340238270247754e-05
	Number of sweeps 3
	Time:  0.15281367301940918
	Time per sweep:  0.05093940099080404

Starting Eigen solve with:
 	 0.00030000000000000003 
 	 sweeps: 10
	Starting Sweep: 0
	Step size: 1.000000
	Direction: -1
	Residual inf
	TT-sol rank: [3, 4, 4, 5, 4, 2]
	 -----
	 Solution rank is [1 2 2 2 2 1]
	 Step size: 1.000000
	 Residual 0
	 Number of sweeps 1
	 Time:  0.015186786651611328
	 Time per sweep:  0.01519012451171875

Starting Eigen solve with:
 	 0.00030000000000000003 
 	 sweeps: 10
	Starting Sweep: 0
	Step size: 1.000000
	Direction: -1
	Residual inf
	TT-sol rank: [3, 4, 4, 4, 4, 2]
	 -----
	 Solution rank is [1 2 2 3 2 1]
	 Step size: 0.867158
	 Residual 0
	 Number of sweeps 1
	 Time:  0.015703439712524414
	 Time per sweep:  0.01570725440979004

--- Centering-Corrector  step ---
	Starting Sweep:
	Max num of sweeps: 0
	Direction -1
	Residual inf
	TT-sol rank: [4, 12, 12, 12, 9, 6]
	Starting Sweep:
	Max num of sweeps: 1
	Direction 1
	Residual 47.922090244374964
	TT-sol rank: [4, 7, 6, 5, 4, 2]
	Starting Sweep:
	Max num of sweeps: 2
	Direction -1
	Residual 0.00020933991359879932
	TT-sol rank: [2, 4, 4, 4, 4, 4]
	Starting Sweep:
	Max num of sweeps: 3
	Direction 1
	Residual 7.58709305928695e-05
	TT-sol rank: [4, 5, 5, 5, 4, 2]

	---Results---
	Solution rank is [4 5 5 5 4 2]
	Residual  7.58709305928695e-05
	Number of sweeps 4
	Time:  0.24186968803405762
	Time per sweep:  0.06046855449676514

Starting Eigen solve with:
 	 0.00030000000000000003 
 	 sweeps: 10
	Starting Sweep: 0
	Step size: 1.000000
	Direction: -1
	Residual inf
	TT-sol rank: [3, 4, 4, 4, 4, 2]
	 -----
	 Solution rank is [1 2 2 3 2 1]
	 Step size: 1.000000
	 Residual 0
	 Number of sweeps 1
	 Time:  0.013356924057006836
	 Time per sweep:  0.013361215591430664

Starting Eigen solve with:
 	 0.00030000000000000003 
 	 sweeps: 10
	Starting Sweep: 0
	Step size: 1.000000
	Direction: -1
	Residual inf
	TT-sol rank: [3, 4, 4, 5, 4, 2]
	 -----
	 Solution rank is [1 2 2 4 2 1]
	 Step size: 0.434476
	 Residual 0
	 Number of sweeps 1
	 Time:  0.017328500747680664
	 Time per sweep:  0.01733231544494629
Step sizes: 1.0, 0.40046717083530886

Results of iteration 2:
Finishing up: False
Is central: False, Is primal feasible:  False, Is dual feasible: False
Using AHO-Direction: False
Centrality Error: 0.06341463191998735
Primal-Dual Error: (np.float64(0.1186291461539364), np.float64(12.827941061544681))
Sigma: 0.004767036841865563
Ranks X_tt: [3, 6, 5, 5, 5, 3], Z_tt: [3, 5, 5, 6, 5, 3], 
      Y_tt: [1, 2, 2, 2, 2, 1], T_tt: None 

--- Step 3 ---
--- Predictor  step ---
	Starting Sweep:
	Max num of sweeps: 0
	Direction -1
	Residual inf
	TT-sol rank: [4, 12, 15, 15, 12, 6]
	Starting Sweep:
	Max num of sweeps: 1
	Direction 1
	Residual 350.5697772846976
	TT-sol rank: [5, 11, 11, 7, 5, 2]
	Starting Sweep:
	Max num of sweeps: 2
	Direction -1
	Residual 0.00017171091147724017
	TT-sol rank: [2, 5, 7, 9, 8, 5]
	Starting Sweep:
	Max num of sweeps: 3
	Direction 1
	Residual 6.229046106549556e-05
	TT-sol rank: [5, 9, 10, 6, 5, 2]

	---Results---
	Solution rank is [ 5  9 10  6  5  2]
	Residual  6.229046106549556e-05
	Number of sweeps 4
	Time:  0.2072315216064453
	Time per sweep:  0.05180889368057251

Starting Eigen solve with:
 	 0.00030000000000000003 
 	 sweeps: 10
	Starting Sweep: 0
	Step size: 1.000000
	Direction: -1
	Residual inf
	TT-sol rank: [3, 4, 4, 5, 4, 2]
	 -----
	 Solution rank is [1 2 2 3 2 1]
	 Step size: 1.000000
	 Residual 0
	 Number of sweeps 1
	 Time:  0.02579498291015625
	 Time per sweep:  0.025798797607421875

Starting Eigen solve with:
 	 0.00030000000000000003 
 	 sweeps: 10
	Starting Sweep: 0
	Step size: 1.000000
	Direction: -1
	Residual inf
	TT-sol rank: [3, 4, 4, 6, 4, 2]
	 -----
	 Solution rank is [1 2 2 4 2 1]
	 Step size: 1.000000
	 Residual 0
	 Number of sweeps 1
	 Time:  0.02590489387512207
	 Time per sweep:  0.025908708572387695

--- Centering-Corrector  step ---

Starting MM solve with:
 	 0.0004 
 	 sweeps: 20
	Starting Sweep: 0
	Direction: -1
	Residual inf
	TT-sol rank: [4, 4, 4, 4, 4, 4]
	Starting Sweep: 0
	Direction: 1
	Residual 163.68251173973252
	TT-sol rank: [4, 6, 6, 6, 6, 4]
	Starting Sweep: 1
	Direction: -1
	Residual 0.005536362962419306
	TT-sol rank: [4, 7, 8, 6, 6, 4]
	Starting Sweep: 1
	Direction: 1
	Residual 0.0026571149291065195
	TT-sol rank: [4, 7, 9, 7, 7, 4]
	Starting Sweep: 2
	Direction: -1
	Residual 0.0003962018986013127
	TT-sol rank: [4, 7, 9, 7, 7, 4]
	 -----
	 Solution rank is [2 5 7 5 5 2]
	 Residual 3.969276278204231e-05
	 Number of sweeps 3
	 Time:  0.034406185150146484
	 Time per sweep:  0.011469761530558268
	Starting Sweep:
	Max num of sweeps: 0
	Direction -1
	Residual inf
	TT-sol rank: [4, 12, 15, 15, 15, 6]
	Starting Sweep:
	Max num of sweeps: 1
	Direction 1
	Residual 51.6144035041627
	TT-sol rank: [5, 10, 11, 8, 5, 2]
	Starting Sweep:
	Max num of sweeps: 2
	Direction -1
	Residual 0.0002225584533818789
	TT-sol rank: [2, 5, 8, 9, 9, 5]
	Starting Sweep:
	Max num of sweeps: 3
	Direction 1
	Residual 5.6507947672928866e-05
	TT-sol rank: [5, 9, 10, 6, 5, 2]

	---Results---
	Solution rank is [ 5  9 10  6  5  2]
	Residual  5.6507947672928866e-05
	Number of sweeps 4
	Time:  0.5239031314849854
	Time per sweep:  0.13097703456878662

Starting Eigen solve with:
 	 0.00030000000000000003 
 	 sweeps: 10
	Starting Sweep: 0
	Step size: 1.000000
	Direction: -1
	Residual inf
	TT-sol rank: [3, 4, 4, 5, 4, 2]
	 -----
	 Solution rank is [1 2 2 3 2 1]
	 Step size: 1.000000
	 Residual 0
	 Number of sweeps 1
	 Time:  0.013103961944580078
	 Time per sweep:  0.013107538223266602

Starting Eigen solve with:
 	 0.00030000000000000003 
 	 sweeps: 10
	Starting Sweep: 0
	Step size: 1.000000
	Direction: -1
	Residual inf
	TT-sol rank: [3, 4, 4, 6, 4, 2]
	 -----
	 Solution rank is [1 2 2 4 2 1]
	 Step size: 0.507002
	 Residual 0
	 Number of sweeps 1
	 Time:  0.016366243362426758
	 Time per sweep:  0.01636981964111328
Step sizes: 1.0, 0.46915409496614724

Results of iteration 3:
Finishing up: False
Is central: False, Is primal feasible:  False, Is dual feasible: False
Using AHO-Direction: True
Centrality Error: 0.007497739634495033
Primal-Dual Error: (np.float64(0.11855446510433043), np.float64(0.7909409010749585))
Sigma: 0.0010378705171342846
Ranks X_tt: [3, 7, 9, 7, 6, 3], Z_tt: [3, 7, 11, 8, 6, 3], 
      Y_tt: [1, 2, 2, 3, 2, 1], T_tt: None 

--- Step 4 ---
--- Predictor  step ---
	Starting Sweep:
	Max num of sweeps: 0
	Direction -1
	Residual inf
	TT-sol rank: [4, 12, 15, 15, 15, 6]
	Starting Sweep:
	Max num of sweeps: 1
	Direction 1
	Residual 611.6674911217239
	TT-sol rank: [5, 20, 22, 16, 8, 2]
	Starting Sweep:
	Max num of sweeps: 2
	Direction -1
	Residual 0.0021978530292549796
	TT-sol rank: [2, 7, 13, 21, 13, 5]
	Starting Sweep:
	Max num of sweeps: 3
	Direction 1
	Residual 5.425564267628433e-05
	TT-sol rank: [5, 14, 20, 17, 7, 2]

	---Results---
	Solution rank is [ 5 14 20 17  7  2]
	Residual  5.425564267628433e-05
	Number of sweeps 4
	Time:  1.4607901573181152
	Time per sweep:  0.36519867181777954

Starting Eigen solve with:
 	 0.00030000000000000003 
 	 sweeps: 10
	Starting Sweep: 0
	Step size: 1.000000
	Direction: -1
	Residual inf
	TT-sol rank: [3, 4, 4, 5, 4, 2]
	 -----
	 Solution rank is [1 2 2 3 2 1]
	 Step size: 1.000000
	 Residual 0
	 Number of sweeps 1
	 Time:  0.013308048248291016
	 Time per sweep:  0.013311624526977539

Starting Eigen solve with:
 	 0.00030000000000000003 
 	 sweeps: 10
	Starting Sweep: 0
	Step size: 1.000000
	Direction: -1
	Residual inf
	TT-sol rank: [3, 4, 4, 6, 4, 2]
	 -----
	 Solution rank is [1 2 2 4 2 1]
	 Step size: 0.511692
	 Residual 0
	 Number of sweeps 1
	 Time:  0.014913797378540039
	 Time per sweep:  0.014917373657226562

--- Centering-Corrector  step ---
	Starting Sweep:
	Max num of sweeps: 0
	Direction -1
	Residual inf
	TT-sol rank: [4, 12, 15, 15, 15, 6]
	Starting Sweep:
	Max num of sweeps: 1
	Direction 1
	Residual 57.30974008029903
	TT-sol rank: [5, 21, 22, 17, 8, 2]
	Starting Sweep:
	Max num of sweeps: 2
	Direction -1
	Residual 0.0034365593066134578
	TT-sol rank: [2, 7, 13, 21, 13, 5]
	Starting Sweep:
	Max num of sweeps: 3
	Direction 1
	Residual 5.869238366537114e-05
	TT-sol rank: [5, 14, 20, 17, 7, 2]

	---Results---
	Solution rank is [ 5 14 20 17  7  2]
	Residual  5.869238366537114e-05
	Number of sweeps 4
	Time:  0.5408391952514648
	Time per sweep:  0.13521075248718262

Starting Eigen solve with:
 	 0.00030000000000000003 
 	 sweeps: 10
	Starting Sweep: 0
	Step size: 1.000000
	Direction: -1
	Residual inf
	TT-sol rank: [3, 4, 4, 5, 4, 2]
	 -----
	 Solution rank is [1 2 2 3 2 1]
	 Step size: 1.000000
	 Residual 0
	 Number of sweeps 1
	 Time:  0.01168060302734375
	 Time per sweep:  0.011683464050292969

Starting Eigen solve with:
 	 0.00030000000000000003 
 	 sweeps: 10
	Starting Sweep: 0
	Step size: 1.000000
	Direction: -1
	Residual inf
	TT-sol rank: [3, 4, 4, 6, 4, 2]
	 -----
	 Solution rank is [1 2 2 4 2 1]
	 Step size: 0.330800
	 Residual 0
	 Number of sweeps 1
	 Time:  0.014274120330810547
	 Time per sweep:  0.014277219772338867
Step sizes: 1.0, 0.30319162676930395

Results of iteration 4:
Finishing up: False
Is central: False, Is primal feasible:  False, Is dual feasible: False
Using AHO-Direction: True
Centrality Error: 0.00341368722729521
Primal-Dual Error: (np.float64(0.11861714164535016), np.float64(0.31073154393545316))
Sigma: 0.5182072366168033
Ranks X_tt: [3, 8, 14, 16, 8, 3], Z_tt: [3, 7, 11, 9, 6, 3], 
      Y_tt: [1, 2, 2, 3, 2, 1], T_tt: None 

--- Step 5 ---
--- Predictor  step ---
	Starting Sweep:
	Max num of sweeps: 0
	Direction -1
	Residual inf
	TT-sol rank: [4, 12, 15, 15, 15, 6]
	Starting Sweep:
	Max num of sweeps: 1
	Direction 1
	Residual 69.49045440242249
	TT-sol rank: [5, 19, 20, 18, 8, 2]
	Starting Sweep:
	Max num of sweeps: 2
	Direction -1
	Residual 0.054807230999574894
	TT-sol rank: [2, 7, 13, 20, 12, 5]
	Starting Sweep:
	Max num of sweeps: 3
	Direction 1
	Residual 0.00047514935567639194
	TT-sol rank: [5, 10, 15, 20, 8, 2]
	Starting Sweep:
	Max num of sweeps: 4
	Direction -1
	Residual 0.000493575741374734
	TT-sol rank: [2, 7, 13, 22, 12, 5]
	Starting Sweep:
	Max num of sweeps: 5
	Direction 1
	Residual 0.0004129301954785685
	TT-sol rank: [5, 10, 15, 21, 8, 2]

	---Results---
	Solution rank is [ 5 10 15 21  8  2]
	Residual  0.0004129301954785685
	Number of sweeps 6
	Time:  1.789325475692749
	Time per sweep:  0.2982221047083537

Starting Eigen solve with:
 	 0.00030000000000000003 
 	 sweeps: 10
	Starting Sweep: 0
	Step size: 1.000000
	Direction: -1
	Residual inf
	TT-sol rank: [3, 4, 4, 5, 4, 2]
	 -----
	 Solution rank is [1 2 2 3 2 1]
	 Step size: 1.000000
	 Residual 0
	 Number of sweeps 1
	 Time:  0.01354217529296875
	 Time per sweep:  0.013546228408813477

Starting Eigen solve with:
 	 0.00030000000000000003 
 	 sweeps: 10
	Starting Sweep: 0
	Step size: 1.000000
	Direction: -1
	Residual inf
	TT-sol rank: [3, 4, 4, 6, 4, 2]
	 -----
	 Solution rank is [1 2 2 3 2 1]
	 Step size: 0.161411
	 Residual 0
	 Number of sweeps 1
	 Time:  0.015033721923828125
	 Time per sweep:  0.01503753662109375

--- Centering-Corrector  step ---

Starting MM solve with:
 	 0.0004 
 	 sweeps: 20
	Starting Sweep: 0
	Direction: -1
	Residual inf
	TT-sol rank: [4, 4, 4, 4, 4, 4]
	Starting Sweep: 0
	Direction: 1
	Residual 146.63081326166943
	TT-sol rank: [4, 6, 6, 6, 6, 4]
	Starting Sweep: 1
	Direction: -1
	Residual 0.16085917690960677
	TT-sol rank: [4, 8, 8, 8, 8, 4]
	Starting Sweep: 1
	Direction: 1
	Residual 0.04093761873684092
	TT-sol rank: [4, 8, 10, 10, 9, 4]
	Starting Sweep: 2
	Direction: -1
	Residual 0.014511354586860514
	TT-sol rank: [4, 8, 11, 12, 9, 4]
	Starting Sweep: 2
	Direction: 1
	Residual 0.007754003626417769
	TT-sol rank: [4, 8, 11, 14, 10, 4]
	Starting Sweep: 3
	Direction: -1
	Residual 0.00153044622543081
	TT-sol rank: [4, 8, 11, 15, 10, 4]
	Starting Sweep: 3
	Direction: 1
	Residual 0.0020792428511566467
	TT-sol rank: [4, 8, 12, 16, 10, 4]
	Starting Sweep: 4
	Direction: -1
	Residual 0.00036517199242546485
	TT-sol rank: [4, 8, 12, 16, 10, 4]
	 -----
	 Solution rank is [ 2  6 10 14  8  2]
	 Residual 0.0001273469784046931
	 Number of sweeps 5
	 Time:  0.06477189064025879
	 Time per sweep:  0.012954998016357421
	Starting Sweep:
	Max num of sweeps: 0
	Direction -1
	Residual inf
	TT-sol rank: [4, 12, 15, 15, 15, 6]
	Starting Sweep:
	Max num of sweeps: 1
	Direction 1
	Residual 80.16471405733287
	TT-sol rank: [4, 17, 19, 16, 8, 2]
	Starting Sweep:
	Max num of sweeps: 2
	Direction -1
	Residual 0.18239828323476615
	TT-sol rank: [2, 6, 11, 17, 10, 4]
	Starting Sweep:
	Max num of sweeps: 3
	Direction 1
	Residual 0.001835304748053784
	TT-sol rank: [4, 7, 12, 17, 8, 2]
	Starting Sweep:
	Max num of sweeps: 4
	Direction -1
	Residual 0.0029304831701371563
	TT-sol rank: [2, 6, 11, 18, 10, 4]
	Starting Sweep:
	Max num of sweeps: 5
	Direction 1
	Residual 0.0018825524167767151
	TT-sol rank: [4, 7, 12, 17, 8, 2]

	---Results---
	Solution rank is [ 4  7 12 17  8  2]
	Residual  0.0018825524167767151
	Number of sweeps 6
	Time:  1.8145952224731445
	Time per sweep:  0.30243321259816486

Starting Eigen solve with:
 	 0.00030000000000000003 
 	 sweeps: 10
	Starting Sweep: 0
	Step size: 1.000000
	Direction: -1
	Residual inf
	TT-sol rank: [3, 4, 4, 5, 4, 2]
	 -----
	 Solution rank is [1 2 2 4 2 1]
	 Step size: 0.491614
	 Residual 0
	 Number of sweeps 1
	 Time:  0.017670869827270508
	 Time per sweep:  0.01767420768737793

Starting Eigen solve with:
 	 0.00030000000000000003 
 	 sweeps: 10
	Starting Sweep: 0
	Step size: 1.000000
	Direction: -1
	Residual inf
	TT-sol rank: [3, 4, 4, 5, 4, 2]
	 -----
	 Solution rank is [1 2 2 4 2 1]
	 Step size: 0.482524
	 Residual 0
	 Number of sweeps 1
	 Time:  0.01842045783996582
	 Time per sweep:  0.018423795700073242
Step sizes: 0.4543129611674756, 0.44591307574062794

Results of iteration 5:
Finishing up: False
Is central: False, Is primal feasible:  False, Is dual feasible: False
Using AHO-Direction: True
Centrality Error: 0.0011295952125435376
Primal-Dual Error: (np.float64(0.010907813810073604), np.float64(0.03301379214385008))
Sigma: 0.6214209320702158
Ranks X_tt: [3, 8, 13, 19, 9, 3], Z_tt: [3, 7, 12, 16, 8, 3], 
      Y_tt: [1, 2, 2, 3, 2, 1], T_tt: None 

--- Step 6 ---
--- Predictor  step ---
	Starting Sweep:
	Max num of sweeps: 0
	Direction -1
	Residual inf
	TT-sol rank: [4, 11, 15, 15, 15, 6]
	Starting Sweep:
	Max num of sweeps: 1
	Direction 1
	Residual 6958.442067353054
	TT-sol rank: [5, 18, 22, 17, 8, 2]
	Starting Sweep:
	Max num of sweeps: 2
	Direction -1
	Residual 1.0713799427655573
	TT-sol rank: [2, 7, 12, 19, 11, 4]
	Starting Sweep:
	Max num of sweeps: 3
	Direction 1
	Residual 0.019367412780889746
	TT-sol rank: [4, 9, 14, 19, 8, 2]
	Starting Sweep:
	Max num of sweeps: 4
	Direction -1
	Residual 0.01889176626784232
	TT-sol rank: [2, 7, 12, 21, 11, 4]
	Starting Sweep:
	Max num of sweeps: 5
	Direction 1
	Residual 0.014962438342019687
	TT-sol rank: [4, 9, 14, 21, 8, 2]

	---Results---
	Solution rank is [ 4  9 14 21  8  2]
	Residual  0.014962438342019687
	Number of sweeps 6
	Time:  3.72182035446167
	Time per sweep:  0.6203039487202963

Starting Eigen solve with:
 	 0.00030000000000000003 
 	 sweeps: 10
	Starting Sweep: 0
	Step size: 1.000000
	Direction: -1
	Residual inf
	TT-sol rank: [3, 4, 4, 5, 4, 2]
	 -----
	 Solution rank is [1 2 2 4 2 1]
	 Step size: 0.993608
	 Residual 0
	 Number of sweeps 1
	 Time:  0.01715993881225586
	 Time per sweep:  0.01716327667236328

Starting Eigen solve with:
 	 0.00030000000000000003 
 	 sweeps: 10
	Starting Sweep: 0
	Step size: 1.000000
	Direction: -1
	Residual inf
	TT-sol rank: [3, 4, 4, 6, 4, 2]
	 -----
	 Solution rank is [1 2 2 4 2 1]
	 Step size: 0.476361
	 Residual 0
	 Number of sweeps 1
	 Time:  0.014046669006347656
	 Time per sweep:  0.01405024528503418

--- Centering-Corrector  step ---

Starting MM solve with:
 	 0.0004 
 	 sweeps: 20
	Starting Sweep: 0
	Direction: -1
	Residual inf
	TT-sol rank: [4, 4, 4, 4, 4, 4]
	Starting Sweep: 0
	Direction: 1
	Residual 1342.9548750098536
	TT-sol rank: [3, 6, 6, 6, 6, 4]
	Starting Sweep: 1
	Direction: -1
	Residual 0.2472562681243254
	TT-sol rank: [4, 8, 8, 8, 7, 4]
	Starting Sweep: 1
	Direction: 1
	Residual 0.04878149080915484
	TT-sol rank: [4, 8, 10, 10, 9, 4]
	Starting Sweep: 2
	Direction: -1
	Residual 0.019792158889226207
	TT-sol rank: [4, 8, 11, 12, 10, 4]
	Starting Sweep: 2
	Direction: 1
	Residual 0.014786582107884578
	TT-sol rank: [4, 8, 12, 14, 10, 4]
	Starting Sweep: 3
	Direction: -1
	Residual 0.007630605026089183
	TT-sol rank: [4, 8, 12, 16, 10, 4]
	Starting Sweep: 3
	Direction: 1
	Residual 0.002963732066284767
	TT-sol rank: [4, 8, 12, 18, 10, 4]
	Starting Sweep: 4
	Direction: -1
	Residual 0.002050728031339832
	TT-sol rank: [4, 8, 12, 19, 10, 4]
	Starting Sweep: 4
	Direction: 1
	Residual 0.0008787301874345642
	TT-sol rank: [4, 8, 12, 20, 10, 4]
	Starting Sweep: 5
	Direction: -1
	Residual 0.00041652415645607735
	TT-sol rank: [4, 8, 12, 20, 10, 4]
	Starting Sweep: 5
	Direction: 1
	Residual 0.00032309560609223073
	TT-sol rank: [4, 8, 12, 21, 10, 4]
	 -----
	 Solution rank is [ 2  6 10 19  8  2]
	 Residual 0.0001440045289417814
	 Number of sweeps 7
	 Time:  0.07285380363464355
	 Time per sweep:  0.010408129010881697
	Starting Sweep:
	Max num of sweeps: 0
	Direction -1
	Residual inf
	TT-sol rank: [4, 12, 15, 15, 15, 6]
	Starting Sweep:
	Max num of sweeps: 1
	Direction 1
	Residual 2356.861345778233
	TT-sol rank: [5, 20, 22, 17, 8, 2]
	Starting Sweep:
	Max num of sweeps: 2
	Direction -1
	Residual 0.5401018852556224
	TT-sol rank: [2, 7, 12, 19, 11, 4]
	Starting Sweep:
	Max num of sweeps: 3
	Direction 1
	Residual 0.018622711484650074
	TT-sol rank: [4, 9, 14, 19, 8, 2]
	Starting Sweep:
	Max num of sweeps: 4
	Direction -1
	Residual 0.019954456776801487
	TT-sol rank: [2, 7, 12, 20, 11, 4]
	Starting Sweep:
	Max num of sweeps: 5
	Direction 1
	Residual 0.01632571045962424
	TT-sol rank: [4, 9, 14, 20, 8, 2]

	---Results---
	Solution rank is [ 4  9 14 20  8  2]
	Residual  0.01632571045962424
	Number of sweeps 6
	Time:  3.298502206802368
	Time per sweep:  0.5497511625289917

Starting Eigen solve with:
 	 0.00030000000000000003 
 	 sweeps: 10
	Starting Sweep: 0
	Step size: 1.000000
	Direction: -1
	Residual inf
	TT-sol rank: [3, 4, 4, 6, 4, 2]
	 -----
	 Solution rank is [1 2 2 4 2 1]
	 Step size: 0.547457
	 Residual 0
	 Number of sweeps 1
	 Time:  0.01604008674621582
	 Time per sweep:  0.016043901443481445

Starting Eigen solve with:
 	 0.00030000000000000003 
 	 sweeps: 10
	Starting Sweep: 0
	Step size: 1.000000
	Direction: -1
	Residual inf
	TT-sol rank: [3, 4, 4, 6, 4, 2]
	 -----
	 Solution rank is [1 2 2 4 2 1]
	 Step size: 0.344642
	 Residual 0
	 Number of sweeps 1
	 Time:  0.014773130416870117
	 Time per sweep:  0.014776468276977539
Step sizes: 0.5021452586321274, 0.31611689420964856

Results of iteration 6:
Finishing up: False
Is central: True, Is primal feasible:  True, Is dual feasible: False
Using AHO-Direction: False
Centrality Error: 0.00015855202490528778
Primal-Dual Error: (np.float64(0.00017392348827591572), np.float64(0.01151358480340091))
Sigma: 0.18650156352153746
Ranks X_tt: [3, 7, 11, 20, 9, 3], Z_tt: [3, 7, 12, 15, 8, 3], 
      Y_tt: [1, 2, 2, 3, 2, 1], T_tt: None 

--- Step 7 ---
--- Predictor  step ---
	Starting Sweep:
	Max num of sweeps: 0
	Direction -1
	Residual inf
	TT-sol rank: [4, 12, 15, 15, 15, 6]
	Starting Sweep:
	Max num of sweeps: 1
	Direction 1
	Residual 871971.8984802042
	TT-sol rank: [5, 21, 24, 23, 8, 2]
	Starting Sweep:
	Max num of sweeps: 2
	Direction -1
	Residual 0.573311637294827
	TT-sol rank: [2, 8, 15, 34, 16, 5]
	Starting Sweep:
	Max num of sweeps: 3
	Direction 1
	Residual 0.026761758307640212
	TT-sol rank: [5, 14, 25, 29, 8, 2]
	Starting Sweep:
	Max num of sweeps: 4
	Direction -1
	Residual 0.012385112394511863
	TT-sol rank: [2, 7, 14, 36, 16, 5]
	Starting Sweep:
	Max num of sweeps: 5
	Direction 1
	Residual 0.027478684654557474
	TT-sol rank: [5, 14, 24, 29, 8, 2]

	---Results---
	Solution rank is [ 5 14 24 29  8  2]
	Residual  0.027478684654557474
	Number of sweeps 6
	Time:  5.521630764007568
	Time per sweep:  0.9202721913655599

Starting Eigen solve with:
 	 0.00030000000000000003 
 	 sweeps: 10
	Starting Sweep: 0
	Step size: 1.000000
	Direction: -1
	Residual inf
	TT-sol rank: [3, 4, 4, 6, 4, 2]
	 -----
	 Solution rank is [1 2 2 3 2 1]
	 Step size: 1.000000
	 Residual 0
	 Number of sweeps 1
	 Time:  0.007119417190551758
	 Time per sweep:  0.00712132453918457

Starting Eigen solve with:
 	 0.00030000000000000003 
 	 sweeps: 10
	Starting Sweep: 0
	Step size: 1.000000
	Direction: -1
	Residual inf
	TT-sol rank: [3, 4, 4, 6, 4, 2]
	 -----
	 Solution rank is [1 2 2 4 2 1]
	 Step size: 1.000000
	 Residual 0
	 Number of sweeps 1
	 Time:  0.006621360778808594
	 Time per sweep:  0.006623029708862305
Step sizes: 1.0, 1.0

Results of iteration 7:
Finishing up: False
Is central: True, Is primal feasible:  True, Is dual feasible: False
Using AHO-Direction: False
Centrality Error: 0.00016626139721403197
Primal-Dual Error: (np.float64(0.0002163195621144962), np.float64(0.0006604500285840785))
Sigma: 0
Ranks X_tt: [3, 7, 11, 18, 9, 3], Z_tt: [3, 7, 7, 8, 5, 3], 
      Y_tt: [1, 2, 2, 3, 2, 1], T_tt: None 

--- Step 8 ---
--- Predictor  step ---
	Starting Sweep:
	Max num of sweeps: 0
	Direction -1
	Residual inf
	TT-sol rank: [4, 12, 15, 15, 15, 6]
	Starting Sweep:
	Max num of sweeps: 1
	Direction 1
	Residual 143236.19445785217
	TT-sol rank: [5, 20, 24, 20, 8, 2]
	Starting Sweep:
	Max num of sweeps: 2
	Direction -1
	Residual 0.029411791820540063
	TT-sol rank: [2, 8, 16, 31, 15, 5]
	Starting Sweep:
	Max num of sweeps: 3
	Direction 1
	Residual 0.00045609811796291537
	TT-sol rank: [5, 16, 27, 31, 8, 2]
	Starting Sweep:
	Max num of sweeps: 4
	Direction -1
	Residual 5.0615086506605104e-05
	TT-sol rank: [2, 8, 16, 42, 15, 5]

	---Results---
	Solution rank is [ 2  8 16 42 15  5]
	Residual  5.0615086506605104e-05
	Number of sweeps 5
	Time:  1.7833292484283447
	Time per sweep:  0.35666623115539553

Starting Eigen solve with:
 	 0.00030000000000000003 
 	 sweeps: 10
	Starting Sweep: 0
	Step size: 1.000000
	Direction: -1
	Residual inf
	TT-sol rank: [3, 4, 4, 5, 4, 2]
	 -----
	 Solution rank is [1 2 2 4 2 1]
	 Step size: 1.000000
	 Residual 0
	 Number of sweeps 1
	 Time:  0.007520914077758789
	 Time per sweep:  0.0075225830078125

Starting Eigen solve with:
 	 0.00030000000000000003 
 	 sweeps: 10
	Starting Sweep: 0
	Step size: 1.000000
	Direction: -1
	Residual inf
	TT-sol rank: [3, 4, 4, 6, 4, 2]
	 -----
	 Solution rank is [1 2 2 4 2 1]
	 Step size: 1.000000
	 Residual 0
	 Number of sweeps 1
	 Time:  0.007873058319091797
	 Time per sweep:  0.00787496566772461
Step sizes: 1.0, 1.0

Results of iteration 8:
Finishing up: True
Is central: True, Is primal feasible:  True, Is dual feasible: True
Using AHO-Direction: True
Centrality Error: 0.0001662760959352947
Primal-Dual Error: (np.float64(0.0002167394809355838), np.float64(2.2445308497948344e-05))
Sigma: 0
Ranks X_tt: [3, 7, 11, 18, 9, 3], Z_tt: [3, 6, 6, 7, 5, 3], 
      Y_tt: [1, 2, 2, 3, 2, 1], T_tt: None 

--- Step 9 ---
--- Predictor  step ---
	Starting Sweep:
	Max num of sweeps: 0
	Direction 1
	Residual inf
	TT-sol rank: [6, 15, 15, 15, 8, 2]
	Starting Sweep:
	Max num of sweeps: 1
	Direction -1
	Residual 2.6521925443116925
	TT-sol rank: [2, 7, 13, 18, 10, 3]
	Starting Sweep:
	Max num of sweeps: 2
	Direction 1
	Residual 0.06244572981417299
	TT-sol rank: [3, 9, 15, 19, 8, 2]
	Starting Sweep:
	Max num of sweeps: 3
	Direction -1
	Residual 0.011055153133190505
	TT-sol rank: [2, 7, 13, 20, 10, 3]
	Starting Sweep:
	Max num of sweeps: 4
	Direction 1
	Residual 0.010847419289694675
	TT-sol rank: [3, 9, 15, 20, 8, 2]
	Starting Sweep:
	Max num of sweeps: 5
	Direction -1
	Residual 0.008699475338416005
	TT-sol rank: [2, 7, 13, 21, 10, 3]

	---Results---
	Solution rank is [ 2  7 13 21 10  3]
	Residual  0.008699475338416005
	Number of sweeps 6
	Time:  2.913662910461426
	Time per sweep:  0.48561084270477295

Starting Eigen solve with:
 	 0.00030000000000000003 
 	 sweeps: 10
	Starting Sweep: 0
	Step size: 1.000000
	Direction: -1
	Residual inf
	TT-sol rank: [3, 4, 4, 6, 4, 2]
	 -----
	 Solution rank is [1 2 2 4 2 1]
	 Step size: 1.000000
	 Residual 0
	 Number of sweeps 1
	 Time:  0.007498741149902344
	 Time per sweep:  0.007500410079956055

Starting Eigen solve with:
 	 0.00030000000000000003 
 	 sweeps: 10
	Starting Sweep: 0
	Step size: 1.000000
	Direction: -1
	Residual inf
	TT-sol rank: [3, 4, 4, 6, 4, 2]
	 -----
	 Solution rank is [1 2 2 3 2 1]
	 Step size: 1.000000
	 Residual 0
	 Number of sweeps 1
	 Time:  0.0071904659271240234
	 Time per sweep:  0.0071926116943359375
Step sizes: 1.0, 1.0

Results of iteration 9:
Finishing up: True
Is central: True, Is primal feasible:  True, Is dual feasible: True
Using AHO-Direction: True
Centrality Error: -3.822076658436223e-07
Primal-Dual Error: (np.float64(0.0005950245213266973), np.float64(5.0808124911471254e-05))
Sigma: 0
Ranks X_tt: [2, 5, 8, 13, 7, 2], Z_tt: [2, 5, 6, 5, 4, 2], 
      Y_tt: [1, 2, 2, 3, 2, 1], T_tt: None 

--- Step 10 ---
--- Predictor  step ---
	Starting Sweep:
	Max num of sweeps: 0
	Direction 1
	Residual inf
	TT-sol rank: [4, 11, 15, 15, 8, 2]
	Starting Sweep:
	Max num of sweeps: 1
	Direction -1
	Residual 4.478596886182448
	TT-sol rank: [2, 6, 10, 18, 11, 4]
	Starting Sweep:
	Max num of sweeps: 2
	Direction 1
	Residual 0.07110190327844369
	TT-sol rank: [3, 8, 12, 21, 8, 2]
	Starting Sweep:
	Max num of sweeps: 3
	Direction -1
	Residual 0.026966037106831937
	TT-sol rank: [2, 6, 10, 22, 10, 3]
	Starting Sweep:
	Max num of sweeps: 4
	Direction 1
	Residual 0.01992846267995118
	TT-sol rank: [3, 8, 12, 21, 8, 2]
	Starting Sweep:
	Max num of sweeps: 5
	Direction -1
	Residual 0.029617875707225974
	TT-sol rank: [2, 6, 10, 22, 10, 3]

	---Results---
	Solution rank is [ 2  6 10 22 10  3]
	Residual  0.029617875707225974
	Number of sweeps 6
	Time:  3.2114975452423096
	Time per sweep:  0.5352499485015869

Starting Eigen solve with:
 	 0.00030000000000000003 
 	 sweeps: 10
	Starting Sweep: 0
	Step size: 1.000000
	Direction: -1
	Residual inf
	TT-sol rank: [3, 4, 4, 6, 4, 2]
	 -----
	 Solution rank is [1 2 2 3 2 1]
	 Step size: 1.000000
	 Residual 0
	 Number of sweeps 1
	 Time:  0.007285118103027344
	 Time per sweep:  0.007286787033081055

Starting Eigen solve with:
 	 0.00030000000000000003 
 	 sweeps: 10
	Starting Sweep: 0
	Step size: 1.000000
	Direction: -1
	Residual inf
	TT-sol rank: [3, 4, 4, 5, 4, 2]
	 -----
	 Solution rank is [1 2 2 4 2 1]
	 Step size: 1.000000
	 Residual 0
	 Number of sweeps 1
	 Time:  0.0068700313568115234
	 Time per sweep:  0.006871938705444336
Step sizes: 1.0, 1.0
---Terminated---
Converged in 10 iterations.
Ranks X_tt: [1, 4, 5, 10, 5, 2], Z_tt: [2, 5, 5, 5, 4, 2], 
      Y_tt: [1, 2, 2, 3, 2, 1], T_tt: None 

Converged after 10.0 iterations
Problem created in 0.002s
Problem solved in 29.362s
Complementary Slackness: 0.0004754399723982054
Total feasibility error: 0.00011483766047947931
--- Run Summary ---
Converged after avg 10.0 iterations
Problem created in avg 0.002s
Problem solved in avg 29.362s
Complementary Slackness avg: 0.0004754399723982054
Total feasibility error avg: 0.00011483766047947931
✅ Completed dim=7 successfully

==== All runs completed at Wed May 21 12:20:47 PM BST 2025 ====
