==== maxcut TT-IPM Batch Run Started at Tue Jun  3 03:39:41 PM BST 2025 ====

▶ Running dim=6 with config=configs/maxcut_6.yaml at Tue Jun  3 03:39:41 PM BST 2025
Seed:  73

Results of iteration 0:
Finishing up: False
Inequality active: not in use
Is central: False, Is primal feasible:  False, Is dual feasible: False
Using AHO-Direction: False
Centrality Error: 1.0999156037934366
Primal-Dual Error: (np.float64(31.499999999999964), np.float64(32.44754372566175))
Sigma: 0.5
Ranks X_tt: [1, 1, 1, 1, 1], Z_tt: [1, 1, 1, 1, 1], 
      Y_tt: [1, 1, 1, 1, 1], T_tt: None 


--- Predictor  step ---

	---Starting Block-ALS---
	Starting Sweep: 0
	Direction 1
	Residual inf
	TT-sol rank: [3, 3, 3, 3, 3]
	Starting Sweep: 1
	Direction -1
	Residual 463.94454939749494
	TT-sol rank: [2, 2, 4, 4, 5]
	Starting Sweep: 2
	Direction 1
	Residual 0.00032178641931789807
	TT-sol rank: [3, 3, 5, 4, 3]
	Starting Sweep: 3
	Direction -1
	Residual 0.00011475452018277123
	TT-sol rank: [2, 2, 4, 5, 5]

	---Results---
	Solution rank is [2 2 4 5 5]
	Residual  0.00011475452018277123
	Number of sweeps 4
	Time:  0.0720055103302002
	Time per sweep:  0.01800239086151123

Starting Eigen solve with:
 	 0.000325 
 	 sweeps: 10
	Starting Sweep: 0
	Step size: 1.000000
	Direction: -1
	Residual inf
	TT-sol rank: [4, 4, 4, 4, 2]
	Starting Sweep: 0
	Step size: 1.000000
	Direction: 1
	Residual 0
	TT-sol rank: [2, 3, 4, 5, 4]
	 -----
	 Solution rank is [1 1 2 3 2]
	 Step size: 1.000000
	 Residual 0
	 Number of sweeps 2
	 Time:  0.02491140365600586
	 Time per sweep:  0.01245737075805664

Starting Eigen solve with:
 	 0.000325 
 	 sweeps: 10
	Starting Sweep: 0
	Step size: 1.000000
	Direction: -1
	Residual inf
	TT-sol rank: [4, 4, 4, 4, 2]
	Starting Sweep: 0
	Step size: 1.000000
	Direction: 1
	Residual 0
	TT-sol rank: [2, 3, 4, 5, 4]
	 -----
	 Solution rank is [1 1 2 3 2]
	 Step size: 1.000000
	 Residual 0
	 Number of sweeps 2
	 Time:  0.01208186149597168
	 Time per sweep:  0.006042838096618652

--- Centering-Corrector  step ---

	---Starting Block-ALS---
	Starting Sweep: 0
	Direction 1
	Residual inf
	TT-sol rank: [6, 6, 6, 4, 3]
	Starting Sweep: 1
	Direction -1
	Residual 518.9272821367495
	TT-sol rank: [2, 3, 7, 7, 7]
	Starting Sweep: 2
	Direction 1
	Residual 1.083955091549706e-05
	TT-sol rank: [5, 5, 6, 4, 3]
	Starting Sweep: 3
	Direction -1
	Residual 1.4868234890019715e-06
	TT-sol rank: [2, 3, 7, 7, 7]

	---Results---
	Solution rank is [2 3 7 7 7]
	Residual  1.4868234890019715e-06
	Number of sweeps 4
	Time:  0.10024881362915039
	Time per sweep:  0.02506345510482788

Starting Eigen solve with:
 	 0.000325 
 	 sweeps: 10
	Starting Sweep: 0
	Step size: 1.000000
	Direction: -1
	Residual inf
	TT-sol rank: [3, 3, 4, 4, 2]
	Starting Sweep: 0
	Step size: 0.503759
	Direction: 1
	Residual 0
	TT-sol rank: [2, 3, 4, 5, 4]
	 -----
	 Solution rank is [1 1 2 3 2]
	 Step size: 0.503759
	 Residual 0
	 Number of sweeps 2
	 Time:  0.020965099334716797
	 Time per sweep:  0.01048421859741211

Starting Eigen solve with:
 	 0.000325 
 	 sweeps: 10
	Starting Sweep: 0
	Step size: 1.000000
	Direction: -1
	Residual inf
	TT-sol rank: [3, 3, 4, 4, 2]
	Starting Sweep: 0
	Step size: 1.000000
	Direction: 1
	Residual 0
	TT-sol rank: [2, 3, 4, 5, 4]
	 -----
	 Solution rank is [1 1 2 3 2]
	 Step size: 1.000000
	 Residual 0
	 Number of sweeps 2
	 Time:  0.011965751647949219
	 Time per sweep:  0.00598454475402832
--- Step 1 ---
Step sizes: 0.4660717089168313, 1.0

Results of iteration 1:
Finishing up: False
Inequality active: not in use
Is central: False, Is primal feasible:  False, Is dual feasible: False
Using AHO-Direction: False
Centrality Error: 0.8758614567656238
Primal-Dual Error: (np.float64(2.137503780312033), np.float64(32.4475075145883))
Sigma: 3.6300015198488584e-06
Ranks X_tt: [3, 4, 5, 4, 4], Z_tt: [3, 4, 5, 4, 4], 
      Y_tt: [1, 1, 2, 2, 2], T_tt: None 


--- Predictor  step ---

	---Starting Block-ALS---
	Starting Sweep: 0
	Direction 1
	Residual inf
	TT-sol rank: [5, 6, 8, 6, 3]
	Starting Sweep: 1
	Direction -1
	Residual 489.8351277960466
	TT-sol rank: [2, 3, 7, 7, 7]
	Starting Sweep: 2
	Direction 1
	Residual 6.470470478657584e-05
	TT-sol rank: [5, 5, 6, 4, 3]
	Starting Sweep: 3
	Direction -1
	Residual 6.470470478657584e-05
	TT-sol rank: [2, 3, 7, 7, 7]

	---Results---
	Solution rank is [2 3 7 7 7]
	Residual  6.470470478657584e-05
	Number of sweeps 4
	Time:  0.08369922637939453
	Time per sweep:  0.020925700664520264

Starting Eigen solve with:
 	 0.000325 
 	 sweeps: 10
	Starting Sweep: 0
	Step size: 1.000000
	Direction: -1
	Residual inf
	TT-sol rank: [3, 3, 4, 4, 2]
	Starting Sweep: 0
	Step size: 1.000000
	Direction: 1
	Residual 0
	TT-sol rank: [2, 3, 4, 6, 4]
	 -----
	 Solution rank is [1 1 2 4 2]
	 Step size: 1.000000
	 Residual 0
	 Number of sweeps 2
	 Time:  0.021186351776123047
	 Time per sweep:  0.010594964027404785

Starting Eigen solve with:
 	 0.000325 
 	 sweeps: 10
	Starting Sweep: 0
	Step size: 1.000000
	Direction: -1
	Residual inf
	TT-sol rank: [3, 3, 4, 4, 2]
	Starting Sweep: 0
	Step size: 1.000000
	Direction: 1
	Residual 0
	TT-sol rank: [2, 3, 4, 5, 4]
	 -----
	 Solution rank is [1 1 2 3 2]
	 Step size: 1.000000
	 Residual 0
	 Number of sweeps 2
	 Time:  0.01611614227294922
	 Time per sweep:  0.00805974006652832

--- Centering-Corrector  step ---

	---Starting Block-ALS---
	Starting Sweep: 0
	Direction 1
	Residual inf
	TT-sol rank: [5, 7, 12, 8, 3]
	Starting Sweep: 1
	Direction -1
	Residual 75.47518640291908
	TT-sol rank: [2, 3, 7, 7, 7]
	Starting Sweep: 2
	Direction 1
	Residual 3.958425495260797e-05
	TT-sol rank: [5, 5, 6, 4, 3]
	Starting Sweep: 3
	Direction -1
	Residual 3.757969188649132e-05
	TT-sol rank: [2, 3, 7, 7, 7]

	---Results---
	Solution rank is [2 3 7 7 7]
	Residual  3.757969188649132e-05
	Number of sweeps 4
	Time:  0.09795761108398438
	Time per sweep:  0.024490177631378174

Starting Eigen solve with:
 	 0.000325 
 	 sweeps: 10
	Starting Sweep: 0
	Step size: 1.000000
	Direction: -1
	Residual inf
	TT-sol rank: [3, 3, 4, 4, 2]
	Starting Sweep: 0
	Step size: 0.613652
	Direction: 1
	Residual 0
	TT-sol rank: [2, 3, 4, 6, 4]
	Starting Sweep: 1
	Step size: 0.613652
	Direction: -1
	Residual 0
	TT-sol rank: [3, 3, 4, 4, 2]
	 -----
	 Solution rank is [1 1 2 3 2]
	 Step size: 0.613652
	 Residual 0
	 Number of sweeps 2
	 Time:  0.028943538665771484
	 Time per sweep:  0.014473319053649902

Starting Eigen solve with:
 	 0.000325 
 	 sweeps: 10
	Starting Sweep: 0
	Step size: 1.000000
	Direction: -1
	Residual inf
	TT-sol rank: [3, 3, 4, 4, 2]
	Starting Sweep: 0
	Step size: 1.000000
	Direction: 1
	Residual 0
	TT-sol rank: [2, 3, 4, 5, 4]
	 -----
	 Solution rank is [1 1 2 3 2]
	 Step size: 1.000000
	 Residual 0
	 Number of sweeps 2
	 Time:  0.013727188110351562
	 Time per sweep:  0.006865143775939941
--- Step 2 ---
Step sizes: 0.5711150754651024, 1.0

Results of iteration 2:
Finishing up: False
Inequality active: not in use
Is central: False, Is primal feasible:  False, Is dual feasible: False
Using AHO-Direction: False
Centrality Error: 0.13046323299347548
Primal-Dual Error: (np.float64(0.30349874673881216), np.float64(32.447528230841))
Sigma: 0.003626717185013923
Ranks X_tt: [3, 4, 7, 5, 4], Z_tt: [3, 4, 6, 5, 4], 
      Y_tt: [1, 1, 1, 1, 1], T_tt: None 


--- Predictor  step ---

	---Starting Block-ALS---
	Starting Sweep: 0
	Direction 1
	Residual inf
	TT-sol rank: [5, 6, 12, 9, 3]
	Starting Sweep: 1
	Direction -1
	Residual 68.02749176727598
	TT-sol rank: [2, 3, 7, 8, 7]
	Starting Sweep: 2
	Direction 1
	Residual 4.360808023299674e-05
	TT-sol rank: [5, 5, 7, 6, 3]
	Starting Sweep: 3
	Direction -1
	Residual 2.6923707855473228e-05
	TT-sol rank: [2, 3, 7, 8, 7]

	---Results---
	Solution rank is [2 3 7 8 7]
	Residual  2.6923707855473228e-05
	Number of sweeps 4
	Time:  0.0954279899597168
	Time per sweep:  0.023857712745666504

Starting Eigen solve with:
 	 0.000325 
 	 sweeps: 10
	Starting Sweep: 0
	Step size: 1.000000
	Direction: -1
	Residual inf
	TT-sol rank: [3, 3, 4, 4, 2]
	Starting Sweep: 0
	Step size: 1.000000
	Direction: 1
	Residual 0
	TT-sol rank: [2, 3, 4, 6, 4]
	 -----
	 Solution rank is [1 1 2 4 2]
	 Step size: 1.000000
	 Residual 0
	 Number of sweeps 2
	 Time:  0.014411449432373047
	 Time per sweep:  0.007207155227661133

Starting Eigen solve with:
 	 0.000325 
 	 sweeps: 10
	Starting Sweep: 0
	Step size: 1.000000
	Direction: -1
	Residual inf
	TT-sol rank: [3, 3, 4, 4, 2]
	Starting Sweep: 0
	Step size: 0.388299
	Direction: 1
	Residual 0
	TT-sol rank: [2, 3, 6, 6, 4]
	Starting Sweep: 1
	Step size: 0.387333
	Direction: -1
	Residual 0
	TT-sol rank: [3, 4, 6, 4, 2]
	Starting Sweep: 1
	Step size: 0.387327
	Direction: 1
	Residual 0
	TT-sol rank: [2, 3, 4, 6, 4]
	 -----
	 Solution rank is [1 1 2 4 2]
	 Step size: 0.387327
	 Residual 0
	 Number of sweeps 3
	 Time:  0.04157233238220215
	 Time per sweep:  0.013858397801717123

--- Centering-Corrector  step ---

	---Starting Block-ALS---
	Starting Sweep: 0
	Direction 1
	Residual inf
	TT-sol rank: [6, 7, 13, 9, 3]
	Starting Sweep: 1
	Direction -1
	Residual 63.913254649673
	TT-sol rank: [2, 3, 7, 8, 7]
	Starting Sweep: 2
	Direction 1
	Residual 3.705566935639684e-05
	TT-sol rank: [5, 5, 7, 6, 3]
	Starting Sweep: 3
	Direction -1
	Residual 2.3273479068495664e-05
	TT-sol rank: [2, 3, 7, 8, 7]

	---Results---
	Solution rank is [2 3 7 8 7]
	Residual  2.3273479068495664e-05
	Number of sweeps 4
	Time:  0.08772420883178711
	Time per sweep:  0.021931767463684082

Starting Eigen solve with:
 	 0.000325 
 	 sweeps: 10
	Starting Sweep: 0
	Step size: 1.000000
	Direction: -1
	Residual inf
	TT-sol rank: [3, 3, 4, 4, 2]
	Starting Sweep: 0
	Step size: 1.000000
	Direction: 1
	Residual 0
	TT-sol rank: [2, 3, 4, 5, 4]
	 -----
	 Solution rank is [1 1 2 3 2]
	 Step size: 1.000000
	 Residual 0
	 Number of sweeps 2
	 Time:  0.015559196472167969
	 Time per sweep:  0.0077811479568481445

Starting Eigen solve with:
 	 0.000325 
 	 sweeps: 10
	Starting Sweep: 0
	Step size: 1.000000
	Direction: -1
	Residual inf
	TT-sol rank: [3, 3, 4, 4, 2]
	Starting Sweep: 0
	Step size: 0.203072
	Direction: 1
	Residual 0
	TT-sol rank: [2, 3, 4, 6, 4]
	 -----
	 Solution rank is [1 1 2 4 2]
	 Step size: 0.203072
	 Residual 0
	 Number of sweeps 2
	 Time:  0.019637107849121094
	 Time per sweep:  0.009820222854614258
--- Step 3 ---
Step sizes: 1.0, 0.18482654176693464

Results of iteration 3:
Finishing up: False
Inequality active: not in use
Is central: False, Is primal feasible:  False, Is dual feasible: False
Using AHO-Direction: True
Centrality Error: 0.030609238514888292
Primal-Dual Error: (np.float64(0.30389232525274723), np.float64(20.453325155137215))
Sigma: 0.2389303006422081
Ranks X_tt: [3, 4, 7, 6, 4], Z_tt: [3, 4, 6, 6, 4], 
      Y_tt: [1, 1, 2, 2, 2], T_tt: None 


--- Predictor  step ---

	---Starting Block-ALS---
	Starting Sweep: 0
	Direction 1
	Residual inf
	TT-sol rank: [6, 7, 13, 9, 3]
	Starting Sweep: 1
	Direction -1
	Residual 65.22290767037629
	TT-sol rank: [2, 4, 8, 9, 8]
	Starting Sweep: 2
	Direction 1
	Residual 1.1152009809679986e-05
	TT-sol rank: [5, 7, 9, 6, 3]
	Starting Sweep: 3
	Direction -1
	Residual 7.0210413977875055e-06
	TT-sol rank: [2, 4, 8, 9, 8]

	---Results---
	Solution rank is [2 4 8 9 8]
	Residual  7.0210413977875055e-06
	Number of sweeps 4
	Time:  0.08373427391052246
	Time per sweep:  0.020934104919433594

Starting Eigen solve with:
 	 0.000325 
 	 sweeps: 10
	Starting Sweep: 0
	Step size: 1.000000
	Direction: -1
	Residual inf
	TT-sol rank: [3, 3, 4, 4, 2]
	Starting Sweep: 0
	Step size: 1.000000
	Direction: 1
	Residual 0
	TT-sol rank: [2, 3, 4, 5, 4]
	 -----
	 Solution rank is [1 1 2 3 2]
	 Step size: 1.000000
	 Residual 0
	 Number of sweeps 2
	 Time:  0.010291576385498047
	 Time per sweep:  0.00514674186706543

Starting Eigen solve with:
 	 0.000325 
 	 sweeps: 10
	Starting Sweep: 0
	Step size: 1.000000
	Direction: -1
	Residual inf
	TT-sol rank: [3, 3, 4, 4, 2]
	Starting Sweep: 0
	Step size: 1.000000
	Direction: 1
	Residual 0
	TT-sol rank: [2, 3, 4, 6, 4]
	 -----
	 Solution rank is [1 1 2 4 2]
	 Step size: 1.000000
	 Residual 0
	 Number of sweeps 2
	 Time:  0.009267091751098633
	 Time per sweep:  0.004634499549865723

--- Centering-Corrector  step ---

	---Starting Block-ALS---
	Starting Sweep: 0
	Direction 1
	Residual inf
	TT-sol rank: [5, 7, 13, 9, 3]
	Starting Sweep: 1
	Direction -1
	Residual 39.91554678991072
	TT-sol rank: [2, 4, 8, 9, 8]
	Starting Sweep: 2
	Direction 1
	Residual 1.955824767887989e-05
	TT-sol rank: [5, 7, 10, 6, 3]
	Starting Sweep: 3
	Direction -1
	Residual 8.636358874002845e-06
	TT-sol rank: [2, 4, 8, 9, 8]

	---Results---
	Solution rank is [2 4 8 9 8]
	Residual  8.636358874002845e-06
	Number of sweeps 4
	Time:  0.061937808990478516
	Time per sweep:  0.015485107898712158

Starting Eigen solve with:
 	 0.000325 
 	 sweeps: 10
	Starting Sweep: 0
	Step size: 1.000000
	Direction: -1
	Residual inf
	TT-sol rank: [3, 3, 4, 4, 2]
	Starting Sweep: 0
	Step size: 0.761560
	Direction: 1
	Residual 0
	TT-sol rank: [2, 3, 4, 6, 4]
	Starting Sweep: 1
	Step size: 0.761560
	Direction: -1
	Residual 0
	TT-sol rank: [3, 3, 4, 4, 2]
	 -----
	 Solution rank is [1 1 2 3 2]
	 Step size: 0.761560
	 Residual 0
	 Number of sweeps 2
	 Time:  0.016188859939575195
	 Time per sweep:  0.008095622062683105

Starting Eigen solve with:
 	 0.000325 
 	 sweeps: 10
	Starting Sweep: 0
	Step size: 1.000000
	Direction: -1
	Residual inf
	TT-sol rank: [3, 3, 4, 4, 2]
	Starting Sweep: 0
	Step size: 0.463417
	Direction: 1
	Residual 0
	TT-sol rank: [2, 3, 4, 6, 4]
	Starting Sweep: 1
	Step size: 0.463417
	Direction: -1
	Residual 0
	TT-sol rank: [3, 3, 4, 4, 2]
	 -----
	 Solution rank is [1 1 2 4 2]
	 Step size: 0.463417
	 Residual 0
	 Number of sweeps 2
	 Time:  0.01554560661315918
	 Time per sweep:  0.007773756980895996
--- Step 4 ---
Step sizes: 0.7030499457408279, 0.4278127456837535

Results of iteration 4:
Finishing up: False
Inequality active: not in use
Is central: False, Is primal feasible:  False, Is dual feasible: False
Using AHO-Direction: True
Centrality Error: 0.007311457977798376
Primal-Dual Error: (np.float64(0.12324707471438617), np.float64(2.953107545423893))
Sigma: 0.012377361802231247
Ranks X_tt: [3, 5, 9, 8, 4], Z_tt: [3, 4, 6, 7, 4], 
      Y_tt: [1, 1, 2, 2, 2], T_tt: None 


--- Predictor  step ---

	---Starting Block-ALS---
	Starting Sweep: 0
	Direction 1
	Residual inf
	TT-sol rank: [5, 8, 13, 9, 3]
	Starting Sweep: 1
	Direction -1
	Residual 39.91420778292915
	TT-sol rank: [2, 4, 12, 12, 8]
	Starting Sweep: 2
	Direction 1
	Residual 2.009964224360023e-05
	TT-sol rank: [5, 7, 13, 9, 3]
	Starting Sweep: 3
	Direction -1
	Residual 2.009964224360023e-05
	TT-sol rank: [2, 4, 12, 12, 8]

	---Results---
	Solution rank is [ 2  4 12 12  8]
	Residual  2.009964224360023e-05
	Number of sweeps 4
	Time:  0.14068889617919922
	Time per sweep:  0.03517282009124756

Starting Eigen solve with:
 	 0.000325 
 	 sweeps: 10
	Starting Sweep: 0
	Step size: 1.000000
	Direction: -1
	Residual inf
	TT-sol rank: [3, 3, 4, 4, 2]
	Starting Sweep: 0
	Step size: 1.000000
	Direction: 1
	Residual 0
	TT-sol rank: [2, 3, 4, 5, 4]
	 -----
	 Solution rank is [1 1 2 3 2]
	 Step size: 1.000000
	 Residual 0
	 Number of sweeps 2
	 Time:  0.012123584747314453
	 Time per sweep:  0.006062865257263184

Starting Eigen solve with:
 	 0.000325 
 	 sweeps: 10
	Starting Sweep: 0
	Step size: 1.000000
	Direction: -1
	Residual inf
	TT-sol rank: [3, 3, 4, 4, 2]
	Starting Sweep: 0
	Step size: 0.163761
	Direction: 1
	Residual 0
	TT-sol rank: [2, 3, 4, 6, 4]
	Starting Sweep: 1
	Step size: 0.163761
	Direction: -1
	Residual 0
	TT-sol rank: [3, 3, 4, 4, 2]
	 -----
	 Solution rank is [1 1 2 4 2]
	 Step size: 0.163761
	 Residual 0
	 Number of sweeps 2
	 Time:  0.015209436416625977
	 Time per sweep:  0.007605791091918945

--- Centering-Corrector  step ---

	---Starting Block-ALS---
	Starting Sweep: 0
	Direction 1
	Residual inf
	TT-sol rank: [5, 8, 13, 11, 4]
	Starting Sweep: 1
	Direction -1
	Residual 4.912374353104435
	TT-sol rank: [2, 4, 13, 13, 9]
	Starting Sweep: 2
	Direction 1
	Residual 0.00010674847623894868
	TT-sol rank: [5, 7, 13, 11, 4]
	Starting Sweep: 3
	Direction -1
	Residual 0.00010674847623894868
	TT-sol rank: [2, 4, 13, 13, 9]

	---Results---
	Solution rank is [ 2  4 13 13  9]
	Residual  0.00010674847623894868
	Number of sweeps 4
	Time:  0.20443320274353027
	Time per sweep:  0.05110901594161987

Starting Eigen solve with:
 	 0.000325 
 	 sweeps: 10
	Starting Sweep: 0
	Step size: 1.000000
	Direction: -1
	Residual inf
	TT-sol rank: [3, 3, 4, 4, 2]
	Starting Sweep: 0
	Step size: 1.000000
	Direction: 1
	Residual 0
	TT-sol rank: [2, 3, 4, 6, 4]
	 -----
	 Solution rank is [1 1 2 4 2]
	 Step size: 1.000000
	 Residual 0
	 Number of sweeps 2
	 Time:  0.010326623916625977
	 Time per sweep:  0.005166172981262207

Starting Eigen solve with:
 	 0.000325 
 	 sweeps: 10
	Starting Sweep: 0
	Step size: 1.000000
	Direction: -1
	Residual inf
	TT-sol rank: [3, 3, 4, 4, 2]
	Starting Sweep: 0
	Step size: 0.125864
	Direction: 1
	Residual 0
	TT-sol rank: [2, 3, 4, 6, 4]
	Starting Sweep: 1
	Step size: 0.125864
	Direction: -1
	Residual 0
	TT-sol rank: [3, 3, 4, 4, 2]
	 -----
	 Solution rank is [1 1 2 3 2]
	 Step size: 0.125864
	 Residual 0
	 Number of sweeps 2
	 Time:  0.013772726058959961
	 Time per sweep:  0.006887316703796387
--- Step 5 ---
Step sizes: 1.0, 0.11406950307369611

Results of iteration 5:
Finishing up: False
Inequality active: not in use
Is central: False, Is primal feasible:  False, Is dual feasible: False
Using AHO-Direction: True
Centrality Error: 0.005807121156073537
Primal-Dual Error: (np.float64(0.12370188827190516), np.float64(2.2795006007375678))
Sigma: 0.9238368699913105
Ranks X_tt: [3, 5, 15, 11, 5], Z_tt: [3, 4, 6, 7, 4], 
      Y_tt: [1, 1, 2, 2, 2], T_tt: None 


--- Predictor  step ---

	---Starting Block-ALS---
	Starting Sweep: 0
	Direction 1
	Residual inf
	TT-sol rank: [6, 11, 13, 12, 4]
	Starting Sweep: 1
	Direction -1
	Residual 4.91806123731089
	TT-sol rank: [2, 4, 13, 13, 9]
	Starting Sweep: 2
	Direction 1
	Residual 0.0005592743118682125
	TT-sol rank: [5, 7, 13, 12, 4]
	Starting Sweep: 3
	Direction -1
	Residual 0.0005592743118682125
	TT-sol rank: [2, 4, 13, 13, 9]

	---Results---
	Solution rank is [ 2  4 13 13  9]
	Residual  0.0005592743118682125
	Number of sweeps 4
	Time:  0.2512168884277344
	Time per sweep:  0.06280475854873657

Starting Eigen solve with:
 	 0.000325 
 	 sweeps: 10
	Starting Sweep: 0
	Step size: 1.000000
	Direction: -1
	Residual inf
	TT-sol rank: [3, 3, 4, 4, 2]
	Starting Sweep: 0
	Step size: 0.460189
	Direction: 1
	Residual 0
	TT-sol rank: [2, 3, 5, 6, 4]
	Starting Sweep: 1
	Step size: 0.460177
	Direction: -1
	Residual 0
	TT-sol rank: [3, 4, 5, 4, 2]
	Starting Sweep: 1
	Step size: 0.460177
	Direction: 1
	Residual 0
	TT-sol rank: [2, 3, 4, 6, 4]
	 -----
	 Solution rank is [1 1 2 4 2]
	 Step size: 0.460177
	 Residual 0
	 Number of sweeps 3
	 Time:  0.02474069595336914
	 Time per sweep:  0.00824753443400065

Starting Eigen solve with:
 	 0.000325 
 	 sweeps: 10
	Starting Sweep: 0
	Step size: 1.000000
	Direction: -1
	Residual inf
	TT-sol rank: [3, 3, 4, 4, 2]
	Starting Sweep: 0
	Step size: 0.234956
	Direction: 1
	Residual 0
	TT-sol rank: [2, 3, 4, 6, 4]
	Starting Sweep: 1
	Step size: 0.234956
	Direction: -1
	Residual 0
	TT-sol rank: [3, 3, 4, 4, 2]
	 -----
	 Solution rank is [1 1 2 4 2]
	 Step size: 0.234956
	 Residual 0
	 Number of sweeps 2
	 Time:  0.013463973999023438
	 Time per sweep:  0.006732940673828125

--- Centering-Corrector  step ---

	---Starting Block-ALS---
	Starting Sweep: 0
	Direction 1
	Residual inf
	TT-sol rank: [6, 12, 13, 13, 4]
	Starting Sweep: 1
	Direction -1
	Residual 3.568608345528639
	TT-sol rank: [2, 4, 13, 13, 9]
	Starting Sweep: 2
	Direction 1
	Residual 0.0005659019584795022
	TT-sol rank: [5, 7, 13, 12, 4]
	Starting Sweep: 3
	Direction -1
	Residual 0.0005659019584795022
	TT-sol rank: [2, 4, 13, 13, 9]

	---Results---
	Solution rank is [ 2  4 13 13  9]
	Residual  0.0005659019584795022
	Number of sweeps 4
	Time:  0.26013922691345215
	Time per sweep:  0.06503546237945557

Starting Eigen solve with:
 	 0.000325 
 	 sweeps: 10
	Starting Sweep: 0
	Step size: 1.000000
	Direction: -1
	Residual inf
	TT-sol rank: [3, 3, 4, 4, 2]
	Starting Sweep: 0
	Step size: 0.308905
	Direction: 1
	Residual 0
	TT-sol rank: [2, 3, 4, 6, 4]
	Starting Sweep: 1
	Step size: 0.308905
	Direction: -1
	Residual 0
	TT-sol rank: [3, 3, 4, 4, 2]
	 -----
	 Solution rank is [1 1 2 4 2]
	 Step size: 0.308905
	 Residual 0
	 Number of sweeps 2
	 Time:  0.017838001251220703
	 Time per sweep:  0.008919954299926758

Starting Eigen solve with:
 	 0.000325 
 	 sweeps: 10
	Starting Sweep: 0
	Step size: 1.000000
	Direction: -1
	Residual inf
	TT-sol rank: [3, 3, 4, 4, 2]
	Starting Sweep: 0
	Step size: 0.680332
	Direction: 1
	Residual 0
	TT-sol rank: [2, 3, 4, 6, 4]
	Starting Sweep: 1
	Step size: 0.680332
	Direction: -1
	Residual 0
	TT-sol rank: [3, 3, 4, 4, 2]
	 -----
	 Solution rank is [1 1 2 4 2]
	 Step size: 0.680332
	 Residual 0
	 Number of sweeps 2
	 Time:  0.014717340469360352
	 Time per sweep:  0.007359743118286133
--- Step 6 ---
Step sizes: 0.2827857524612409, 0.6228064633245479

Results of iteration 6:
Finishing up: False
Inequality active: not in use
Is central: False, Is primal feasible:  False, Is dual feasible: False
Using AHO-Direction: True
Centrality Error: 0.0031473615076308805
Primal-Dual Error: (np.float64(0.05406073505050352), np.float64(0.5595013234119467))
Sigma: 0.6396952657570254
Ranks X_tt: [3, 5, 17, 12, 5], Z_tt: [3, 5, 12, 6, 4], 
      Y_tt: [1, 1, 2, 3, 2], T_tt: None 


--- Predictor  step ---

	---Starting Block-ALS---
	Starting Sweep: 0
	Direction 1
	Residual inf
	TT-sol rank: [6, 12, 13, 12, 4]
	Starting Sweep: 1
	Direction -1
	Residual 5.558666957780616
	TT-sol rank: [2, 4, 13, 13, 9]
	Starting Sweep: 2
	Direction 1
	Residual 0.0009904360365791572
	TT-sol rank: [5, 9, 13, 12, 4]
	Starting Sweep: 3
	Direction -1
	Residual 0.0009904360365791572
	TT-sol rank: [2, 4, 13, 13, 9]

	---Results---
	Solution rank is [ 2  4 13 13  9]
	Residual  0.0009904360365791572
	Number of sweeps 4
	Time:  0.244537353515625
	Time per sweep:  0.06113487482070923

Starting Eigen solve with:
 	 0.000325 
 	 sweeps: 10
	Starting Sweep: 0
	Step size: 1.000000
	Direction: -1
	Residual inf
	TT-sol rank: [3, 3, 4, 4, 2]
	Starting Sweep: 0
	Step size: 0.873914
	Direction: 1
	Residual 0
	TT-sol rank: [2, 3, 4, 6, 4]
	Starting Sweep: 1
	Step size: 0.873914
	Direction: -1
	Residual 0
	TT-sol rank: [3, 3, 4, 4, 2]
	 -----
	 Solution rank is [1 1 2 4 2]
	 Step size: 0.873914
	 Residual 0
	 Number of sweeps 2
	 Time:  0.01659560203552246
	 Time per sweep:  0.008298754692077637

Starting Eigen solve with:
 	 0.000325 
 	 sweeps: 10
	Starting Sweep: 0
	Step size: 1.000000
	Direction: -1
	Residual inf
	TT-sol rank: [3, 3, 4, 4, 2]
	Starting Sweep: 0
	Step size: 0.445236
	Direction: 1
	Residual 0
	TT-sol rank: [2, 3, 4, 6, 4]
	Starting Sweep: 1
	Step size: 0.445236
	Direction: -1
	Residual 0
	TT-sol rank: [3, 3, 4, 4, 2]
	 -----
	 Solution rank is [1 1 2 4 2]
	 Step size: 0.445236
	 Residual 0
	 Number of sweeps 2
	 Time:  0.01563239097595215
	 Time per sweep:  0.00781714916229248

--- Centering-Corrector  step ---

	---Starting Block-ALS---
	Starting Sweep: 0
	Direction 1
	Residual inf
	TT-sol rank: [6, 12, 13, 12, 4]
	Starting Sweep: 1
	Direction -1
	Residual 0.12908078316668428
	TT-sol rank: [2, 4, 13, 13, 9]
	Starting Sweep: 2
	Direction 1
	Residual 0.0008935905937307729
	TT-sol rank: [5, 9, 13, 12, 4]

	---Results---
	Solution rank is [ 5  9 13 12  4]
	Residual  0.0008935905937307729
	Number of sweeps 3
	Time:  0.161268949508667
	Time per sweep:  0.053757111231486

Starting Eigen solve with:
 	 0.000325 
 	 sweeps: 10
	Starting Sweep: 0
	Step size: 1.000000
	Direction: -1
	Residual inf
	TT-sol rank: [3, 3, 4, 4, 2]
	Starting Sweep: 0
	Step size: 0.534269
	Direction: 1
	Residual 0
	TT-sol rank: [2, 3, 4, 6, 4]
	Starting Sweep: 1
	Step size: 0.534269
	Direction: -1
	Residual 0
	TT-sol rank: [3, 3, 4, 4, 2]
	 -----
	 Solution rank is [1 1 2 4 2]
	 Step size: 0.534269
	 Residual 0
	 Number of sweeps 2
	 Time:  0.015796184539794922
	 Time per sweep:  0.007899165153503418

Starting Eigen solve with:
 	 0.000325 
 	 sweeps: 10
	Starting Sweep: 0
	Step size: 1.000000
	Direction: -1
	Residual inf
	TT-sol rank: [3, 3, 4, 4, 2]
	Starting Sweep: 0
	Step size: 0.721211
	Direction: 1
	Residual 0
	TT-sol rank: [2, 3, 4, 6, 4]
	Starting Sweep: 1
	Step size: 0.721211
	Direction: -1
	Residual 0
	TT-sol rank: [3, 3, 4, 4, 2]
	 -----
	 Solution rank is [1 1 2 3 2]
	 Step size: 0.721211
	 Residual 0
	 Number of sweeps 2
	 Time:  0.01540231704711914
	 Time per sweep:  0.007701992988586426
--- Step 7 ---
Step sizes: 0.49511457538803383, 0.6683558267094707

Results of iteration 7:
Finishing up: False
Inequality active: not in use
Is central: False, Is primal feasible:  False, Is dual feasible: False
Using AHO-Direction: True
Centrality Error: 0.0003651618749516428
Primal-Dual Error: (np.float64(0.0010101111747088758), np.float64(0.18883416171349374))
Sigma: 0.22937353800992002
Ranks X_tt: [3, 5, 15, 12, 5], Z_tt: [3, 5, 13, 10, 5], 
      Y_tt: [1, 1, 2, 3, 2], T_tt: None 


--- Predictor  step ---

	---Starting Block-ALS---
	Starting Sweep: 0
	Direction -1
	Residual inf
	TT-sol rank: [4, 11, 13, 13, 12]
	Starting Sweep: 1
	Direction 1
	Residual 91.80582252309931
	TT-sol rank: [5, 13, 13, 13, 4]
	Starting Sweep: 2
	Direction -1
	Residual 0.020594387926044413
	TT-sol rank: [2, 4, 13, 13, 10]
	Starting Sweep: 3
	Direction 1
	Residual 0.0029719641334079467
	TT-sol rank: [5, 9, 13, 13, 4]

	---Results---
	Solution rank is [ 5  9 13 13  4]
	Residual  0.0029719641334079467
	Number of sweeps 4
	Time:  0.3487589359283447
	Time per sweep:  0.08719021081924438

Starting Eigen solve with:
 	 0.000325 
 	 sweeps: 10
	Starting Sweep: 0
	Step size: 1.000000
	Direction: -1
	Residual inf
	TT-sol rank: [3, 3, 4, 4, 2]
	Starting Sweep: 0
	Step size: 0.893959
	Direction: 1
	Residual 0
	TT-sol rank: [2, 3, 4, 6, 4]
	Starting Sweep: 1
	Step size: 0.893959
	Direction: -1
	Residual 0
	TT-sol rank: [3, 3, 4, 4, 2]
	 -----
	 Solution rank is [1 1 2 4 2]
	 Step size: 0.893959
	 Residual 0
	 Number of sweeps 2
	 Time:  0.01623058319091797
	 Time per sweep:  0.00811624526977539

Starting Eigen solve with:
 	 0.000325 
 	 sweeps: 10
	Starting Sweep: 0
	Step size: 1.000000
	Direction: -1
	Residual inf
	TT-sol rank: [3, 3, 4, 4, 2]
	Starting Sweep: 0
	Step size: 0.833113
	Direction: 1
	Residual 0
	TT-sol rank: [2, 3, 4, 6, 4]
	Starting Sweep: 1
	Step size: 0.833113
	Direction: -1
	Residual 0
	TT-sol rank: [3, 3, 4, 4, 2]
	 -----
	 Solution rank is [1 1 2 3 2]
	 Step size: 0.833113
	 Residual 0
	 Number of sweeps 2
	 Time:  0.01579570770263672
	 Time per sweep:  0.007898688316345215

--- Centering-Corrector  step ---

	---Starting Block-ALS---
	Starting Sweep: 0
	Direction -1
	Residual inf
	TT-sol rank: [4, 11, 13, 13, 12]
	Starting Sweep: 1
	Direction 1
	Residual 17.27377122288249
	TT-sol rank: [5, 13, 13, 13, 4]
	Starting Sweep: 2
	Direction -1
	Residual 0.01706540590901085
	TT-sol rank: [2, 4, 13, 13, 10]
	Starting Sweep: 3
	Direction 1
	Residual 0.003059745852606972
	TT-sol rank: [5, 9, 13, 13, 4]

	---Results---
	Solution rank is [ 5  9 13 13  4]
	Residual  0.003059745852606972
	Number of sweeps 4
	Time:  0.3327908515930176
	Time per sweep:  0.08319830894470215

Starting Eigen solve with:
 	 0.000325 
 	 sweeps: 10
	Starting Sweep: 0
	Step size: 1.000000
	Direction: -1
	Residual inf
	TT-sol rank: [3, 3, 4, 4, 2]
	Starting Sweep: 0
	Step size: 0.455146
	Direction: 1
	Residual 0
	TT-sol rank: [2, 3, 4, 6, 4]
	Starting Sweep: 1
	Step size: 0.455146
	Direction: -1
	Residual 0
	TT-sol rank: [3, 3, 4, 4, 2]
	 -----
	 Solution rank is [1 1 2 4 2]
	 Step size: 0.455146
	 Residual 0
	 Number of sweeps 2
	 Time:  0.013063907623291016
	 Time per sweep:  0.006533026695251465

Starting Eigen solve with:
 	 0.000325 
 	 sweeps: 10
	Starting Sweep: 0
	Step size: 1.000000
	Direction: -1
	Residual inf
	TT-sol rank: [3, 3, 4, 4, 2]
	Starting Sweep: 0
	Step size: 0.421520
	Direction: 1
	Residual 0
	TT-sol rank: [2, 3, 4, 6, 4]
	Starting Sweep: 1
	Step size: 0.421520
	Direction: -1
	Residual 0
	TT-sol rank: [3, 3, 4, 4, 2]
	 -----
	 Solution rank is [1 1 2 3 2]
	 Step size: 0.421520
	 Residual 0
	 Number of sweeps 2
	 Time:  0.01470947265625
	 Time per sweep:  0.0073555707931518555
--- Step 8 ---
Step sizes: 0.41922443574683416, 0.3882517166959344

Results of iteration 8:
Finishing up: False
Inequality active: not in use
Is central: True, Is primal feasible:  False, Is dual feasible: False
Using AHO-Direction: True
Centrality Error: 7.459829847900123e-05
Primal-Dual Error: (np.float64(0.0007429420432506714), np.float64(0.04278532346840302))
Sigma: 0.032460351999822175
Ranks X_tt: [3, 5, 12, 9, 5], Z_tt: [3, 5, 11, 10, 5], 
      Y_tt: [1, 1, 2, 2, 2], T_tt: None 


--- Predictor  step ---

	---Starting Block-ALS---
	Starting Sweep: 0
	Direction -1
	Residual inf
	TT-sol rank: [4, 11, 13, 13, 12]
	Starting Sweep: 1
	Direction 1
	Residual 16.74518586223007
	TT-sol rank: [5, 13, 13, 13, 4]
	Starting Sweep: 2
	Direction -1
	Residual 0.00882232851060755
	TT-sol rank: [2, 4, 13, 13, 10]
	Starting Sweep: 3
	Direction 1
	Residual 0.003750333330661851
	TT-sol rank: [5, 9, 13, 13, 4]

	---Results---
	Solution rank is [ 5  9 13 13  4]
	Residual  0.003750333330661851
	Number of sweeps 4
	Time:  0.33518242835998535
	Time per sweep:  0.08379626274108887

Starting Eigen solve with:
 	 0.000325 
 	 sweeps: 10
	Starting Sweep: 0
	Step size: 1.000000
	Direction: -1
	Residual inf
	TT-sol rank: [3, 3, 4, 4, 2]
	Starting Sweep: 0
	Step size: 1.000000
	Direction: 1
	Residual 0
	TT-sol rank: [2, 3, 4, 6, 4]
	 -----
	 Solution rank is [1 1 2 4 2]
	 Step size: 1.000000
	 Residual 0
	 Number of sweeps 2
	 Time:  0.008446931838989258
	 Time per sweep:  0.0042247772216796875

Starting Eigen solve with:
 	 0.000325 
 	 sweeps: 10
	Starting Sweep: 0
	Step size: 1.000000
	Direction: -1
	Residual inf
	TT-sol rank: [3, 3, 4, 4, 2]
	Starting Sweep: 0
	Step size: 1.000000
	Direction: 1
	Residual 0
	TT-sol rank: [2, 3, 4, 5, 4]
	 -----
	 Solution rank is [1 1 2 3 2]
	 Step size: 1.000000
	 Residual 0
	 Number of sweeps 2
	 Time:  0.01022958755493164
	 Time per sweep:  0.0051157474517822266
--- Step 9 ---
Step sizes: 1.0, 1.0

Results of iteration 9:
Finishing up: True
Inequality active: not in use
Is central: True, Is primal feasible:  True, Is dual feasible: True
Using AHO-Direction: True
Centrality Error: 8.584399589394603e-05
Primal-Dual Error: (np.float64(0.0005683187461668171), np.float64(0.00047913825138788343))
Sigma: 0
Ranks X_tt: [3, 5, 11, 8, 5], Z_tt: [3, 4, 6, 5, 4], 
      Y_tt: [1, 1, 2, 2, 2], T_tt: None 


--- Predictor  step ---

	---Starting Block-ALS---
	Starting Sweep: 0
	Direction -1
	Residual inf
	TT-sol rank: [4, 11, 13, 13, 12]
	Starting Sweep: 1
	Direction 1
	Residual 1.410910486434463
	TT-sol rank: [5, 13, 13, 13, 4]
	Starting Sweep: 2
	Direction -1
	Residual 0.7566490370025932
	TT-sol rank: [2, 4, 13, 13, 9]
	Starting Sweep: 3
	Direction 1
	Residual 0.007366492618033862
	TT-sol rank: [5, 9, 13, 13, 4]
	Starting Sweep: 4
	Direction -1
	Residual 0.007366492618033862
	TT-sol rank: [2, 4, 14, 15, 9]

	---Results---
	Solution rank is [ 2  4 14 15  9]
	Residual  0.007366492618033862
	Number of sweeps 5
	Time:  0.3486216068267822
	Time per sweep:  0.06972465515136719

Starting Eigen solve with:
 	 0.000325 
 	 sweeps: 10
	Starting Sweep: 0
	Step size: 1.000000
	Direction: -1
	Residual inf
	TT-sol rank: [3, 3, 4, 4, 2]
	Starting Sweep: 0
	Step size: 1.000000
	Direction: 1
	Residual 0
	TT-sol rank: [2, 3, 4, 6, 4]
	 -----
	 Solution rank is [1 1 2 4 2]
	 Step size: 1.000000
	 Residual 0
	 Number of sweeps 2
	 Time:  0.007889032363891602
	 Time per sweep:  0.003945469856262207

Starting Eigen solve with:
 	 0.000325 
 	 sweeps: 10
	Starting Sweep: 0
	Step size: 1.000000
	Direction: -1
	Residual inf
	TT-sol rank: [3, 3, 4, 4, 2]
	Starting Sweep: 0
	Step size: 1.000000
	Direction: 1
	Residual 0
	TT-sol rank: [2, 3, 3, 3, 3]
	 -----
	 Solution rank is [1 1 1 1 1]
	 Step size: 1.000000
	 Residual 0
	 Number of sweeps 2
	 Time:  0.00921487808227539
	 Time per sweep:  0.004608154296875
--- Step 10 ---
Step sizes: 1.0, 1.0

Results of iteration 10:
Finishing up: True
Inequality active: not in use
Is central: True, Is primal feasible:  True, Is dual feasible: True
Using AHO-Direction: True
Centrality Error: 2.418916485787705e-07
Primal-Dual Error: (np.float64(6.909624233065488e-05), np.float64(1.5736418321945842e-06))
Sigma: 0
Ranks X_tt: [1, 1, 1, 1, 1], Z_tt: [2, 3, 5, 4, 3], 
      Y_tt: [1, 1, 2, 2, 2], T_tt: None 


--- Predictor  step ---

	---Starting Block-ALS---
	Starting Sweep: 0
	Direction 1
	Residual inf
	TT-sol rank: [4, 6, 13, 10, 4]
	Starting Sweep: 1
	Direction -1
	Residual 1.0016649935890012
	TT-sol rank: [2, 4, 13, 13, 9]
	Starting Sweep: 2
	Direction 1
	Residual 0.0012589212023987075
	TT-sol rank: [5, 7, 13, 11, 4]
	Starting Sweep: 3
	Direction -1
	Residual 7.595466177320381e-05
	TT-sol rank: [2, 4, 12, 12, 7]

	---Results---
	Solution rank is [ 2  4 12 12  7]
	Residual  7.595466177320381e-05
	Number of sweeps 4
	Time:  0.25409412384033203
	Time per sweep:  0.06352412700653076

Starting Eigen solve with:
 	 0.000325 
 	 sweeps: 10
	Starting Sweep: 0
	Step size: 1.000000
	Direction: -1
	Residual inf
	TT-sol rank: [3, 3, 4, 4, 2]
	Starting Sweep: 0
	Step size: 1.000000
	Direction: 1
	Residual 0
	TT-sol rank: [2, 4, 6, 6, 4]
	 -----
	 Solution rank is [2 2 3 4 2]
	 Step size: 1.000000
	 Residual 0
	 Number of sweeps 2
	 Time:  0.009857892990112305
	 Time per sweep:  0.004930019378662109

Starting Eigen solve with:
 	 0.000325 
 	 sweeps: 10
	Starting Sweep: 0
	Step size: 1.000000
	Direction: -1
	Residual inf
	TT-sol rank: [3, 3, 3, 3, 2]
	Starting Sweep: 0
	Step size: 1.000000
	Direction: 1
	Residual 0
	TT-sol rank: [2, 3, 3, 3, 3]
	 -----
	 Solution rank is [1 1 1 1 1]
	 Step size: 1.000000
	 Residual 0
	 Number of sweeps 2
	 Time:  0.011664867401123047
	 Time per sweep:  0.005833864212036133
--- Step 11 ---
Step sizes: 1.0, 1.0
---Terminated---
Converged in 11 iterations.
Ranks X_tt: [1, 1, 1, 1, 1], Z_tt: [2, 3, 5, 4, 3], 
      Y_tt: [1, 1, 2, 2, 2], T_tt: None 

Converged after 11.0 iterations
Problem created in 0.001s
Problem solved in 4.725s
Complementary Slackness: 4.709886591847123e-09
Total feasibility error: 5.900054648857148e-19
--- Run Summary ---
Converged after avg 11.0 iterations
Problem created in avg 0.001s
Problem solved in avg 4.725s
Complementary Slackness avg: 4.709886591847123e-09
Total feasibility error avg: 5.900054648857148e-19
✅ Completed dim=6 successfully

==== All runs completed at Tue Jun  3 03:39:46 PM BST 2025 ====
