==== max_stable_set TT-IPM Batch Run Started at Mon May 19 05:27:43 PM BST 2025 ====

▶ Running dim=2 with config=configs/max_stable_set_2.yaml at Mon May 19 05:27:43 PM BST 2025
Seed:  5

Results of iteration 0:
Finishing up: False
Is central: False, Is primal feasible:  False, Is dual feasible: False
Using AHO-Direction: False
Centrality Error: 0.06153846153846154
Primal-Dual Error: (np.float64(3.499999999999998), np.float64(1.0356368176142465))
Sigma: 0.5
Ranks X_tt: [1], Z_tt: [1], 
      Y_tt: [1], T_tt: None 

--- Step 1 ---
--- Predictor  step ---
	Starting Sweep:
	Max num of sweeps: 0
	Direction 1
	Residual inf
	TT-sol rank: [2]
	Starting Sweep:
	Max num of sweeps: 1
	Direction -1
	Residual 1.0624414839323224
	TT-sol rank: [3]
	Starting Sweep:
	Max num of sweeps: 2
	Direction 1
	Residual 6.577948038347902e-16
	TT-sol rank: [3]

	---Results---
	Solution rank is [3]
	Residual  6.577948038347902e-16
	Number of sweeps 3
	Time:  0.010217905044555664
	Time per sweep:  0.003406683603922526
Starting Eigen solve with:
 	 0.0006000000000000001 
 	 sweeps: 10
	Starting Sweep: 0
	Step size: 1.000000
	Direction: -1
	Residual inf
	TT-sol rank: [2]
	Starting Sweep: 0
	Step size: 0.136107
	Direction: 1
	Residual 0
	TT-sol rank: [2]
	 -----
	 Solution rank is [1]
	 Step size: 0.136107
	 Residual 0
	 Number of sweeps 2
	 Time:  0.004392862319946289
	 Time per sweep:  0.0021973848342895508
Starting Eigen solve with:
 	 0.0006000000000000001 
 	 sweeps: 10
	Starting Sweep: 0
	Step size: 1.000000
	Direction: -1
	Residual inf
	TT-sol rank: [2]
	Starting Sweep: 0
	Step size: 0.151581
	Direction: 1
	Residual 0
	TT-sol rank: [2]
	 -----
	 Solution rank is [1]
	 Step size: 0.151581
	 Residual 0
	 Number of sweeps 2
	 Time:  0.0021986961364746094
	 Time per sweep:  0.001100301742553711

--- Centering-Corrector  step ---
	Starting Sweep:
	Max num of sweeps: 0
	Direction -1
	Residual inf
	TT-sol rank: [2]
	Starting Sweep:
	Max num of sweeps: 1
	Direction 1
	Residual 1.0162655299724281
	TT-sol rank: [3]
	Starting Sweep:
	Max num of sweeps: 2
	Direction -1
	Residual 4.3461773448185744e-16
	TT-sol rank: [3]

	---Results---
	Solution rank is [3]
	Residual  4.3461773448185744e-16
	Number of sweeps 3
	Time:  0.007923126220703125
	Time per sweep:  0.0026416778564453125
Starting Eigen solve with:
 	 0.0006000000000000001 
 	 sweeps: 10
	Starting Sweep: 0
	Step size: 1.000000
	Direction: -1
	Residual inf
	TT-sol rank: [2]
	Starting Sweep: 0
	Step size: 0.085594
	Direction: 1
	Residual 0
	TT-sol rank: [2]
	 -----
	 Solution rank is [1]
	 Step size: 0.085594
	 Residual 0
	 Number of sweeps 2
	 Time:  0.002393960952758789
	 Time per sweep:  0.00119781494140625
Starting Eigen solve with:
 	 0.0006000000000000001 
 	 sweeps: 10
	Starting Sweep: 0
	Step size: 1.000000
	Direction: -1
	Residual inf
	TT-sol rank: [2]
	Starting Sweep: 0
	Step size: 1.000000
	Direction: 1
	Residual 0
	TT-sol rank: [2]
	 -----
	 Solution rank is [1]
	 Step size: 1.000000
	 Residual 0
	 Number of sweeps 2
	 Time:  0.002076387405395508
	 Time per sweep:  0.0010390281677246094
Step sizes: 0.0774, 1.0000

Results of iteration 1:
Finishing up: False
Is central: False, Is primal feasible:  False, Is dual feasible: False
Using AHO-Direction: False
Centrality Error: 0.7301754991562451
Primal-Dual Error: (np.float64(2.9581922888755736), np.float64(1.0356368176142439))
Sigma: 0.4695179022644783
Ranks X_tt: [3], Z_tt: [3], 
      Y_tt: [2], T_tt: None 

--- Step 2 ---
--- Predictor  step ---
	Starting Sweep:
	Max num of sweeps: 0
	Direction 1
	Residual inf
	TT-sol rank: [2]
	Starting Sweep:
	Max num of sweeps: 1
	Direction -1
	Residual 2.8043810371102165
	TT-sol rank: [3]
	Starting Sweep:
	Max num of sweeps: 2
	Direction 1
	Residual 0.033640005659855636
	TT-sol rank: [3]
	Starting Sweep:
	Max num of sweeps: 3
	Direction -1
	Residual 1.611542783676621e-15
	TT-sol rank: [4]

	---Results---
	Solution rank is [4]
	Residual  1.611542783676621e-15
	Number of sweeps 4
	Time:  0.009334325790405273
	Time per sweep:  0.0023340582847595215
Starting Eigen solve with:
 	 0.0006000000000000001 
 	 sweeps: 10
	Starting Sweep: 0
	Step size: 1.000000
	Direction: -1
	Residual inf
	TT-sol rank: [2]
	Starting Sweep: 0
	Step size: 1.000000
	Direction: 1
	Residual 0
	TT-sol rank: [2]
	 -----
	 Solution rank is [1]
	 Step size: 1.000000
	 Residual 0
	 Number of sweeps 2
	 Time:  0.002871990203857422
	 Time per sweep:  0.0014367103576660156
Starting Eigen solve with:
 	 0.0006000000000000001 
 	 sweeps: 10
	Starting Sweep: 0
	Step size: 1.000000
	Direction: -1
	Residual inf
	TT-sol rank: [2]
	Starting Sweep: 0
	Step size: 1.000000
	Direction: 1
	Residual 0
	TT-sol rank: [2]
	 -----
	 Solution rank is [1]
	 Step size: 1.000000
	 Residual 0
	 Number of sweeps 2
	 Time:  0.0019807815551757812
	 Time per sweep:  0.0009913444519042969

--- Centering-Corrector  step ---
	Starting Sweep:
	Max num of sweeps: 0
	Direction 1
	Residual inf
	TT-sol rank: [2]
	Starting Sweep:
	Max num of sweeps: 1
	Direction -1
	Residual 0.8133268928492023
	TT-sol rank: [3]
	Starting Sweep:
	Max num of sweeps: 2
	Direction 1
	Residual 0.07002338660346656
	TT-sol rank: [3]
	Starting Sweep:
	Max num of sweeps: 3
	Direction -1
	Residual 2.9031724812559894e-15
	TT-sol rank: [4]

	---Results---
	Solution rank is [4]
	Residual  2.9031724812559894e-15
	Number of sweeps 4
	Time:  0.0071179866790771484
	Time per sweep:  0.0017799139022827148
Starting Eigen solve with:
 	 0.0006000000000000001 
 	 sweeps: 10
	Starting Sweep: 0
	Step size: 1.000000
	Direction: -1
	Residual inf
	TT-sol rank: [2]
	Starting Sweep: 0
	Step size: 0.559911
	Direction: 1
	Residual 0
	TT-sol rank: [2]
	 -----
	 Solution rank is [1]
	 Step size: 0.559911
	 Residual 0
	 Number of sweeps 2
	 Time:  0.002490997314453125
	 Time per sweep:  0.0012464523315429688
Starting Eigen solve with:
 	 0.0006000000000000001 
 	 sweeps: 10
	Starting Sweep: 0
	Step size: 1.000000
	Direction: -1
	Residual inf
	TT-sol rank: [2]
	Starting Sweep: 0
	Step size: 1.000000
	Direction: 1
	Residual 0
	TT-sol rank: [2]
	 -----
	 Solution rank is [1]
	 Step size: 1.000000
	 Residual 0
	 Number of sweeps 2
	 Time:  0.00281524658203125
	 Time per sweep:  0.0014090538024902344
Step sizes: 0.5196, 1.0000

Results of iteration 2:
Finishing up: False
Is central: False, Is primal feasible:  False, Is dual feasible: False
Using AHO-Direction: False
Centrality Error: 0.44978008698036737
Primal-Dual Error: (np.float64(0.11592995214537757), np.float64(1.0356368176142408))
Sigma: 0.002317470846993448
Ranks X_tt: [3], Z_tt: [3], 
      Y_tt: [2], T_tt: None 

--- Step 3 ---
--- Predictor  step ---
	Starting Sweep:
	Max num of sweeps: 0
	Direction 1
	Residual inf
	TT-sol rank: [2]
	Starting Sweep:
	Max num of sweeps: 1
	Direction -1
	Residual 2.2950424069410125
	TT-sol rank: [3]
	Starting Sweep:
	Max num of sweeps: 2
	Direction 1
	Residual 0.04069704953039697
	TT-sol rank: [3]
	Starting Sweep:
	Max num of sweeps: 3
	Direction -1
	Residual 1.993923689532273e-14
	TT-sol rank: [4]

	---Results---
	Solution rank is [4]
	Residual  1.993923689532273e-14
	Number of sweeps 4
	Time:  0.006970405578613281
	Time per sweep:  0.0017430782318115234
Starting Eigen solve with:
 	 0.0006000000000000001 
 	 sweeps: 10
	Starting Sweep: 0
	Step size: 1.000000
	Direction: -1
	Residual inf
	TT-sol rank: [2]
	Starting Sweep: 0
	Step size: 1.000000
	Direction: 1
	Residual 0
	TT-sol rank: [2]
	 -----
	 Solution rank is [1]
	 Step size: 1.000000
	 Residual 0
	 Number of sweeps 2
	 Time:  0.0024814605712890625
	 Time per sweep:  0.0012422800064086914
Starting Eigen solve with:
 	 0.0006000000000000001 
 	 sweeps: 10
	Starting Sweep: 0
	Step size: 1.000000
	Direction: -1
	Residual inf
	TT-sol rank: [2]
	Starting Sweep: 0
	Step size: 0.631339
	Direction: 1
	Residual 0
	TT-sol rank: [2]
	 -----
	 Solution rank is [1]
	 Step size: 0.631339
	 Residual 0
	 Number of sweeps 2
	 Time:  0.004030942916870117
	 Time per sweep:  0.002016782760620117

--- Centering-Corrector  step ---
	Starting Sweep:
	Max num of sweeps: 0
	Direction 1
	Residual inf
	TT-sol rank: [2]
	Starting Sweep:
	Max num of sweeps: 1
	Direction -1
	Residual 0.7818729399683289
	TT-sol rank: [3]
	Starting Sweep:
	Max num of sweeps: 2
	Direction 1
	Residual 0.040390272323685916
	TT-sol rank: [3]
	Starting Sweep:
	Max num of sweeps: 3
	Direction -1
	Residual 1.1541871752392697e-14
	TT-sol rank: [4]

	---Results---
	Solution rank is [4]
	Residual  1.1541871752392697e-14
	Number of sweeps 4
	Time:  0.011961698532104492
	Time per sweep:  0.002991199493408203
Starting Eigen solve with:
 	 0.0006000000000000001 
 	 sweeps: 10
	Starting Sweep: 0
	Step size: 1.000000
	Direction: -1
	Residual inf
	TT-sol rank: [2]
	Starting Sweep: 0
	Step size: 0.623348
	Direction: 1
	Residual 0
	TT-sol rank: [2]
	 -----
	 Solution rank is [1]
	 Step size: 0.623348
	 Residual 0
	 Number of sweeps 2
	 Time:  0.004082202911376953
	 Time per sweep:  0.002041935920715332
Starting Eigen solve with:
 	 0.0006000000000000001 
 	 sweeps: 10
	Starting Sweep: 0
	Step size: 1.000000
	Direction: -1
	Residual inf
	TT-sol rank: [2]
	Starting Sweep: 0
	Step size: 0.384496
	Direction: 1
	Residual 0
	TT-sol rank: [2]
	 -----
	 Solution rank is [1]
	 Step size: 0.384496
	 Residual 0
	 Number of sweeps 2
	 Time:  0.002086162567138672
	 Time per sweep:  0.0010437965393066406
Step sizes: 0.5730, 0.3534

Results of iteration 3:
Finishing up: False
Is central: False, Is primal feasible:  False, Is dual feasible: False
Using AHO-Direction: False
Centrality Error: 0.06602490755904412
Primal-Dual Error: (np.float64(0.016925099043016215), np.float64(0.30356922486834303))
Sigma: 0.2021488954679741
Ranks X_tt: [3], Z_tt: [3], 
      Y_tt: [2], T_tt: None 

--- Step 4 ---
--- Predictor  step ---
	Starting Sweep:
	Max num of sweeps: 0
	Direction 1
	Residual inf
	TT-sol rank: [2]
	Starting Sweep:
	Max num of sweeps: 1
	Direction -1
	Residual 2.763007884912622
	TT-sol rank: [3]
	Starting Sweep:
	Max num of sweeps: 2
	Direction 1
	Residual 0.05193607909952022
	TT-sol rank: [3]
	Starting Sweep:
	Max num of sweeps: 3
	Direction -1
	Residual 6.7501295361287684e-15
	TT-sol rank: [4]

	---Results---
	Solution rank is [4]
	Residual  6.7501295361287684e-15
	Number of sweeps 4
	Time:  0.0067386627197265625
	Time per sweep:  0.0016850829124450684
Starting Eigen solve with:
 	 0.0006000000000000001 
 	 sweeps: 10
	Starting Sweep: 0
	Step size: 1.000000
	Direction: -1
	Residual inf
	TT-sol rank: [2]
	Starting Sweep: 0
	Step size: 0.618704
	Direction: 1
	Residual 0
	TT-sol rank: [2]
	 -----
	 Solution rank is [1]
	 Step size: 0.618704
	 Residual 0
	 Number of sweeps 2
	 Time:  0.0022497177124023438
	 Time per sweep:  0.0011258125305175781
Starting Eigen solve with:
 	 0.0006000000000000001 
 	 sweeps: 10
	Starting Sweep: 0
	Step size: 1.000000
	Direction: -1
	Residual inf
	TT-sol rank: [2]
	Starting Sweep: 0
	Step size: 0.788797
	Direction: 1
	Residual 0
	TT-sol rank: [2]
	 -----
	 Solution rank is [1]
	 Step size: 0.788797
	 Residual 0
	 Number of sweeps 2
	 Time:  0.0025148391723632812
	 Time per sweep:  0.0012583732604980469

--- Centering-Corrector  step ---
	Starting Sweep:
	Max num of sweeps: 0
	Direction 1
	Residual inf
	TT-sol rank: [2]
	Starting Sweep:
	Max num of sweeps: 1
	Direction -1
	Residual 0.2561450574374701
	TT-sol rank: [3]
	Starting Sweep:
	Max num of sweeps: 2
	Direction 1
	Residual 0.027254091538041873
	TT-sol rank: [3]
	Starting Sweep:
	Max num of sweeps: 3
	Direction -1
	Residual 5.5107049316117194e-15
	TT-sol rank: [4]

	---Results---
	Solution rank is [4]
	Residual  5.5107049316117194e-15
	Number of sweeps 4
	Time:  0.008144855499267578
	Time per sweep:  0.002036750316619873
Starting Eigen solve with:
 	 0.0006000000000000001 
 	 sweeps: 10
	Starting Sweep: 0
	Step size: 1.000000
	Direction: -1
	Residual inf
	TT-sol rank: [2]
	Starting Sweep: 0
	Step size: 0.631647
	Direction: 1
	Residual 0
	TT-sol rank: [2]
	 -----
	 Solution rank is [1]
	 Step size: 0.631647
	 Residual 0
	 Number of sweeps 2
	 Time:  0.0024025440216064453
	 Time per sweep:  0.0012021064758300781
Starting Eigen solve with:
 	 0.0006000000000000001 
 	 sweeps: 10
	Starting Sweep: 0
	Step size: 1.000000
	Direction: -1
	Residual inf
	TT-sol rank: [2]
	Starting Sweep: 0
	Step size: 0.534277
	Direction: 1
	Residual 0
	TT-sol rank: [2]
	 -----
	 Solution rank is [1]
	 Step size: 0.534277
	 Residual 0
	 Number of sweeps 2
	 Time:  0.002361297607421875
	 Time per sweep:  0.0011816024780273438
Step sizes: 0.5854, 0.4951

Results of iteration 4:
Finishing up: False
Is central: False, Is primal feasible:  False, Is dual feasible: False
Using AHO-Direction: False
Centrality Error: 0.008578320293541733
Primal-Dual Error: (np.float64(0.0028893093386557433), np.float64(0.0029618652795040277))
Sigma: 0.28080801851610626
Ranks X_tt: [3], Z_tt: [3], 
      Y_tt: [2], T_tt: None 

--- Step 5 ---
--- Predictor  step ---
	Starting Sweep:
	Max num of sweeps: 0
	Direction 1
	Residual inf
	TT-sol rank: [2]
	Starting Sweep:
	Max num of sweeps: 1
	Direction -1
	Residual 18.7044154254398
	TT-sol rank: [3]
	Starting Sweep:
	Max num of sweeps: 2
	Direction 1
	Residual 0.011458360851549379
	TT-sol rank: [3]
	Starting Sweep:
	Max num of sweeps: 3
	Direction -1
	Residual 3.5837964674976624e-14
	TT-sol rank: [4]

	---Results---
	Solution rank is [4]
	Residual  3.5837964674976624e-14
	Number of sweeps 4
	Time:  0.007133007049560547
	Time per sweep:  0.0017837285995483398
Starting Eigen solve with:
 	 0.0006000000000000001 
 	 sweeps: 10
	Starting Sweep: 0
	Step size: 1.000000
	Direction: -1
	Residual inf
	TT-sol rank: [2]
	Starting Sweep: 0
	Step size: 0.969821
	Direction: 1
	Residual 0
	TT-sol rank: [2]
	 -----
	 Solution rank is [1]
	 Step size: 0.969821
	 Residual 0
	 Number of sweeps 2
	 Time:  0.0023169517517089844
	 Time per sweep:  0.0011594295501708984
Starting Eigen solve with:
 	 0.0006000000000000001 
 	 sweeps: 10
	Starting Sweep: 0
	Step size: 1.000000
	Direction: -1
	Residual inf
	TT-sol rank: [2]
	Starting Sweep: 0
	Step size: 0.985227
	Direction: 1
	Residual 0
	TT-sol rank: [2]
	 -----
	 Solution rank is [1]
	 Step size: 0.985227
	 Residual 0
	 Number of sweeps 2
	 Time:  0.002317190170288086
	 Time per sweep:  0.0011593103408813477

--- Centering-Corrector  step ---
	Starting Sweep:
	Max num of sweeps: 0
	Direction 1
	Residual inf
	TT-sol rank: [2]
	Starting Sweep:
	Max num of sweeps: 1
	Direction -1
	Residual 0.7675037996027387
	TT-sol rank: [3]
	Starting Sweep:
	Max num of sweeps: 2
	Direction 1
	Residual 0.009094404318432336
	TT-sol rank: [3]
	Starting Sweep:
	Max num of sweeps: 3
	Direction -1
	Residual 3.0419242813705955e-14
	TT-sol rank: [4]

	---Results---
	Solution rank is [4]
	Residual  3.0419242813705955e-14
	Number of sweeps 4
	Time:  0.0066912174224853516
	Time per sweep:  0.0016732215881347656
Starting Eigen solve with:
 	 0.0006000000000000001 
 	 sweeps: 10
	Starting Sweep: 0
	Step size: 1.000000
	Direction: -1
	Residual inf
	TT-sol rank: [2]
	Starting Sweep: 0
	Step size: 0.492464
	Direction: 1
	Residual 0
	TT-sol rank: [2]
	 -----
	 Solution rank is [1]
	 Step size: 0.492464
	 Residual 0
	 Number of sweeps 2
	 Time:  0.0023653507232666016
	 Time per sweep:  0.001183629035949707
Starting Eigen solve with:
 	 0.0006000000000000001 
 	 sweeps: 10
	Starting Sweep: 0
	Step size: 1.000000
	Direction: -1
	Residual inf
	TT-sol rank: [2]
	Starting Sweep: 0
	Step size: 0.493267
	Direction: 1
	Residual 0
	TT-sol rank: [2]
	 -----
	 Solution rank is [1]
	 Step size: 0.493267
	 Residual 0
	 Number of sweeps 2
	 Time:  0.0022335052490234375
	 Time per sweep:  0.0011178255081176758
Step sizes: 0.4553, 0.4561

Results of iteration 5:
Finishing up: False
Is central: False, Is primal feasible:  True, Is dual feasible: True
Using AHO-Direction: False
Centrality Error: 0.0007343048621921756
Primal-Dual Error: (np.float64(0.0002580533167760235), np.float64(0.0002601353522304802))
Sigma: 0.0008531435280057216
Ranks X_tt: [3], Z_tt: [3], 
      Y_tt: [2], T_tt: None 

--- Step 6 ---
--- Predictor  step ---
	Starting Sweep:
	Max num of sweeps: 0
	Direction 1
	Residual inf
	TT-sol rank: [2]
	Starting Sweep:
	Max num of sweeps: 1
	Direction -1
	Residual 4.893433094447415
	TT-sol rank: [3]
	Starting Sweep:
	Max num of sweeps: 2
	Direction 1
	Residual 0.016145411094589394
	TT-sol rank: [3]
	Starting Sweep:
	Max num of sweeps: 3
	Direction -1
	Residual 1.0944325137742965e-13
	TT-sol rank: [4]

	---Results---
	Solution rank is [4]
	Residual  1.0944325137742965e-13
	Number of sweeps 4
	Time:  0.006398200988769531
	Time per sweep:  0.001600027084350586
Starting Eigen solve with:
 	 0.0006000000000000001 
 	 sweeps: 10
	Starting Sweep: 0
	Step size: 1.000000
	Direction: -1
	Residual inf
	TT-sol rank: [2]
	Starting Sweep: 0
	Step size: 0.940141
	Direction: 1
	Residual 0
	TT-sol rank: [2]
	 -----
	 Solution rank is [1]
	 Step size: 0.940141
	 Residual 0
	 Number of sweeps 2
	 Time:  0.0025289058685302734
	 Time per sweep:  0.001265406608581543
Starting Eigen solve with:
 	 0.0006000000000000001 
 	 sweeps: 10
	Starting Sweep: 0
	Step size: 1.000000
	Direction: -1
	Residual inf
	TT-sol rank: [2]
	Starting Sweep: 0
	Step size: 0.989828
	Direction: 1
	Residual 0
	TT-sol rank: [2]
	 -----
	 Solution rank is [1]
	 Step size: 0.989828
	 Residual 0
	 Number of sweeps 2
	 Time:  0.0023751258850097656
	 Time per sweep:  0.0011886358261108398

--- Centering-Corrector  step ---
	Starting Sweep:
	Max num of sweeps: 0
	Direction 1
	Residual inf
	TT-sol rank: [2]
	Starting Sweep:
	Max num of sweeps: 1
	Direction -1
	Residual 0.534327782745585
	TT-sol rank: [3]
	Starting Sweep:
	Max num of sweeps: 2
	Direction 1
	Residual 0.03609340407834215
	TT-sol rank: [3]
	Starting Sweep:
	Max num of sweeps: 3
	Direction -1
	Residual 9.61330943857258e-14
	TT-sol rank: [4]

	---Results---
	Solution rank is [4]
	Residual  9.61330943857258e-14
	Number of sweeps 4
	Time:  0.00673365592956543
	Time per sweep:  0.0016837716102600098
Starting Eigen solve with:
 	 0.0006000000000000001 
 	 sweeps: 10
	Starting Sweep: 0
	Step size: 1.000000
	Direction: -1
	Residual inf
	TT-sol rank: [2]
	Starting Sweep: 0
	Step size: 0.484588
	Direction: 1
	Residual 0
	TT-sol rank: [2]
	 -----
	 Solution rank is [1]
	 Step size: 0.484588
	 Residual 0
	 Number of sweeps 2
	 Time:  0.0026264190673828125
	 Time per sweep:  0.0013140439987182617
Starting Eigen solve with:
 	 0.0006000000000000001 
 	 sweeps: 10
	Starting Sweep: 0
	Step size: 1.000000
	Direction: -1
	Residual inf
	TT-sol rank: [2]
	Starting Sweep: 0
	Step size: 0.496643
	Direction: 1
	Residual 0
	TT-sol rank: [2]
	 -----
	 Solution rank is [1]
	 Step size: 0.496643
	 Residual 0
	 Number of sweeps 2
	 Time:  0.00240325927734375
	 Time per sweep:  0.0012024641036987305
Step sizes: 0.4479, 0.4590

Results of iteration 6:
Finishing up: True
Is central: True, Is primal feasible:  True, Is dual feasible: True
Using AHO-Direction: False
Centrality Error: 3.7157429736151866e-05
Primal-Dual Error: (np.float64(0.0002580533167501061), np.float64(0.00013644028579476813))
Sigma: 0.0015923395899953138
Ranks X_tt: [3], Z_tt: [2], 
      Y_tt: [2], T_tt: None 

--- Step 7 ---
--- Predictor  step ---
	Starting Sweep:
	Max num of sweeps: 0
	Direction 1
	Residual inf
	TT-sol rank: [2]
	Starting Sweep:
	Max num of sweeps: 1
	Direction -1
	Residual 1.152971612886375
	TT-sol rank: [2]
	Starting Sweep:
	Max num of sweeps: 2
	Direction 1
	Residual 0.12155903515511933
	TT-sol rank: [3]
	Starting Sweep:
	Max num of sweeps: 3
	Direction -1
	Residual 1.2739940794723423e-08
	TT-sol rank: [4]

	---Results---
	Solution rank is [4]
	Residual  1.2739940794723423e-08
	Number of sweeps 4
	Time:  0.02874588966369629
	Time per sweep:  0.007186949253082275
Starting Eigen solve with:
 	 0.0006000000000000001 
 	 sweeps: 10
	Starting Sweep: 0
	Step size: 1.000000
	Direction: -1
	Residual inf
	TT-sol rank: [2]
	Starting Sweep: 0
	Step size: 1.000000
	Direction: 1
	Residual 0
	TT-sol rank: [2]
	 -----
	 Solution rank is [1]
	 Step size: 1.000000
	 Residual 0
	 Number of sweeps 2
	 Time:  0.0028078556060791016
	 Time per sweep:  0.0014050006866455078
Starting Eigen solve with:
 	 0.0006000000000000001 
 	 sweeps: 10
	Starting Sweep: 0
	Step size: 1.000000
	Direction: -1
	Residual inf
	TT-sol rank: [2]
	Starting Sweep: 0
	Step size: 1.000000
	Direction: 1
	Residual 0
	TT-sol rank: [2]
	 -----
	 Solution rank is [1]
	 Step size: 1.000000
	 Residual 0
	 Number of sweeps 2
	 Time:  0.0020940303802490234
	 Time per sweep:  0.0010478496551513672
Step sizes: 1.0000, 1.0000

Results of iteration 7:
Finishing up: True
Is central: True, Is primal feasible:  True, Is dual feasible: True
Using AHO-Direction: False
Centrality Error: -5.6447018130000593e-08
Primal-Dual Error: (np.float64(9.087628546655534e-15), np.float64(4.991459226283177e-07))
Sigma: 0
Ranks X_tt: [2], Z_tt: [1], 
      Y_tt: [2], T_tt: None 

--- Step 8 ---
--- Predictor  step ---
	Starting Sweep:
	Max num of sweeps: 0
	Direction 1
	Residual inf
	TT-sol rank: [2]
	Starting Sweep:
	Max num of sweeps: 1
	Direction -1
	Residual 0.8666827435773318
	TT-sol rank: [2]
	Starting Sweep:
	Max num of sweeps: 2
	Direction 1
	Residual 0.0010858919183517252
	TT-sol rank: [3]
	Starting Sweep:
	Max num of sweeps: 3
	Direction -1
	Residual 8.414985079183914e-10
	TT-sol rank: [4]

	---Results---
	Solution rank is [4]
	Residual  8.414985079183914e-10
	Number of sweeps 4
	Time:  0.14114093780517578
	Time per sweep:  0.03528571128845215
Starting Eigen solve with:
 	 0.0006000000000000001 
 	 sweeps: 10
	Starting Sweep: 0
	Step size: 1.000000
	Direction: -1
	Residual inf
	TT-sol rank: [2]
	Starting Sweep: 0
	Step size: 1.000000
	Direction: 1
	Residual 0
	TT-sol rank: [2]
	 -----
	 Solution rank is [1]
	 Step size: 1.000000
	 Residual 0
	 Number of sweeps 2
	 Time:  0.0018723011016845703
	 Time per sweep:  0.0009372234344482422
Starting Eigen solve with:
 	 0.0006000000000000001 
 	 sweeps: 10
	Starting Sweep: 0
	Step size: 1.000000
	Direction: -1
	Residual inf
	TT-sol rank: [2]
	Starting Sweep: 0
	Step size: 1.000000
	Direction: 1
	Residual 0
	TT-sol rank: [2]
	 -----
	 Solution rank is [1]
	 Step size: 1.000000
	 Residual 0
	 Number of sweeps 2
	 Time:  0.0016570091247558594
	 Time per sweep:  0.0008292198181152344
Step sizes: 1.0000, 1.0000
---Terminated---
Converged in 8 iterations.
Ranks X_tt: [2], Z_tt: [1], 
      Y_tt: [2], T_tt: None 

Converged after 8.0 iterations
Problem created in 0.001s
Problem solved in 0.395s
Complementary Slackness: 5.39012213274237e-06
Total feasibility error: 1.1876549918059715e-30
--- Run Summary ---
Converged after avg 8.0 iterations
Problem created in avg 0.001s
Problem solved in avg 0.395s
Complementary Slackness avg: 5.39012213274237e-06
Total feasibility error  avg: 1.1876549918059715e-30
[[0.4718 0.0257]]
[[  1.533 ]
 [-28.1869]]
✅ Completed dim=2 successfully

==== All runs completed at Mon May 19 05:27:44 PM BST 2025 ====
