==== maxcut TT-IPM Batch Run Started at Thu May 22 12:09:56 PM BST 2025 ====

▶ Running dim=7 with config=configs/maxcut_7.yaml at Thu May 22 12:09:56 PM BST 2025
Seed:  5

Results of iteration 0:
Finishing up: False
Is central: False, Is primal feasible:  False, Is dual feasible: False
Using AHO-Direction: True
Centrality Error: 1.1195992179751186
Primal-Dual Error: (np.float64(9.476128927366524), np.float64(64.44309769676636))
Sigma: 0.5
Ranks X_tt: [1, 1, 1, 1, 1, 1], Z_tt: [1, 1, 1, 1, 1, 1], 
      Y_tt: [1, 1, 1, 1, 1, 1], T_tt: None 

--- Step 1 ---
--- Predictor  step ---
	Starting Sweep:
	Max num of sweeps: 0
	Direction 1
	Residual inf
	TT-sol rank: [3, 3, 3, 3, 3, 3]
	Starting Sweep:
	Max num of sweeps: 1
	Direction -1
	Residual 1.120142937760124
	TT-sol rank: [4, 4, 4, 4, 5, 5]
	Starting Sweep:
	Max num of sweeps: 2
	Direction 1
	Residual 1.9312053504221772e-05
	TT-sol rank: [5, 6, 6, 6, 5, 4]
	Starting Sweep:
	Max num of sweeps: 3
	Direction -1
	Residual 3.600324772683018e-05
	TT-sol rank: [2, 3, 3, 3, 3, 3]

	---Results---
	Solution rank is [2 3 3 3 3 3]
	Residual  3.600324772683018e-05
	Number of sweeps 4
	Time:  0.3315141201019287
	Time per sweep:  0.08287948369979858

Starting Eigen solve with:
 	 0.00030000000000000003 
 	 sweeps: 10
	Starting Sweep: 0
	Step size: 1.000000
	Direction: -1
	Residual inf
	TT-sol rank: [4, 6, 10, 8, 4, 2]
	 -----
	 Solution rank is [1 2 2 2 2 1]
	 Step size: 1.000000
	 Residual 0
	 Number of sweeps 1
	 Time:  0.01793980598449707
	 Time per sweep:  0.0179443359375

Starting Eigen solve with:
 	 0.00030000000000000003 
 	 sweeps: 10
	Starting Sweep: 0
	Step size: 1.000000
	Direction: -1
	Residual inf
	TT-sol rank: [4, 6, 10, 8, 4, 2]
	 -----
	 Solution rank is [1 2 2 3 2 1]
	 Step size: 1.000000
	 Residual 0
	 Number of sweeps 1
	 Time:  0.011421442031860352
	 Time per sweep:  0.011425018310546875

--- Centering-Corrector  step ---
	Starting Sweep:
	Max num of sweeps: 0
	Direction 1
	Residual inf
	TT-sol rank: [3, 5, 4, 4, 3, 2]
	Starting Sweep:
	Max num of sweeps: 1
	Direction -1
	Residual 0.0736678211186055
	TT-sol rank: [4, 5, 5, 6, 6, 6]
	Starting Sweep:
	Max num of sweeps: 2
	Direction 1
	Residual 4.062602823695656e-05
	TT-sol rank: [5, 6, 6, 5, 5, 4]
	Starting Sweep:
	Max num of sweeps: 3
	Direction -1
	Residual 7.4279217329904e-05
	TT-sol rank: [2, 3, 3, 3, 3, 3]

	---Results---
	Solution rank is [2 3 3 3 3 3]
	Residual  7.4279217329904e-05
	Number of sweeps 4
	Time:  0.1891493797302246
	Time per sweep:  0.04728853702545166

Starting Eigen solve with:
 	 0.00030000000000000003 
 	 sweeps: 10
	Starting Sweep: 0
	Step size: 1.000000
	Direction: -1
	Residual inf
	TT-sol rank: [3, 4, 4, 4, 4, 2]
	 -----
	 Solution rank is [1 2 2 2 2 1]
	 Step size: 0.545597
	 Residual 0
	 Number of sweeps 1
	 Time:  0.017798185348510742
	 Time per sweep:  0.017801523208618164

Starting Eigen solve with:
 	 0.00030000000000000003 
 	 sweeps: 10
	Starting Sweep: 0
	Step size: 1.000000
	Direction: -1
	Residual inf
	TT-sol rank: [3, 4, 4, 5, 4, 2]
	 -----
	 Solution rank is [1 2 2 3 2 1]
	 Step size: 1.000000
	 Residual 0
	 Number of sweeps 1
	 Time:  0.011693477630615234
	 Time per sweep:  0.011698246002197266
Step sizes: 0.5059206564564173, 1.0

Results of iteration 1:
Finishing up: False
Is central: False, Is primal feasible:  False, Is dual feasible: False
Using AHO-Direction: False
Centrality Error: 0.7531256621349209
Primal-Dual Error: (np.float64(0.11220938510156223), np.float64(64.44285057515343))
Sigma: 0.0005231217003129873
Ranks X_tt: [3, 4, 4, 4, 4, 3], Z_tt: [3, 4, 3, 3, 3, 3], 
      Y_tt: [1, 2, 2, 2, 2, 1], T_tt: None 

--- Step 2 ---
--- Predictor  step ---
	Starting Sweep:
	Max num of sweeps: 0
	Direction 1
	Residual inf
	TT-sol rank: [3, 5, 4, 4, 3, 2]
	Starting Sweep:
	Max num of sweeps: 1
	Direction -1
	Residual 6.246756061830396
	TT-sol rank: [4, 5, 5, 6, 6, 5]
	Starting Sweep:
	Max num of sweeps: 2
	Direction 1
	Residual 0.00025985392046885066
	TT-sol rank: [5, 7, 7, 7, 5, 4]
	Starting Sweep:
	Max num of sweeps: 3
	Direction -1
	Residual 0.0003055029836579874
	TT-sol rank: [4, 5, 6, 7, 6, 5]
	Starting Sweep:
	Max num of sweeps: 4
	Direction 1
	Residual 0.0002663781125908954
	TT-sol rank: [5, 7, 7, 7, 5, 4]
	Starting Sweep:
	Max num of sweeps: 5
	Direction -1
	Residual 0.0003014673610333988
	TT-sol rank: [4, 5, 6, 7, 6, 5]

	---Results---
	Solution rank is [4 5 6 7 6 5]
	Residual  0.0003014673610333988
	Number of sweeps 6
	Time:  0.4951975345611572
	Time per sweep:  0.08253347873687744

Starting Eigen solve with:
 	 0.00030000000000000003 
 	 sweeps: 10
	Starting Sweep: 0
	Step size: 1.000000
	Direction: -1
	Residual inf
	TT-sol rank: [3, 4, 4, 4, 4, 2]
	 -----
	 Solution rank is [1 2 2 3 2 1]
	 Step size: 1.000000
	 Residual 0
	 Number of sweeps 1
	 Time:  0.013368368148803711
	 Time per sweep:  0.013371706008911133

Starting Eigen solve with:
 	 0.00030000000000000003 
 	 sweeps: 10
	Starting Sweep: 0
	Step size: 1.000000
	Direction: -1
	Residual inf
	TT-sol rank: [3, 4, 4, 5, 4, 2]
	 -----
	 Solution rank is [1 2 2 4 2 1]
	 Step size: 0.873537
	 Residual 0
	 Number of sweeps 1
	 Time:  0.017222166061401367
	 Time per sweep:  0.01722550392150879

--- Centering-Corrector  step ---
	Starting Sweep:
	Max num of sweeps: 0
	Direction 1
	Residual inf
	TT-sol rank: [3, 5, 5, 5, 3, 2]
	Starting Sweep:
	Max num of sweeps: 1
	Direction -1
	Residual 0.0023703616314235307
	TT-sol rank: [4, 5, 6, 7, 6, 5]
	Starting Sweep:
	Max num of sweeps: 2
	Direction 1
	Residual 0.00027821618322547637
	TT-sol rank: [5, 7, 7, 7, 5, 4]
	Starting Sweep:
	Max num of sweeps: 3
	Direction -1
	Residual 0.00031366262274962306
	TT-sol rank: [4, 5, 6, 7, 6, 5]
	Starting Sweep:
	Max num of sweeps: 4
	Direction 1
	Residual 0.0002571487445302396
	TT-sol rank: [5, 7, 7, 7, 5, 4]
	Starting Sweep:
	Max num of sweeps: 5
	Direction -1
	Residual 0.00031376901878533986
	TT-sol rank: [4, 5, 6, 7, 6, 5]

	---Results---
	Solution rank is [4 5 6 7 6 5]
	Residual  0.00031376901878533986
	Number of sweeps 6
	Time:  0.5173230171203613
	Time per sweep:  0.08622105916341145

Starting Eigen solve with:
 	 0.00030000000000000003 
 	 sweeps: 10
	Starting Sweep: 0
	Step size: 1.000000
	Direction: -1
	Residual inf
	TT-sol rank: [3, 4, 4, 5, 4, 2]
	 -----
	 Solution rank is [1 2 2 3 2 1]
	 Step size: 1.000000
	 Residual 0
	 Number of sweeps 1
	 Time:  0.02680373191833496
	 Time per sweep:  0.026807308197021484

Starting Eigen solve with:
 	 0.00030000000000000003 
 	 sweeps: 10
	Starting Sweep: 0
	Step size: 1.000000
	Direction: -1
	Residual inf
	TT-sol rank: [3, 4, 4, 6, 4, 2]
	 -----
	 Solution rank is [1 2 2 4 2 1]
	 Step size: 0.437606
	 Residual 0
	 Number of sweeps 1
	 Time:  0.01423192024230957
	 Time per sweep:  0.014235496520996094
Step sizes: 1.0, 0.4034208168077648

Results of iteration 2:
Finishing up: False
Is central: False, Is primal feasible:  False, Is dual feasible: False
Using AHO-Direction: False
Centrality Error: 0.06366595908633783
Primal-Dual Error: (np.float64(0.11226913005089308), np.float64(12.44720579995829))
Sigma: 0.004353937359335664
Ranks X_tt: [3, 4, 5, 5, 4, 3], Z_tt: [3, 5, 6, 6, 5, 3], 
      Y_tt: [1, 2, 2, 2, 2, 1], T_tt: None 

--- Step 3 ---
--- Predictor  step ---
	Starting Sweep:
	Max num of sweeps: 0
	Direction 1
	Residual inf
	TT-sol rank: [3, 5, 5, 5, 3, 2]
	Starting Sweep:
	Max num of sweeps: 1
	Direction -1
	Residual 5.761485644593221
	TT-sol rank: [4, 7, 9, 10, 10, 7]
	Starting Sweep:
	Max num of sweeps: 2
	Direction 1
	Residual 7.314045954617434e-05
	TT-sol rank: [7, 12, 13, 9, 7, 4]
	Starting Sweep:
	Max num of sweeps: 3
	Direction -1
	Residual 4.6076722168267803e-05
	TT-sol rank: [2, 5, 8, 8, 8, 5]

	---Results---
	Solution rank is [2 5 8 8 8 5]
	Residual  4.6076722168267803e-05
	Number of sweeps 4
	Time:  0.3080618381500244
	Time per sweep:  0.07701647281646729

Starting Eigen solve with:
 	 0.00030000000000000003 
 	 sweeps: 10
	Starting Sweep: 0
	Step size: 1.000000
	Direction: -1
	Residual inf
	TT-sol rank: [3, 4, 4, 5, 4, 2]
	 -----
	 Solution rank is [1 2 2 3 2 1]
	 Step size: 1.000000
	 Residual 0
	 Number of sweeps 1
	 Time:  0.013040542602539062
	 Time per sweep:  0.013044118881225586

Starting Eigen solve with:
 	 0.00030000000000000003 
 	 sweeps: 10
	Starting Sweep: 0
	Step size: 1.000000
	Direction: -1
	Residual inf
	TT-sol rank: [3, 4, 4, 6, 4, 2]
	 -----
	 Solution rank is [1 2 2 4 2 1]
	 Step size: 1.000000
	 Residual 0
	 Number of sweeps 1
	 Time:  0.015484809875488281
	 Time per sweep:  0.015489578247070312

--- Centering-Corrector  step ---

Starting MM solve with:
 	 0.0004 
 	 sweeps: 20
	Starting Sweep: 0
	Direction: -1
	Residual inf
	TT-sol rank: [4, 4, 4, 4, 4, 4]
	Starting Sweep: 0
	Direction: 1
	Residual 94.86342591568119
	TT-sol rank: [4, 6, 6, 5, 6, 4]
	Starting Sweep: 1
	Direction: -1
	Residual 0.059929620535842866
	TT-sol rank: [4, 7, 8, 7, 6, 4]
	Starting Sweep: 1
	Direction: 1
	Residual 0.002130094236971877
	TT-sol rank: [4, 7, 8, 7, 7, 4]
	Starting Sweep: 2
	Direction: -1
	Residual 0.0005339891194281423
	TT-sol rank: [4, 7, 9, 7, 7, 4]
	Starting Sweep: 2
	Direction: 1
	Residual 0.0001858747050038343
	TT-sol rank: [4, 7, 9, 7, 7, 4]
	 -----
	 Solution rank is [2 5 7 5 5 2]
	 Residual 3.0558366216141025e-05
	 Number of sweeps 4
	 Time:  0.06446051597595215
	 Time per sweep:  0.016115844249725342
	Starting Sweep:
	Max num of sweeps: 0
	Direction 1
	Residual inf
	TT-sol rank: [5, 10, 11, 7, 5, 2]
	Starting Sweep:
	Max num of sweeps: 1
	Direction -1
	Residual 0.03187909380591861
	TT-sol rank: [4, 7, 10, 10, 10, 7]
	Starting Sweep:
	Max num of sweeps: 2
	Direction 1
	Residual 7.030755638021033e-05
	TT-sol rank: [7, 12, 13, 9, 7, 4]
	Starting Sweep:
	Max num of sweeps: 3
	Direction -1
	Residual 5.179801935265459e-05
	TT-sol rank: [2, 5, 8, 8, 8, 5]

	---Results---
	Solution rank is [2 5 8 8 8 5]
	Residual  5.179801935265459e-05
	Number of sweeps 4
	Time:  1.0418391227722168
	Time per sweep:  0.2604610323905945

Starting Eigen solve with:
 	 0.00030000000000000003 
 	 sweeps: 10
	Starting Sweep: 0
	Step size: 1.000000
	Direction: -1
	Residual inf
	TT-sol rank: [3, 4, 4, 5, 4, 2]
	 -----
	 Solution rank is [1 2 2 3 2 1]
	 Step size: 1.000000
	 Residual 0
	 Number of sweeps 1
	 Time:  0.010471343994140625
	 Time per sweep:  0.010474443435668945

Starting Eigen solve with:
 	 0.00030000000000000003 
 	 sweeps: 10
	Starting Sweep: 0
	Step size: 1.000000
	Direction: -1
	Residual inf
	TT-sol rank: [3, 4, 4, 6, 4, 2]
	 -----
	 Solution rank is [1 2 2 4 2 1]
	 Step size: 0.505229
	 Residual 0
	 Number of sweeps 1
	 Time:  0.014065027236938477
	 Time per sweep:  0.014068603515625
Step sizes: 1.0, 0.4674688797923577

Results of iteration 3:
Finishing up: False
Is central: False, Is primal feasible:  False, Is dual feasible: False
Using AHO-Direction: True
Centrality Error: 0.007543987227753705
Primal-Dual Error: (np.float64(0.11220790118407714), np.float64(0.8090680792223028))
Sigma: 0.0009134430888424322
Ranks X_tt: [3, 6, 9, 8, 7, 3], Z_tt: [3, 6, 9, 9, 5, 3], 
      Y_tt: [1, 2, 2, 3, 2, 1], T_tt: None 

--- Step 4 ---
--- Predictor  step ---
	Starting Sweep:
	Max num of sweeps: 0
	Direction 1
	Residual inf
	TT-sol rank: [5, 11, 12, 8, 5, 2]
	Starting Sweep:
	Max num of sweeps: 1
	Direction -1
	Residual 10.585313979031774
	TT-sol rank: [4, 8, 13, 17, 13, 7]
	Starting Sweep:
	Max num of sweeps: 2
	Direction 1
	Residual 0.0003136651264485828
	TT-sol rank: [7, 15, 22, 18, 9, 4]
	Starting Sweep:
	Max num of sweeps: 3
	Direction -1
	Residual 7.464983529407319e-05
	TT-sol rank: [4, 8, 14, 24, 15, 7]
	Starting Sweep:
	Max num of sweeps: 4
	Direction 1
	Residual 2.947424908524199e-05
	TT-sol rank: [5, 13, 20, 18, 7, 2]

	---Results---
	Solution rank is [ 5 13 20 18  7  2]
	Residual  2.947424908524199e-05
	Number of sweeps 5
	Time:  1.2746822834014893
	Time per sweep:  0.25493736267089845

Starting Eigen solve with:
 	 0.00030000000000000003 
 	 sweeps: 10
	Starting Sweep: 0
	Step size: 1.000000
	Direction: -1
	Residual inf
	TT-sol rank: [3, 4, 4, 5, 4, 2]
	 -----
	 Solution rank is [1 2 2 3 2 1]
	 Step size: 1.000000
	 Residual 0
	 Number of sweeps 1
	 Time:  0.012730598449707031
	 Time per sweep:  0.012733936309814453

Starting Eigen solve with:
 	 0.00030000000000000003 
 	 sweeps: 10
	Starting Sweep: 0
	Step size: 1.000000
	Direction: -1
	Residual inf
	TT-sol rank: [3, 4, 4, 5, 4, 2]
	 -----
	 Solution rank is [1 2 2 4 2 1]
	 Step size: 0.514988
	 Residual 0
	 Number of sweeps 1
	 Time:  0.01601886749267578
	 Time per sweep:  0.016022443771362305

--- Centering-Corrector  step ---
	Starting Sweep:
	Max num of sweeps: 0
	Direction -1
	Residual inf
	TT-sol rank: [4, 12, 15, 15, 15, 6]
	Starting Sweep:
	Max num of sweeps: 1
	Direction 1
	Residual 67.30910885873482
	TT-sol rank: [7, 23, 25, 19, 9, 4]
	Starting Sweep:
	Max num of sweeps: 2
	Direction -1
	Residual 0.001747386147341416
	TT-sol rank: [4, 8, 14, 24, 15, 7]
	Starting Sweep:
	Max num of sweeps: 3
	Direction 1
	Residual 5.747983300032244e-05
	TT-sol rank: [7, 15, 22, 20, 9, 4]
	Starting Sweep:
	Max num of sweeps: 4
	Direction -1
	Residual 4.440809918448789e-05
	TT-sol rank: [2, 6, 12, 22, 13, 5]

	---Results---
	Solution rank is [ 2  6 12 22 13  5]
	Residual  4.440809918448789e-05
	Number of sweeps 5
	Time:  1.5678305625915527
	Time per sweep:  0.3135670185089111

Starting Eigen solve with:
 	 0.00030000000000000003 
 	 sweeps: 10
	Starting Sweep: 0
	Step size: 1.000000
	Direction: -1
	Residual inf
	TT-sol rank: [3, 4, 4, 5, 4, 2]
	 -----
	 Solution rank is [1 2 2 3 2 1]
	 Step size: 1.000000
	 Residual 0
	 Number of sweeps 1
	 Time:  0.014849185943603516
	 Time per sweep:  0.014853239059448242

Starting Eigen solve with:
 	 0.00030000000000000003 
 	 sweeps: 10
	Starting Sweep: 0
	Step size: 1.000000
	Direction: -1
	Residual inf
	TT-sol rank: [3, 4, 4, 5, 4, 2]
	 -----
	 Solution rank is [1 2 2 4 2 1]
	 Step size: 0.333759
	 Residual 0
	 Number of sweeps 1
	 Time:  0.014841318130493164
	 Time per sweep:  0.014844894409179688
Step sizes: 1.0, 0.30595287839842533

Results of iteration 4:
Finishing up: False
Is central: False, Is primal feasible:  False, Is dual feasible: False
Using AHO-Direction: True
Centrality Error: 0.003424284153514176
Primal-Dual Error: (np.float64(0.11226102718817217), np.float64(0.3134833779291492))
Sigma: 0.5149608017742343
Ranks X_tt: [3, 7, 13, 17, 8, 3], Z_tt: [3, 6, 9, 9, 5, 3], 
      Y_tt: [1, 2, 2, 3, 2, 1], T_tt: None 

--- Step 5 ---
--- Predictor  step ---
	Starting Sweep:
	Max num of sweeps: 0
	Direction 1
	Residual inf
	TT-sol rank: [5, 13, 15, 15, 7, 2]
	Starting Sweep:
	Max num of sweeps: 1
	Direction -1
	Residual 1.847530173143093
	TT-sol rank: [4, 8, 14, 18, 11, 6]
	Starting Sweep:
	Max num of sweeps: 2
	Direction 1
	Residual 0.0005594313370445221
	TT-sol rank: [7, 10, 15, 20, 10, 4]
	Starting Sweep:
	Max num of sweeps: 3
	Direction -1
	Residual 0.000534057181701532
	TT-sol rank: [4, 8, 14, 22, 13, 6]
	Starting Sweep:
	Max num of sweeps: 4
	Direction 1
	Residual 0.0004876734934699401
	TT-sol rank: [7, 11, 15, 22, 10, 4]
	Starting Sweep:
	Max num of sweeps: 5
	Direction -1
	Residual 0.0004989072983404747
	TT-sol rank: [4, 8, 14, 22, 13, 6]

	---Results---
	Solution rank is [ 4  8 14 22 13  6]
	Residual  0.0004989072983404747
	Number of sweeps 6
	Time:  4.376384496688843
	Time per sweep:  0.7293981313705444

Starting Eigen solve with:
 	 0.00030000000000000003 
 	 sweeps: 10
	Starting Sweep: 0
	Step size: 1.000000
	Direction: -1
	Residual inf
	TT-sol rank: [3, 4, 4, 5, 4, 2]
	 -----
	 Solution rank is [1 2 2 3 2 1]
	 Step size: 1.000000
	 Residual 0
	 Number of sweeps 1
	 Time:  0.014407157897949219
	 Time per sweep:  0.014412164688110352

Starting Eigen solve with:
 	 0.00030000000000000003 
 	 sweeps: 10
	Starting Sweep: 0
	Step size: 1.000000
	Direction: -1
	Residual inf
	TT-sol rank: [3, 4, 4, 5, 4, 2]
	 -----
	 Solution rank is [1 2 2 4 2 1]
	 Step size: 0.160841
	 Residual 0
	 Number of sweeps 1
	 Time:  0.016334056854248047
	 Time per sweep:  0.016338109970092773

--- Centering-Corrector  step ---

Starting MM solve with:
 	 0.0004 
 	 sweeps: 20
	Starting Sweep: 0
	Direction: -1
	Residual inf
	TT-sol rank: [4, 4, 4, 4, 4, 4]
	Starting Sweep: 0
	Direction: 1
	Residual 61.87275900317154
	TT-sol rank: [4, 6, 6, 6, 6, 4]
	Starting Sweep: 1
	Direction: -1
	Residual 0.2046101940741986
	TT-sol rank: [4, 8, 8, 8, 8, 4]
	Starting Sweep: 1
	Direction: 1
	Residual 0.04897141743362671
	TT-sol rank: [4, 8, 10, 10, 9, 4]
	Starting Sweep: 2
	Direction: -1
	Residual 0.012806398607546433
	TT-sol rank: [4, 8, 12, 12, 10, 4]
	Starting Sweep: 2
	Direction: 1
	Residual 0.008627608713322086
	TT-sol rank: [4, 8, 12, 14, 10, 4]
	Starting Sweep: 3
	Direction: -1
	Residual 0.0024724133934879823
	TT-sol rank: [4, 8, 12, 15, 10, 4]
	Starting Sweep: 3
	Direction: 1
	Residual 0.0010628457150921949
	TT-sol rank: [4, 8, 12, 16, 10, 4]
	Starting Sweep: 4
	Direction: -1
	Residual 0.00021996747083823058
	TT-sol rank: [4, 8, 12, 16, 10, 4]
	 -----
	 Solution rank is [ 2  6 10 14  8  2]
	 Residual 5.8571885697528643e-05
	 Number of sweeps 5
	 Time:  0.05634617805480957
	 Time per sweep:  0.011269855499267577
	Starting Sweep:
	Max num of sweeps: 0
	Direction 1
	Residual inf
	TT-sol rank: [4, 8, 13, 15, 8, 2]
	Starting Sweep:
	Max num of sweeps: 1
	Direction -1
	Residual 0.3309071350646541
	TT-sol rank: [4, 8, 13, 18, 12, 6]
	Starting Sweep:
	Max num of sweeps: 2
	Direction 1
	Residual 0.0032073039738644933
	TT-sol rank: [5, 9, 14, 19, 10, 4]
	Starting Sweep:
	Max num of sweeps: 3
	Direction -1
	Residual 0.0016628177632580514
	TT-sol rank: [4, 8, 13, 20, 12, 6]
	Starting Sweep:
	Max num of sweeps: 4
	Direction 1
	Residual 0.0032365019181308965
	TT-sol rank: [5, 9, 14, 20, 10, 4]
	Starting Sweep:
	Max num of sweeps: 5
	Direction -1
	Residual 0.0016685566453173268
	TT-sol rank: [4, 8, 13, 21, 12, 6]

	---Results---
	Solution rank is [ 4  8 13 21 12  6]
	Residual  0.0016685566453173268
	Number of sweeps 6
	Time:  3.390223979949951
	Time per sweep:  0.5650381247202555

Starting Eigen solve with:
 	 0.00030000000000000003 
 	 sweeps: 10
	Starting Sweep: 0
	Step size: 1.000000
	Direction: -1
	Residual inf
	TT-sol rank: [3, 4, 4, 5, 4, 2]
	 -----
	 Solution rank is [1 1 1 2 2 1]
	 Step size: 0.484959
	 Residual 0
	 Number of sweeps 1
	 Time:  0.019610166549682617
	 Time per sweep:  0.019614458084106445

Starting Eigen solve with:
 	 0.00030000000000000003 
 	 sweeps: 10
	Starting Sweep: 0
	Step size: 1.000000
	Direction: -1
	Residual inf
	TT-sol rank: [3, 4, 4, 6, 4, 2]
	 -----
	 Solution rank is [1 2 2 4 2 1]
	 Step size: 0.512223
	 Residual 0
	 Number of sweeps 1
	 Time:  0.02829575538635254
	 Time per sweep:  0.028300762176513672
Step sizes: 0.448222094941805, 0.47342092106686146

Results of iteration 5:
Finishing up: False
Is central: False, Is primal feasible:  False, Is dual feasible: False
Using AHO-Direction: True
Centrality Error: 0.0011250760637539152
Primal-Dual Error: (np.float64(0.011715363765565468), np.float64(0.016124620788998224))
Sigma: 0.6207455232489749
Ranks X_tt: [3, 7, 12, 19, 9, 3], Z_tt: [3, 7, 12, 10, 5, 3], 
      Y_tt: [1, 2, 2, 3, 2, 1], T_tt: None 

--- Step 6 ---
--- Predictor  step ---
	Starting Sweep:
	Max num of sweeps: 0
	Direction 1
	Residual inf
	TT-sol rank: [4, 7, 12, 15, 8, 2]
	Starting Sweep:
	Max num of sweeps: 1
	Direction -1
	Residual 7.856310437460893
	TT-sol rank: [4, 8, 13, 18, 12, 6]
	Starting Sweep:
	Max num of sweeps: 2
	Direction 1
	Residual 0.008273069364638041
	TT-sol rank: [6, 10, 16, 21, 10, 4]
	Starting Sweep:
	Max num of sweeps: 3
	Direction -1
	Residual 0.005646371548698623
	TT-sol rank: [4, 8, 13, 22, 12, 6]
	Starting Sweep:
	Max num of sweeps: 4
	Direction 1
	Residual 0.008575346625016737
	TT-sol rank: [6, 10, 16, 23, 10, 4]
	Starting Sweep:
	Max num of sweeps: 5
	Direction -1
	Residual 0.006062088506990877
	TT-sol rank: [4, 8, 13, 23, 12, 6]

	---Results---
	Solution rank is [ 4  8 13 23 12  6]
	Residual  0.006062088506990877
	Number of sweeps 6
	Time:  8.186887979507446
	Time per sweep:  1.3644822835922241

Starting Eigen solve with:
 	 0.00030000000000000003 
 	 sweeps: 10
	Starting Sweep: 0
	Step size: 1.000000
	Direction: -1
	Residual inf
	TT-sol rank: [3, 3, 3, 4, 4, 2]
	 -----
	 Solution rank is [1 1 1 2 2 1]
	 Step size: 0.979732
	 Residual 0
	 Number of sweeps 1
	 Time:  0.03249645233154297
	 Time per sweep:  0.032501935958862305

Starting Eigen solve with:
 	 0.00030000000000000003 
 	 sweeps: 10
	Starting Sweep: 0
	Step size: 1.000000
	Direction: -1
	Residual inf
	TT-sol rank: [3, 4, 4, 6, 4, 2]
	 -----
	 Solution rank is [1 2 2 4 2 1]
	 Step size: 0.463951
	 Residual 0
	 Number of sweeps 1
	 Time:  0.017022132873535156
	 Time per sweep:  0.017026662826538086

--- Centering-Corrector  step ---

Starting MM solve with:
 	 0.0004 
 	 sweeps: 20
	Starting Sweep: 0
	Direction: -1
	Residual inf
	TT-sol rank: [4, 4, 4, 4, 4, 4]
	Starting Sweep: 0
	Direction: 1
	Residual 403.2606234800046
	TT-sol rank: [4, 6, 6, 6, 6, 4]
	Starting Sweep: 1
	Direction: -1
	Residual 0.3200093308527515
	TT-sol rank: [4, 8, 8, 8, 8, 4]
	Starting Sweep: 1
	Direction: 1
	Residual 0.10984310958599787
	TT-sol rank: [4, 8, 10, 10, 9, 4]
	Starting Sweep: 2
	Direction: -1
	Residual 0.03479030683072516
	TT-sol rank: [4, 8, 11, 12, 9, 4]
	Starting Sweep: 2
	Direction: 1
	Residual 0.010172490659182952
	TT-sol rank: [4, 8, 11, 14, 10, 4]
	Starting Sweep: 3
	Direction: -1
	Residual 0.009653968820265141
	TT-sol rank: [4, 8, 12, 16, 10, 4]
	Starting Sweep: 3
	Direction: 1
	Residual 0.0018682225549241263
	TT-sol rank: [4, 8, 12, 18, 10, 4]
	Starting Sweep: 4
	Direction: -1
	Residual 0.00046590497501195014
	TT-sol rank: [4, 8, 12, 18, 10, 4]
	Starting Sweep: 4
	Direction: 1
	Residual 0.00017152079803546433
	TT-sol rank: [4, 8, 12, 18, 10, 4]
	 -----
	 Solution rank is [ 2  6 10 16  8  2]
	 Residual 3.135971196017877e-05
	 Number of sweeps 6
	 Time:  0.08519387245178223
	 Time per sweep:  0.014199535051981607
	Starting Sweep:
	Max num of sweeps: 0
	Direction 1
	Residual inf
	TT-sol rank: [5, 8, 14, 15, 8, 2]
	Starting Sweep:
	Max num of sweeps: 1
	Direction -1
	Residual 0.39256624890773667
	TT-sol rank: [4, 8, 13, 18, 12, 6]
	Starting Sweep:
	Max num of sweeps: 2
	Direction 1
	Residual 0.007965543568860528
	TT-sol rank: [6, 10, 16, 20, 10, 4]
	Starting Sweep:
	Max num of sweeps: 3
	Direction -1
	Residual 0.003024285833082924
	TT-sol rank: [4, 8, 14, 22, 12, 6]
	Starting Sweep:
	Max num of sweeps: 4
	Direction 1
	Residual 0.008272449515333399
	TT-sol rank: [6, 10, 16, 23, 10, 4]
	Starting Sweep:
	Max num of sweeps: 5
	Direction -1
	Residual 0.005049338752619164
	TT-sol rank: [4, 8, 14, 23, 12, 6]

	---Results---
	Solution rank is [ 4  8 14 23 12  6]
	Residual  0.005049338752619164
	Number of sweeps 6
	Time:  3.4666481018066406
	Time per sweep:  0.5777751604715983

Starting Eigen solve with:
 	 0.00030000000000000003 
 	 sweeps: 10
	Starting Sweep: 0
	Step size: 1.000000
	Direction: -1
	Residual inf
	TT-sol rank: [3, 3, 3, 4, 4, 2]
	 -----
	 Solution rank is [1 1 1 2 2 1]
	 Step size: 0.547013
	 Residual 0
	 Number of sweeps 1
	 Time:  0.007959842681884766
	 Time per sweep:  0.00796198844909668

Starting Eigen solve with:
 	 0.00030000000000000003 
 	 sweeps: 10
	Starting Sweep: 0
	Step size: 1.000000
	Direction: -1
	Residual inf
	TT-sol rank: [3, 4, 4, 6, 4, 2]
	 -----
	 Solution rank is [1 2 2 4 2 1]
	 Step size: 0.337046
	 Residual 0
	 Number of sweeps 1
	 Time:  0.008467912673950195
	 Time per sweep:  0.008469820022583008
Step sizes: 0.5015305708732467, 0.30902136540866726

Results of iteration 6:
Finishing up: False
Is central: True, Is primal feasible:  True, Is dual feasible: False
Using AHO-Direction: False
Centrality Error: 0.00017433561534297313
Primal-Dual Error: (np.float64(0.00011569635275258723), np.float64(0.005597092978280096))
Sigma: 0.2064121223768434
Ranks X_tt: [3, 7, 12, 17, 9, 3], Z_tt: [3, 7, 11, 10, 5, 3], 
      Y_tt: [1, 2, 2, 3, 2, 1], T_tt: None 

--- Step 7 ---
--- Predictor  step ---
	Starting Sweep:
	Max num of sweeps: 0
	Direction 1
	Residual inf
	TT-sol rank: [4, 8, 14, 15, 8, 2]
	Starting Sweep:
	Max num of sweeps: 1
	Direction -1
	Residual 18.72453624071044
	TT-sol rank: [4, 8, 14, 26, 17, 7]
	Starting Sweep:
	Max num of sweeps: 2
	Direction 1
	Residual 0.011195834930619729
	TT-sol rank: [7, 16, 27, 33, 10, 4]
	Starting Sweep:
	Max num of sweeps: 3
	Direction -1
	Residual 0.002821186957763624
	TT-sol rank: [4, 8, 14, 43, 17, 7]
	Starting Sweep:
	Max num of sweeps: 4
	Direction 1
	Residual 0.0011024928839915519
	TT-sol rank: [7, 16, 27, 34, 10, 4]
	Starting Sweep:
	Max num of sweeps: 5
	Direction -1
	Residual 0.002830028079153379
	TT-sol rank: [4, 8, 14, 43, 17, 7]

	---Results---
	Solution rank is [ 4  8 14 43 17  7]
	Residual  0.002830028079153379
	Number of sweeps 6
	Time:  3.579059600830078
	Time per sweep:  0.5965103308359782

Starting Eigen solve with:
 	 0.00030000000000000003 
 	 sweeps: 10
	Starting Sweep: 0
	Step size: 1.000000
	Direction: -1
	Residual inf
	TT-sol rank: [3, 3, 3, 4, 4, 2]
	 -----
	 Solution rank is [1 1 1 2 2 1]
	 Step size: 1.000000
	 Residual 0
	 Number of sweeps 1
	 Time:  0.0069866180419921875
	 Time per sweep:  0.0069887638092041016

Starting Eigen solve with:
 	 0.00030000000000000003 
 	 sweeps: 10
	Starting Sweep: 0
	Step size: 1.000000
	Direction: -1
	Residual inf
	TT-sol rank: [3, 4, 4, 5, 4, 2]
	 -----
	 Solution rank is [1 2 2 3 2 1]
	 Step size: 1.000000
	 Residual 0
	 Number of sweeps 1
	 Time:  0.008713006973266602
	 Time per sweep:  0.008714675903320312
Step sizes: 1.0, 1.0

Results of iteration 7:
Finishing up: True
Is central: True, Is primal feasible:  True, Is dual feasible: True
Using AHO-Direction: True
Centrality Error: 0.00017747543769739354
Primal-Dual Error: (np.float64(0.00013053961728074572), np.float64(0.0002585038162288688))
Sigma: 0
Ranks X_tt: [3, 7, 12, 17, 9, 3], Z_tt: [3, 6, 6, 6, 5, 3], 
      Y_tt: [1, 2, 2, 3, 2, 1], T_tt: None 

--- Step 8 ---
--- Predictor  step ---
	Starting Sweep:
	Max num of sweeps: 0
	Direction 1
	Residual inf
	TT-sol rank: [6, 15, 15, 15, 8, 2]
	Starting Sweep:
	Max num of sweeps: 1
	Direction -1
	Residual 2.8397188268797935
	TT-sol rank: [4, 8, 14, 19, 12, 5]
	Starting Sweep:
	Max num of sweeps: 2
	Direction 1
	Residual 0.02642020495042481
	TT-sol rank: [5, 10, 16, 22, 10, 4]
	Starting Sweep:
	Max num of sweeps: 3
	Direction -1
	Residual 0.02712471157036036
	TT-sol rank: [4, 8, 14, 24, 12, 5]
	Starting Sweep:
	Max num of sweeps: 4
	Direction 1
	Residual 0.02381041571217857
	TT-sol rank: [5, 10, 16, 24, 10, 4]
	Starting Sweep:
	Max num of sweeps: 5
	Direction -1
	Residual 0.027129896110831473
	TT-sol rank: [4, 8, 14, 24, 12, 5]

	---Results---
	Solution rank is [ 4  8 14 24 12  5]
	Residual  0.027129896110831473
	Number of sweeps 6
	Time:  4.13735294342041
	Time per sweep:  0.6895591417948405

Starting Eigen solve with:
 	 0.00030000000000000003 
 	 sweeps: 10
	Starting Sweep: 0
	Step size: 1.000000
	Direction: -1
	Residual inf
	TT-sol rank: [3, 3, 3, 4, 4, 2]
	 -----
	 Solution rank is [1 2 2 4 2 1]
	 Step size: 0.664922
	 Residual 0
	 Number of sweeps 1
	 Time:  0.009565353393554688
	 Time per sweep:  0.0095672607421875

Starting Eigen solve with:
 	 0.00030000000000000003 
 	 sweeps: 10
	Starting Sweep: 0
	Step size: 1.000000
	Direction: -1
	Residual inf
	TT-sol rank: [3, 4, 4, 5, 4, 2]
	 -----
	 Solution rank is [1 2 2 3 2 1]
	 Step size: 1.000000
	 Residual 0
	 Number of sweeps 1
	 Time:  0.008159637451171875
	 Time per sweep:  0.008162498474121094
Step sizes: 0.6205360253859898, 1.0

Results of iteration 8:
Finishing up: True
Is central: True, Is primal feasible:  True, Is dual feasible: True
Using AHO-Direction: True
Centrality Error: 4.7680442765857145e-05
Primal-Dual Error: (np.float64(5.937336184061487e-05), np.float64(1.629879126365831e-05))
Sigma: 0
Ranks X_tt: [2, 6, 9, 14, 8, 2], Z_tt: [2, 5, 5, 5, 4, 2], 
      Y_tt: [1, 2, 2, 3, 2, 1], T_tt: None 

--- Step 9 ---
--- Predictor  step ---
	Starting Sweep:
	Max num of sweeps: 0
	Direction 1
	Residual inf
	TT-sol rank: [4, 10, 15, 15, 8, 2]
	Starting Sweep:
	Max num of sweeps: 1
	Direction -1
	Residual 3.0825173767354626
	TT-sol rank: [4, 8, 13, 18, 12, 5]
	Starting Sweep:
	Max num of sweeps: 2
	Direction 1
	Residual 0.03496547232424504
	TT-sol rank: [5, 10, 16, 20, 10, 4]
	Starting Sweep:
	Max num of sweeps: 3
	Direction -1
	Residual 0.007140910975490502
	TT-sol rank: [4, 8, 14, 22, 12, 5]
	Starting Sweep:
	Max num of sweeps: 4
	Direction 1
	Residual 0.00983840372191366
	TT-sol rank: [5, 10, 16, 22, 10, 4]
	Starting Sweep:
	Max num of sweeps: 5
	Direction -1
	Residual 0.005866295947911514
	TT-sol rank: [4, 8, 14, 23, 12, 5]

	---Results---
	Solution rank is [ 4  8 14 23 12  5]
	Residual  0.005866295947911514
	Number of sweeps 6
	Time:  4.171027421951294
	Time per sweep:  0.695171594619751

Starting Eigen solve with:
 	 0.00030000000000000003 
 	 sweeps: 10
	Starting Sweep: 0
	Step size: 1.000000
	Direction: -1
	Residual inf
	TT-sol rank: [3, 4, 4, 6, 4, 2]
	 -----
	 Solution rank is [1 1 1 2 2 1]
	 Step size: 0.998348
	 Residual 0
	 Number of sweeps 1
	 Time:  0.011464834213256836
	 Time per sweep:  0.011468172073364258

Starting Eigen solve with:
 	 0.00030000000000000003 
 	 sweeps: 10
	Starting Sweep: 0
	Step size: 1.000000
	Direction: -1
	Residual inf
	TT-sol rank: [3, 4, 4, 5, 4, 2]
	 -----
	 Solution rank is [1 2 2 3 2 1]
	 Step size: 1.000000
	 Residual 0
	 Number of sweeps 1
	 Time:  0.011801481246948242
	 Time per sweep:  0.011804580688476562
Step sizes: 0.9483479766019095, 1.0

Results of iteration 9:
Finishing up: True
Is central: True, Is primal feasible:  False, Is dual feasible: True
Using AHO-Direction: True
Centrality Error: 1.526543151415136e-06
Primal-Dual Error: (np.float64(0.0006690671813256193), np.float64(8.68555494584877e-06))
Sigma: 0
Ranks X_tt: [1, 4, 5, 10, 5, 2], Z_tt: [2, 5, 5, 5, 4, 2], 
      Y_tt: [1, 2, 2, 3, 2, 1], T_tt: None 

--- Step 10 ---
--- Predictor  step ---
	Starting Sweep:
	Max num of sweeps: 0
	Direction 1
	Residual inf
	TT-sol rank: [4, 8, 14, 15, 8, 2]
	Starting Sweep:
	Max num of sweeps: 1
	Direction -1
	Residual 5.411152676659235
	TT-sol rank: [4, 9, 15, 21, 12, 5]
	Starting Sweep:
	Max num of sweeps: 2
	Direction 1
	Residual 0.024108504606657484
	TT-sol rank: [5, 12, 15, 22, 10, 4]
	Starting Sweep:
	Max num of sweeps: 3
	Direction -1
	Residual 0.024314153114854842
	TT-sol rank: [4, 10, 14, 24, 12, 5]
	Starting Sweep:
	Max num of sweeps: 4
	Direction 1
	Residual 0.005732442039407595
	TT-sol rank: [6, 12, 16, 24, 10, 4]
	Starting Sweep:
	Max num of sweeps: 5
	Direction -1
	Residual 0.012918127371714586
	TT-sol rank: [4, 10, 14, 25, 12, 5]

	---Results---
	Solution rank is [ 4 10 14 25 12  5]
	Residual  0.012918127371714586
	Number of sweeps 6
	Time:  3.446418285369873
	Time per sweep:  0.5744033654530843

Starting Eigen solve with:
 	 0.00030000000000000003 
 	 sweeps: 10
	Starting Sweep: 0
	Step size: 1.000000
	Direction: -1
	Residual inf
	TT-sol rank: [3, 3, 3, 4, 4, 2]
	 -----
	 Solution rank is [1 2 3 4 2 1]
	 Step size: 1.000000
	 Residual 0
	 Number of sweeps 1
	 Time:  0.008171558380126953
	 Time per sweep:  0.008173227310180664

Starting Eigen solve with:
 	 0.00030000000000000003 
 	 sweeps: 10
	Starting Sweep: 0
	Step size: 1.000000
	Direction: -1
	Residual inf
	TT-sol rank: [3, 4, 4, 5, 4, 2]
	 -----
	 Solution rank is [1 2 2 4 2 1]
	 Step size: 1.000000
	 Residual 0
	 Number of sweeps 1
	 Time:  0.006663799285888672
	 Time per sweep:  0.006665468215942383
Step sizes: 1.0, 1.0

Results of iteration 10:
Finishing up: True
Is central: True, Is primal feasible:  True, Is dual feasible: True
Using AHO-Direction: True
Centrality Error: -2.6718675242323146e-09
Primal-Dual Error: (np.float64(4.822338373098395e-05), np.float64(4.361153560653108e-06))
Sigma: 0
Ranks X_tt: [1, 4, 4, 10, 4, 1], Z_tt: [2, 5, 5, 5, 4, 2], 
      Y_tt: [1, 2, 2, 3, 2, 1], T_tt: None 

--- Step 11 ---
--- Predictor  step ---
	Starting Sweep:
	Max num of sweeps: 0
	Direction 1
	Residual inf
	TT-sol rank: [4, 12, 15, 15, 8, 2]
	Starting Sweep:
	Max num of sweeps: 1
	Direction -1
	Residual 8.703038399733423
	TT-sol rank: [4, 10, 16, 26, 17, 7]
	Starting Sweep:
	Max num of sweeps: 2
	Direction 1
	Residual 0.001904922028743871
	TT-sol rank: [7, 17, 24, 26, 10, 4]
	Starting Sweep:
	Max num of sweeps: 3
	Direction -1
	Residual 0.0014784856205880144
	TT-sol rank: [4, 10, 15, 30, 17, 8]
	Starting Sweep:
	Max num of sweeps: 4
	Direction 1
	Residual 0.001419212873138498
	TT-sol rank: [7, 17, 23, 26, 10, 4]
	Starting Sweep:
	Max num of sweeps: 5
	Direction -1
	Residual 0.0016358220518013476
	TT-sol rank: [4, 10, 15, 30, 18, 8]

	---Results---
	Solution rank is [ 4 10 15 30 18  8]
	Residual  0.0016358220518013476
	Number of sweeps 6
	Time:  4.470672607421875
	Time per sweep:  0.7451123793919882

Starting Eigen solve with:
 	 0.00030000000000000003 
 	 sweeps: 10
	Starting Sweep: 0
	Step size: 1.000000
	Direction: -1
	Residual inf
	TT-sol rank: [3, 4, 5, 6, 4, 2]
	 -----
	 Solution rank is [1 2 3 4 4 2]
	 Step size: 1.000000
	 Residual 0
	 Number of sweeps 1
	 Time:  0.009387493133544922
	 Time per sweep:  0.009389162063598633

Starting Eigen solve with:
 	 0.00030000000000000003 
 	 sweeps: 10
	Starting Sweep: 0
	Step size: 1.000000
	Direction: -1
	Residual inf
	TT-sol rank: [3, 4, 4, 6, 4, 2]
	 -----
	 Solution rank is [1 2 2 4 2 1]
	 Step size: 1.000000
	 Residual 0
	 Number of sweeps 1
	 Time:  0.007615566253662109
	 Time per sweep:  0.007617473602294922
Step sizes: 1.0, 1.0
---Terminated---
Converged in 11 iterations.
Ranks X_tt: [1, 4, 4, 10, 4, 1], Z_tt: [2, 5, 5, 5, 4, 2], 
      Y_tt: [1, 2, 2, 3, 2, 1], T_tt: None 

Converged after 11.0 iterations
Problem created in 0.001s
Problem solved in 46.952s
Complementary Slackness: 1.7251412520735698e-07
Total feasibility error: 7.597377159852254e-14
--- Run Summary ---
Converged after avg 11.0 iterations
Problem created in avg 0.001s
Problem solved in avg 46.952s
Complementary Slackness avg: 1.7251412520735698e-07
Total feasibility error avg: 7.597377159852254e-14
✅ Completed dim=7 successfully

==== All runs completed at Thu May 22 12:10:44 PM BST 2025 ====
