==== graphm TT-IPM Batch Run Started at Fri May 30 05:18:51 PM BST 2025 ====

▶ Running dim=2 with config=configs/graphm_2.yaml at Fri May 30 05:18:51 PM BST 2025
Seed:  5
Creating Problem...

Results of iteration 0:
Finishing up: False
Inequality active: active
Is central: False, Is primal feasible:  False, Is dual feasible: False
Using AHO-Direction: False
Centrality Error: 5.818181987215763
Primal-Dual Error: (np.float64(9.867390008536452), np.float64(16.007815334428997))
Sigma: 0.5
Ranks X_tt: [1, 1, 1, 1], Z_tt: [1, 1, 1, 1], 
      Y_tt: [1, 1, 1, 1], T_tt: [1, 2, 1, 2] 

--- Step 1 ---

--- Predictor  step ---

	---Starting Block-ALS---
	Starting Sweep: 0
	Direction 1
	Residual inf
	TT-sol rank: [4, 4, 4, 4]
	Starting Sweep: 1
	Direction -1
	Residual inf
	TT-sol rank: [4, 8, 8, 8]
	Starting Sweep: 2
	Direction 1
	Residual 95.18858656802088
	TT-sol rank: [7, 8, 8, 4]
	Starting Sweep: 3
	Direction -1
	Residual 0.0039523155938889975
	TT-sol rank: [4, 8, 8, 8]
	Starting Sweep: 4
	Direction 1
	Residual 0.0021233322084985187
	TT-sol rank: [7, 10, 7, 4]
	Starting Sweep: 5
	Direction -1
	Residual 0.00036322736411550943
	TT-sol rank: [4, 7, 8, 8]

	---Results---
	Solution rank is [4 7 8 8]
	Residual  0.00012495165237653706
	Number of sweeps 6
	Time:  0.1422717571258545
	Time per sweep:  0.023712515830993652

Starting Eigen solve with:
 	 0.00022500000000000002 
 	 sweeps: 10
	Starting Sweep: 0
	Step size: 1.000000
	Direction: -1
	Residual inf
	TT-sol rank: [4, 4, 4, 2]
	Starting Sweep: 0
	Step size: 0.943783
	Direction: 1
	Residual 0
	TT-sol rank: [2, 4, 5, 3]
	Starting Sweep: 1
	Step size: 0.943783
	Direction: -1
	Residual 0
	TT-sol rank: [3, 4, 4, 2]
	 -----
	 Solution rank is [1 2 2 1]
	 Step size: 0.943783
	 Residual 0
	 Number of sweeps 2
	 Time:  0.02507615089416504
	 Time per sweep:  0.012539863586425781

Starting Eigen solve with:
 	 0.00022500000000000002 
 	 sweeps: 10
	Starting Sweep: 0
	Step size: 1.000000
	Direction: -1
	Residual inf
	TT-sol rank: [4, 4, 4, 2]
	Starting Sweep: 0
	Step size: 1.000000
	Direction: 1
	Residual 0
	TT-sol rank: [2, 4, 5, 4]
	 -----
	 Solution rank is [2 3 3 2]
	 Step size: 1.000000
	 Residual 0
	 Number of sweeps 2
	 Time:  0.012560129165649414
	 Time per sweep:  0.006281256675720215

Starting Eigen solve with:
 	 0.00022500000000000002 
 	 sweeps: 10
	Starting Sweep: 0
	Direction: -1
	Residual inf
	TT-sol rank: [4, 4, 4, 4]
	Starting Sweep: 0
	Direction: 1
	Residual 0.026436118581549567
	TT-sol rank: [3, 3, 3, 3]
	Starting Sweep: 1
	Direction: -1
	Residual 2.608195387331179e-09
	TT-sol rank: [3, 3, 3, 3]
	 -----
	 Solution rank is [1 1 1 1]
	 Residual 1.2451159087793625e-17
	 Number of sweeps 2
	 Time:  0.015991926193237305
	 Time per sweep:  0.00799703598022461

--- Centering-Corrector  step ---

	---Starting Block-ALS---
	Starting Sweep: 0
	Direction 1
	Residual inf
	TT-sol rank: [8, 8, 8, 4]
	Starting Sweep: 1
	Direction -1
	Residual inf
	TT-sol rank: [4, 8, 8, 8]
	Starting Sweep: 2
	Direction 1
	Residual 193.0850133946779
	TT-sol rank: [8, 8, 8, 4]
	Starting Sweep: 3
	Direction -1
	Residual 0.03995923049192358
	TT-sol rank: [4, 8, 8, 8]
	Starting Sweep: 4
	Direction 1
	Residual 0.03995923049192358
	TT-sol rank: [10, 10, 10, 4]
	Starting Sweep: 5
	Direction -1
	Residual 0.02749294236397442
	TT-sol rank: [4, 10, 10, 10]
	Starting Sweep: 6
	Direction 1
	Residual 0.013349438349885402
	TT-sol rank: [11, 22, 13, 4]
	Starting Sweep: 7
	Direction -1
	Residual 0.0032649553434004044
	TT-sol rank: [4, 10, 15, 12]
	Starting Sweep: 8
	Direction 1
	Residual 0.0016011964422191227
	TT-sol rank: [9, 20, 14, 4]
	Starting Sweep: 9
	Direction -1
	Residual 3.630328346215601e-05
	TT-sol rank: [4, 10, 15, 12]

	---Results---
	Solution rank is [ 4 10 15 12]
	Residual  3.0735458138382736e-05
	Number of sweeps 10
	Time:  0.6043283939361572
	Time per sweep:  0.060433149337768555

Starting Eigen solve with:
 	 0.00022500000000000002 
 	 sweeps: 10
	Starting Sweep: 0
	Step size: 1.000000
	Direction: -1
	Residual inf
	TT-sol rank: [3, 4, 3, 2]
	Starting Sweep: 0
	Step size: 0.992360
	Direction: 1
	Residual 0
	TT-sol rank: [2, 4, 5, 4]
	Starting Sweep: 1
	Step size: 0.992360
	Direction: -1
	Residual 0
	TT-sol rank: [4, 5, 4, 2]
	 -----
	 Solution rank is [2 3 4 2]
	 Step size: 0.992360
	 Residual 0
	 Number of sweeps 2
	 Time:  0.022200584411621094
	 Time per sweep:  0.011101484298706055

Starting Eigen solve with:
 	 0.00022500000000000002 
 	 sweeps: 10
	Starting Sweep: 0
	Step size: 1.000000
	Direction: -1
	Residual inf
	TT-sol rank: [4, 5, 4, 2]
	Starting Sweep: 0
	Step size: 1.000000
	Direction: 1
	Residual 0
	TT-sol rank: [2, 4, 5, 4]
	 -----
	 Solution rank is [2 3 3 2]
	 Step size: 1.000000
	 Residual 0
	 Number of sweeps 2
	 Time:  0.010736227035522461
	 Time per sweep:  0.005369424819946289

Starting Eigen solve with:
 	 0.00022500000000000002 
 	 sweeps: 10
	Starting Sweep: 0
	Direction: -1
	Residual inf
	TT-sol rank: [3, 3, 3, 3]
	Starting Sweep: 0
	Direction: 1
	Residual 0.0014549884827444104
	TT-sol rank: [3, 3, 3, 3]
	Starting Sweep: 1
	Direction: -1
	Residual 9.658228340524284e-18
	TT-sol rank: [3, 3, 3, 3]
	 -----
	 Solution rank is [1 1 1 1]
	 Residual 9.658228340524284e-18
	 Number of sweeps 2
	 Time:  0.012605667114257812
	 Time per sweep:  0.006303906440734863
Step sizes: 0.9423625837196096, 1.0

Results of iteration 1:
Finishing up: False
Inequality active: inactive
Is central: False, Is primal feasible:  False, Is dual feasible: False
Using AHO-Direction: False
Centrality Error: 0.41949739382750034
Primal-Dual Error: (np.float64(0.5213199564438651), np.float64(0.08143298345524332))
Sigma: 0.015365702867912447
Ranks X_tt: [5, 10, 12, 5], Z_tt: [5, 10, 10, 5], 
      Y_tt: [4, 8, 9, 4], T_tt: [1, 2, 1, 2] 

--- Step 2 ---

--- Predictor  step ---

	---Starting Block-ALS---
	Starting Sweep: 0
	Direction 1
	Residual inf
	TT-sol rank: [3, 3, 3, 3]
	Starting Sweep: 1
	Direction -1
	Residual inf
	TT-sol rank: [4, 8, 8, 8]
	Starting Sweep: 2
	Direction 1
	Residual 110.18842586337033
	TT-sol rank: [8, 8, 8, 4]
	Starting Sweep: 3
	Direction -1
	Residual 0.1691531027771187
	TT-sol rank: [4, 8, 8, 8]
	Starting Sweep: 4
	Direction 1
	Residual 0.0836279265340618
	TT-sol rank: [10, 10, 10, 4]
	Starting Sweep: 5
	Direction -1
	Residual 0.07766283799129299
	TT-sol rank: [4, 10, 10, 10]
	Starting Sweep: 6
	Direction 1
	Residual 0.027576180047000666
	TT-sol rank: [11, 21, 14, 4]
	Starting Sweep: 7
	Direction -1
	Residual 0.0017301187571508246
	TT-sol rank: [4, 10, 16, 12]
	Starting Sweep: 8
	Direction 1
	Residual 0.0009028059618847717
	TT-sol rank: [11, 21, 14, 4]

	---Results---
	Solution rank is [11 21 14  4]
	Residual  0.00047636756510922694
	Number of sweeps 9
	Time:  2.2161471843719482
	Time per sweep:  0.2462388144599067

Starting Eigen solve with:
 	 0.00022500000000000002 
 	 sweeps: 10
	Starting Sweep: 0
	Step size: 1.000000
	Direction: -1
	Residual inf
	TT-sol rank: [4, 5, 4, 2]
	Starting Sweep: 0
	Step size: 0.985663
	Direction: 1
	Residual 0
	TT-sol rank: [2, 4, 6, 4]
	Starting Sweep: 1
	Step size: 0.985663
	Direction: -1
	Residual 0
	TT-sol rank: [4, 5, 4, 2]
	 -----
	 Solution rank is [2 3 4 2]
	 Step size: 0.985663
	 Residual 0
	 Number of sweeps 2
	 Time:  0.012519359588623047
	 Time per sweep:  0.0062607526779174805

Starting Eigen solve with:
 	 0.00022500000000000002 
 	 sweeps: 10
	Starting Sweep: 0
	Step size: 1.000000
	Direction: -1
	Residual inf
	TT-sol rank: [4, 5, 4, 2]
	Starting Sweep: 0
	Step size: 1.000000
	Direction: 1
	Residual 0
	TT-sol rank: [2, 4, 5, 4]
	 -----
	 Solution rank is [2 3 3 2]
	 Step size: 1.000000
	 Residual 0
	 Number of sweeps 2
	 Time:  0.007425546646118164
	 Time per sweep:  0.003713846206665039

Starting Eigen solve with:
 	 0.00022500000000000002 
 	 sweeps: 10
	Starting Sweep: 0
	Direction: -1
	Residual inf
	TT-sol rank: [3, 3, 3, 3]
	Starting Sweep: 0
	Direction: 1
	Residual 0.0005884359227772418
	TT-sol rank: [3, 3, 3, 3]
	Starting Sweep: 1
	Direction: -1
	Residual 4.389135327841519e-18
	TT-sol rank: [3, 3, 3, 3]
	 -----
	 Solution rank is [1 1 1 1]
	 Residual 4.389135327841519e-18
	 Number of sweeps 2
	 Time:  0.007231950759887695
	 Time per sweep:  0.0036165714263916016

--- Centering-Corrector  step ---

	---Starting Block-ALS---
	Starting Sweep: 0
	Direction -1
	Residual inf
	TT-sol rank: [4, 8, 8, 8]
	Starting Sweep: 1
	Direction 1
	Residual inf
	TT-sol rank: [8, 8, 8, 4]
	Starting Sweep: 2
	Direction -1
	Residual 84.12840918417226
	TT-sol rank: [4, 8, 8, 8]
	Starting Sweep: 3
	Direction 1
	Residual 0.21361265167535695
	TT-sol rank: [8, 8, 8, 4]
	Starting Sweep: 4
	Direction -1
	Residual 0.26140067391518224
	TT-sol rank: [4, 10, 10, 10]
	Starting Sweep: 5
	Direction 1
	Residual 0.26140067391518224
	TT-sol rank: [10, 10, 10, 4]
	Starting Sweep: 6
	Direction -1
	Residual 0.018534372491116835
	TT-sol rank: [4, 10, 20, 12]
	Starting Sweep: 7
	Direction 1
	Residual 0.018534372491116835
	TT-sol rank: [11, 22, 15, 4]
	Starting Sweep: 8
	Direction -1
	Residual 0.0014393246976155433
	TT-sol rank: [4, 10, 21, 12]

	---Results---
	Solution rank is [ 4 10 21 12]
	Residual  0.0007871043092987269
	Number of sweeps 9
	Time:  2.8438100814819336
	Time per sweep:  0.3159790833791097

Starting Eigen solve with:
 	 0.00022500000000000002 
 	 sweeps: 10
	Starting Sweep: 0
	Step size: 1.000000
	Direction: -1
	Residual inf
	TT-sol rank: [4, 5, 4, 2]
	Starting Sweep: 0
	Step size: 0.949837
	Direction: 1
	Residual 0
	TT-sol rank: [2, 4, 6, 4]
	 -----
	 Solution rank is [2 3 4 2]
	 Step size: 0.949837
	 Residual 0
	 Number of sweeps 2
	 Time:  0.007264137268066406
	 Time per sweep:  0.0036330223083496094

Starting Eigen solve with:
 	 0.00022500000000000002 
 	 sweeps: 10
	Starting Sweep: 0
	Step size: 1.000000
	Direction: -1
	Residual inf
	TT-sol rank: [4, 5, 4, 2]
	Starting Sweep: 0
	Step size: 0.968550
	Direction: 1
	Residual 0
	TT-sol rank: [2, 4, 6, 4]
	Starting Sweep: 1
	Step size: 0.968550
	Direction: -1
	Residual 0
	TT-sol rank: [4, 5, 4, 2]
	 -----
	 Solution rank is [2 3 4 2]
	 Step size: 0.968550
	 Residual 0
	 Number of sweeps 2
	 Time:  0.009024620056152344
	 Time per sweep:  0.004513144493103027

Starting Eigen solve with:
 	 0.00022500000000000002 
 	 sweeps: 10
	Starting Sweep: 0
	Direction: -1
	Residual inf
	TT-sol rank: [3, 3, 3, 3]
	Starting Sweep: 0
	Direction: 1
	Residual 4.603072549440366e-18
	TT-sol rank: [3, 3, 3, 3]
	 -----
	 Solution rank is [1 1 1 1]
	 Residual 1.352234088094463e-18
	 Number of sweeps 2
	 Time:  0.004921436309814453
	 Time per sweep:  0.0024613142013549805
Step sizes: 0.8999624192540723, 0.9176933725007439

Results of iteration 2:
Finishing up: False
Inequality active: inactive
Is central: False, Is primal feasible:  False, Is dual feasible: False
Using AHO-Direction: False
Centrality Error: 0.03562624419552563
Primal-Dual Error: (np.float64(0.03098124791694313), np.float64(0.0041466788455075685))
Sigma: 0.009744619853579686
Ranks X_tt: [5, 10, 13, 5], Z_tt: [5, 11, 12, 5], 
      Y_tt: [4, 10, 13, 4], T_tt: [1, 2, 1, 2] 

--- Step 3 ---

--- Predictor  step ---

	---Starting Block-ALS---
	Starting Sweep: 0
	Direction 1
	Residual inf
	TT-sol rank: [8, 8, 8, 4]
	Starting Sweep: 1
	Direction -1
	Residual inf
	TT-sol rank: [4, 8, 8, 8]
	Starting Sweep: 2
	Direction 1
	Residual 2.4306747983549335
	TT-sol rank: [8, 8, 8, 4]
	Starting Sweep: 3
	Direction -1
	Residual 0.2937163893023691
	TT-sol rank: [4, 8, 8, 8]
	Starting Sweep: 4
	Direction 1
	Residual 0.2937163893023691
	TT-sol rank: [10, 10, 10, 4]
	Starting Sweep: 5
	Direction -1
	Residual 0.1740171870182796
	TT-sol rank: [4, 10, 10, 10]
	Starting Sweep: 6
	Direction 1
	Residual 0.1740171870182796
	TT-sol rank: [11, 22, 16, 4]
	Starting Sweep: 7
	Direction -1
	Residual 0.06443740515250408
	TT-sol rank: [4, 10, 22, 12]
	Starting Sweep: 8
	Direction 1
	Residual 0.007849624387472774
	TT-sol rank: [11, 26, 16, 4]
	Starting Sweep: 9
	Direction -1
	Residual 0.003827069555208939
	TT-sol rank: [4, 10, 30, 12]

	---Results---
	Solution rank is [ 4 10 30 12]
	Residual  3.4199657700909585e-05
	Number of sweeps 10
	Time:  6.5678911209106445
	Time per sweep:  0.6567893266677857

Starting Eigen solve with:
 	 0.00022500000000000002 
 	 sweeps: 10
	Starting Sweep: 0
	Step size: 1.000000
	Direction: -1
	Residual inf
	TT-sol rank: [4, 5, 4, 2]
	Starting Sweep: 0
	Step size: 0.982419
	Direction: 1
	Residual 0
	TT-sol rank: [2, 4, 6, 4]
	Starting Sweep: 1
	Step size: 0.982419
	Direction: -1
	Residual 0
	TT-sol rank: [4, 5, 4, 2]
	 -----
	 Solution rank is [2 3 4 2]
	 Step size: 0.982419
	 Residual 0
	 Number of sweeps 2
	 Time:  0.01027989387512207
	 Time per sweep:  0.005140900611877441

Starting Eigen solve with:
 	 0.00022500000000000002 
 	 sweeps: 10
	Starting Sweep: 0
	Step size: 1.000000
	Direction: -1
	Residual inf
	TT-sol rank: [4, 5, 4, 2]
	Starting Sweep: 0
	Step size: 0.941971
	Direction: 1
	Residual 0
	TT-sol rank: [2, 4, 6, 4]
	Starting Sweep: 1
	Step size: 0.941971
	Direction: -1
	Residual 0
	TT-sol rank: [4, 5, 4, 2]
	 -----
	 Solution rank is [2 3 4 2]
	 Step size: 0.941971
	 Residual 0
	 Number of sweeps 2
	 Time:  0.00953984260559082
	 Time per sweep:  0.004770636558532715

Starting Eigen solve with:
 	 0.00022500000000000002 
 	 sweeps: 10
	Starting Sweep: 0
	Direction: -1
	Residual inf
	TT-sol rank: [3, 3, 3, 3]
	Starting Sweep: 0
	Direction: 1
	Residual 6.700362621612615e-18
	TT-sol rank: [3, 3, 3, 3]
	 -----
	 Solution rank is [1 1 1 1]
	 Residual 6.700362621612615e-18
	 Number of sweeps 2
	 Time:  0.003995656967163086
	 Time per sweep:  0.0019985437393188477

--- Centering-Corrector  step ---

	---Starting Block-ALS---
	Starting Sweep: 0
	Direction 1
	Residual inf
	TT-sol rank: [8, 8, 8, 4]
	Starting Sweep: 1
	Direction -1
	Residual inf
	TT-sol rank: [4, 8, 8, 8]
	Starting Sweep: 2
	Direction 1
	Residual 0.9241751392886498
	TT-sol rank: [8, 8, 8, 4]
	Starting Sweep: 3
	Direction -1
	Residual 0.41969567046726314
	TT-sol rank: [4, 8, 8, 8]
	Starting Sweep: 4
	Direction 1
	Residual 0.41969567046726314
	TT-sol rank: [10, 10, 10, 4]
	Starting Sweep: 5
	Direction -1
	Residual 0.7801786880776928
	TT-sol rank: [4, 10, 10, 10]
	Starting Sweep: 6
	Direction 1
	Residual 0.7801786880776928
	TT-sol rank: [11, 22, 16, 4]
	Starting Sweep: 7
	Direction -1
	Residual 0.1814672571671052
	TT-sol rank: [4, 10, 22, 12]
	Starting Sweep: 8
	Direction 1
	Residual 0.006480913401521393
	TT-sol rank: [11, 26, 16, 4]
	Starting Sweep: 9
	Direction -1
	Residual 0.004675648528826515
	TT-sol rank: [4, 10, 31, 12]

	---Results---
	Solution rank is [ 4 10 31 12]
	Residual  3.552250218258623e-05
	Number of sweeps 10
	Time:  6.440688848495483
	Time per sweep:  0.6440690517425537

Starting Eigen solve with:
 	 0.00022500000000000002 
 	 sweeps: 10
	Starting Sweep: 0
	Step size: 1.000000
	Direction: -1
	Residual inf
	TT-sol rank: [4, 5, 4, 2]
	Starting Sweep: 0
	Step size: 0.647548
	Direction: 1
	Residual 0
	TT-sol rank: [2, 4, 6, 4]
	Starting Sweep: 1
	Step size: 0.647548
	Direction: -1
	Residual 0
	TT-sol rank: [4, 5, 4, 2]
	 -----
	 Solution rank is [2 3 4 2]
	 Step size: 0.647548
	 Residual 0
	 Number of sweeps 2
	 Time:  0.009648323059082031
	 Time per sweep:  0.004825115203857422

Starting Eigen solve with:
 	 0.00022500000000000002 
 	 sweeps: 10
	Starting Sweep: 0
	Step size: 1.000000
	Direction: -1
	Residual inf
	TT-sol rank: [4, 5, 4, 2]
	Starting Sweep: 0
	Step size: 0.603109
	Direction: 1
	Residual 0
	TT-sol rank: [2, 4, 6, 4]
	Starting Sweep: 1
	Step size: 0.603109
	Direction: -1
	Residual 0
	TT-sol rank: [4, 5, 4, 2]
	 -----
	 Solution rank is [2 3 4 2]
	 Step size: 0.603109
	 Residual 0
	 Number of sweeps 2
	 Time:  0.008893966674804688
	 Time per sweep:  0.004448413848876953

Starting Eigen solve with:
 	 0.00022500000000000002 
 	 sweeps: 10
	Starting Sweep: 0
	Direction: -1
	Residual inf
	TT-sol rank: [3, 3, 3, 3]
	Starting Sweep: 0
	Direction: 1
	Residual 1.1277387078856645e-17
	TT-sol rank: [3, 3, 3, 3]
	 -----
	 Solution rank is [1 1 1 1]
	 Residual 1.1277387078856645e-17
	 Number of sweeps 2
	 Time:  0.003927707672119141
	 Time per sweep:  0.001964569091796875
Step sizes: 0.6023205644767083, 0.5609849738463732

Results of iteration 3:
Finishing up: False
Inequality active: inactive
Is central: False, Is primal feasible:  False, Is dual feasible: False
Using AHO-Direction: True
Centrality Error: 0.005141496532383094
Primal-Dual Error: (np.float64(0.0026151895505935135), np.float64(0.0006226256222148617))
Sigma: 0.006954442382825649
Ranks X_tt: [5, 10, 14, 5], Z_tt: [5, 11, 13, 5], 
      Y_tt: [4, 10, 12, 4], T_tt: [1, 2, 1, 2] 

--- Step 4 ---

--- Predictor  step ---

	---Starting Block-ALS---
	Starting Sweep: 0
	Direction 1
	Residual inf
	TT-sol rank: [8, 8, 8, 4]
	Starting Sweep: 1
	Direction -1
	Residual inf
	TT-sol rank: [4, 8, 8, 8]
	Starting Sweep: 2
	Direction 1
	Residual 0.5822129971989343
	TT-sol rank: [8, 8, 8, 4]
	Starting Sweep: 3
	Direction -1
	Residual 1.0279145779832806
	TT-sol rank: [4, 8, 8, 8]
	Starting Sweep: 4
	Direction 1
	Residual 1.0279145779832806
	TT-sol rank: [10, 10, 10, 4]
	Starting Sweep: 5
	Direction -1
	Residual 2.309889395404463
	TT-sol rank: [4, 10, 10, 10]
	Starting Sweep: 6
	Direction 1
	Residual 2.309889395404463
	TT-sol rank: [11, 22, 16, 4]
	Starting Sweep: 7
	Direction -1
	Residual 0.7133933804618288
	TT-sol rank: [4, 10, 22, 12]
	Starting Sweep: 8
	Direction 1
	Residual 0.04187705842803095
	TT-sol rank: [11, 26, 15, 4]
	Starting Sweep: 9
	Direction -1
	Residual 0.009069572897125362
	TT-sol rank: [4, 10, 24, 12]

	---Results---
	Solution rank is [ 4 10 24 12]
	Residual  0.0073858798168669245
	Number of sweeps 10
	Time:  6.3942930698394775
	Time per sweep:  0.6394295215606689

Starting Eigen solve with:
 	 0.00022500000000000002 
 	 sweeps: 10
	Starting Sweep: 0
	Step size: 1.000000
	Direction: -1
	Residual inf
	TT-sol rank: [4, 5, 4, 2]
	Starting Sweep: 0
	Step size: 0.862014
	Direction: 1
	Residual 0
	TT-sol rank: [2, 4, 6, 4]
	Starting Sweep: 1
	Step size: 0.862014
	Direction: -1
	Residual 0
	TT-sol rank: [4, 5, 4, 2]
	 -----
	 Solution rank is [2 3 4 2]
	 Step size: 0.862014
	 Residual 0
	 Number of sweeps 2
	 Time:  0.011688232421875
	 Time per sweep:  0.005845069885253906

Starting Eigen solve with:
 	 0.00022500000000000002 
 	 sweeps: 10
	Starting Sweep: 0
	Step size: 1.000000
	Direction: -1
	Residual inf
	TT-sol rank: [4, 5, 4, 2]
	Starting Sweep: 0
	Step size: 0.553243
	Direction: 1
	Residual 0
	TT-sol rank: [2, 4, 6, 4]
	Starting Sweep: 1
	Step size: 0.553243
	Direction: -1
	Residual 0
	TT-sol rank: [4, 5, 4, 2]
	 -----
	 Solution rank is [2 3 4 2]
	 Step size: 0.553243
	 Residual 0
	 Number of sweeps 2
	 Time:  0.00922083854675293
	 Time per sweep:  0.0046111345291137695

Starting Eigen solve with:
 	 0.00022500000000000002 
 	 sweeps: 10
	Starting Sweep: 0
	Direction: -1
	Residual inf
	TT-sol rank: [3, 3, 3, 3]
	Starting Sweep: 0
	Direction: 1
	Residual 3.2046313544813916e-17
	TT-sol rank: [3, 3, 3, 3]
	 -----
	 Solution rank is [1 1 1 1]
	 Residual 8.630900010364154e-20
	 Number of sweeps 2
	 Time:  0.0038809776306152344
	 Time per sweep:  0.0019413232803344727

--- Centering-Corrector  step ---

	---Starting Block-ALS---
	Starting Sweep: 0
	Direction 1
	Residual inf
	TT-sol rank: [8, 8, 8, 4]
	Starting Sweep: 1
	Direction -1
	Residual inf
	TT-sol rank: [4, 8, 8, 8]
	Starting Sweep: 2
	Direction 1
	Residual 1.5415730661039695
	TT-sol rank: [8, 8, 8, 4]
	Starting Sweep: 3
	Direction -1
	Residual 0.7489704646632518
	TT-sol rank: [4, 8, 8, 8]
	Starting Sweep: 4
	Direction 1
	Residual 1.6840053405065063
	TT-sol rank: [10, 10, 10, 4]
	Starting Sweep: 5
	Direction -1
	Residual 1.6840053405065063
	TT-sol rank: [4, 10, 10, 10]
	Starting Sweep: 6
	Direction 1
	Residual 1.3575403411438554
	TT-sol rank: [11, 22, 16, 4]
	Starting Sweep: 7
	Direction -1
	Residual 1.3575403411438554
	TT-sol rank: [4, 10, 21, 12]
	Starting Sweep: 8
	Direction 1
	Residual 0.13480427849569188
	TT-sol rank: [11, 25, 15, 4]
	Starting Sweep: 9
	Direction -1
	Residual 0.016795104712234683
	TT-sol rank: [4, 10, 24, 12]

	---Results---
	Solution rank is [ 4 10 24 12]
	Residual  0.011074605002192723
	Number of sweeps 10
	Time:  6.544482946395874
	Time per sweep:  0.6544484853744507

Starting Eigen solve with:
 	 0.00022500000000000002 
 	 sweeps: 10
	Starting Sweep: 0
	Step size: 1.000000
	Direction: -1
	Residual inf
	TT-sol rank: [4, 5, 4, 2]
	Starting Sweep: 0
	Step size: 0.196992
	Direction: 1
	Residual 0
	TT-sol rank: [2, 4, 6, 4]
	Starting Sweep: 1
	Step size: 0.196992
	Direction: -1
	Residual 0
	TT-sol rank: [4, 5, 4, 2]
	 -----
	 Solution rank is [2 3 4 2]
	 Step size: 0.196992
	 Residual 0
	 Number of sweeps 2
	 Time:  0.009435892105102539
	 Time per sweep:  0.004718899726867676

Starting Eigen solve with:
 	 0.00022500000000000002 
 	 sweeps: 10
	Starting Sweep: 0
	Step size: 1.000000
	Direction: -1
	Residual inf
	TT-sol rank: [4, 5, 4, 2]
	Starting Sweep: 0
	Step size: 0.127215
	Direction: 1
	Residual 0
	TT-sol rank: [2, 4, 6, 4]
	Starting Sweep: 1
	Step size: 0.127215
	Direction: -1
	Residual 0
	TT-sol rank: [4, 5, 4, 2]
	 -----
	 Solution rank is [2 3 4 2]
	 Step size: 0.127215
	 Residual 0
	 Number of sweeps 2
	 Time:  0.00825357437133789
	 Time per sweep:  0.00412750244140625

Starting Eigen solve with:
 	 0.00022500000000000002 
 	 sweeps: 10
	Starting Sweep: 0
	Direction: -1
	Residual inf
	TT-sol rank: [3, 3, 3, 3]
	Starting Sweep: 0
	Direction: 1
	Residual 9.853975968693266e-20
	TT-sol rank: [3, 3, 3, 3]
	 -----
	 Solution rank is [1 1 1 1]
	 Residual 5.349353355161607e-20
	 Number of sweeps 2
	 Time:  0.004011392593383789
	 Time per sweep:  0.0020064115524291992
Step sizes: 0.1785454590433792, 0.11530309482282258

Results of iteration 4:
Finishing up: False
Inequality active: inactive
Is central: False, Is primal feasible:  False, Is dual feasible: True
Using AHO-Direction: True
Centrality Error: 0.0023123651710598284
Primal-Dual Error: (np.float64(0.000590343082995089), np.float64(0.0003321452859870767))
Sigma: 0.4558558021372643
Ranks X_tt: [5, 10, 13, 5], Z_tt: [5, 11, 12, 5], 
      Y_tt: [4, 10, 13, 4], T_tt: [1, 2, 1, 2] 

--- Step 5 ---

--- Predictor  step ---

	---Starting Block-ALS---
	Starting Sweep: 0
	Direction 1
	Residual inf
	TT-sol rank: [8, 8, 8, 4]
	Starting Sweep: 1
	Direction -1
	Residual inf
	TT-sol rank: [4, 8, 8, 8]
	Starting Sweep: 2
	Direction 1
	Residual 2.8714667483712724
	TT-sol rank: [8, 8, 8, 4]
	Starting Sweep: 3
	Direction -1
	Residual 2.4270881195716285
	TT-sol rank: [4, 8, 8, 8]
	Starting Sweep: 4
	Direction 1
	Residual 2.4270881195716285
	TT-sol rank: [10, 10, 10, 4]
	Starting Sweep: 5
	Direction -1
	Residual 4.6942773276055405
	TT-sol rank: [4, 10, 10, 10]
	Starting Sweep: 6
	Direction 1
	Residual 4.6942773276055405
	TT-sol rank: [11, 22, 16, 4]
	Starting Sweep: 7
	Direction -1
	Residual 1.1854073866473016
	TT-sol rank: [4, 11, 22, 12]
	Starting Sweep: 8
	Direction 1
	Residual 0.07010765823981008
	TT-sol rank: [11, 22, 15, 4]
	Starting Sweep: 9
	Direction -1
	Residual 0.07404060289648719
	TT-sol rank: [4, 10, 21, 12]

	---Results---
	Solution rank is [ 4 10 21 12]
	Residual  0.031097872072241364
	Number of sweeps 10
	Time:  6.772106647491455
	Time per sweep:  0.6772108554840088

Starting Eigen solve with:
 	 0.00022500000000000002 
 	 sweeps: 10
	Starting Sweep: 0
	Step size: 1.000000
	Direction: -1
	Residual inf
	TT-sol rank: [4, 5, 4, 2]
	Starting Sweep: 0
	Step size: 0.563469
	Direction: 1
	Residual 0
	TT-sol rank: [2, 4, 6, 4]
	Starting Sweep: 1
	Step size: 0.563469
	Direction: -1
	Residual 0
	TT-sol rank: [4, 5, 4, 2]
	 -----
	 Solution rank is [2 3 4 2]
	 Step size: 0.563469
	 Residual 0
	 Number of sweeps 2
	 Time:  0.008728265762329102
	 Time per sweep:  0.004364967346191406

Starting Eigen solve with:
 	 0.00022500000000000002 
 	 sweeps: 10
	Starting Sweep: 0
	Step size: 1.000000
	Direction: -1
	Residual inf
	TT-sol rank: [4, 5, 4, 2]
	Starting Sweep: 0
	Step size: 0.512930
	Direction: 1
	Residual 0
	TT-sol rank: [2, 4, 6, 4]
	Starting Sweep: 1
	Step size: 0.512930
	Direction: -1
	Residual 0
	TT-sol rank: [4, 6, 4, 2]
	 -----
	 Solution rank is [2 4 4 2]
	 Step size: 0.512930
	 Residual 0
	 Number of sweeps 2
	 Time:  0.011010169982910156
	 Time per sweep:  0.005505919456481934

Starting Eigen solve with:
 	 0.00022500000000000002 
 	 sweeps: 10
	Starting Sweep: 0
	Direction: -1
	Residual inf
	TT-sol rank: [3, 3, 3, 3]
	Starting Sweep: 0
	Direction: 1
	Residual 2.302997084756385e-20
	TT-sol rank: [3, 3, 3, 3]
	 -----
	 Solution rank is [1 1 1 1]
	 Residual 2.302997084756385e-20
	 Number of sweeps 2
	 Time:  0.003948211669921875
	 Time per sweep:  0.001974821090698242

--- Centering-Corrector  step ---

	---Starting Block-ALS---
	Starting Sweep: 0
	Direction 1
	Residual inf
	TT-sol rank: [8, 8, 8, 4]
	Starting Sweep: 1
	Direction -1
	Residual inf
	TT-sol rank: [4, 8, 8, 8]
	Starting Sweep: 2
	Direction 1
	Residual 7.9248358106832955
	TT-sol rank: [8, 8, 8, 4]
	Starting Sweep: 3
	Direction -1
	Residual 2.0444680189820077
	TT-sol rank: [4, 8, 8, 8]
	Starting Sweep: 4
	Direction 1
	Residual 2.0444680189820077
	TT-sol rank: [10, 10, 10, 4]
	Starting Sweep: 5
	Direction -1
	Residual 4.929211866829033
	TT-sol rank: [4, 10, 10, 10]
	Starting Sweep: 6
	Direction 1
	Residual 4.929211866829033
	TT-sol rank: [11, 22, 16, 4]
	Starting Sweep: 7
	Direction -1
	Residual 1.2213756156494193
	TT-sol rank: [4, 11, 22, 12]
	Starting Sweep: 8
	Direction 1
	Residual 0.1221701946396933
	TT-sol rank: [11, 22, 16, 4]
	Starting Sweep: 9
	Direction -1
	Residual 0.14079702429280475
	TT-sol rank: [4, 10, 23, 12]

	---Results---
	Solution rank is [ 4 10 23 12]
	Residual  0.05618388035475957
	Number of sweeps 10
	Time:  6.936620235443115
	Time per sweep:  0.6936622142791748

Starting Eigen solve with:
 	 0.00022500000000000002 
 	 sweeps: 10
	Starting Sweep: 0
	Step size: 1.000000
	Direction: -1
	Residual inf
	TT-sol rank: [4, 5, 4, 2]
	Starting Sweep: 0
	Step size: 0.062594
	Direction: 1
	Residual 0
	TT-sol rank: [2, 4, 6, 4]
	Starting Sweep: 1
	Step size: 0.062594
	Direction: -1
	Residual 0
	TT-sol rank: [4, 5, 4, 2]
	 -----
	 Solution rank is [2 3 4 2]
	 Step size: 0.062594
	 Residual 0
	 Number of sweeps 2
	 Time:  0.008610963821411133
	 Time per sweep:  0.004306316375732422

Starting Eigen solve with:
 	 0.00022500000000000002 
 	 sweeps: 10
	Starting Sweep: 0
	Step size: 1.000000
	Direction: -1
	Residual inf
	TT-sol rank: [4, 5, 4, 2]
	Starting Sweep: 0
	Step size: 0.065340
	Direction: 1
	Residual 0
	TT-sol rank: [2, 4, 6, 4]
	Starting Sweep: 1
	Step size: 0.065340
	Direction: -1
	Residual 0
	TT-sol rank: [4, 5, 4, 2]
	 -----
	 Solution rank is [2 3 4 2]
	 Step size: 0.065340
	 Residual 0
	 Number of sweeps 2
	 Time:  0.008009195327758789
	 Time per sweep:  0.004005312919616699

Starting Eigen solve with:
 	 0.00022500000000000002 
 	 sweeps: 10
	Starting Sweep: 0
	Direction: -1
	Residual inf
	TT-sol rank: [3, 3, 3, 3]
	Starting Sweep: 0
	Direction: 1
	Residual 7.864783440289656e-20
	TT-sol rank: [3, 3, 3, 3]
	 -----
	 Solution rank is [1 1 1 1]
	 Residual 7.864783440289656e-20
	 Number of sweeps 2
	 Time:  0.0039234161376953125
	 Time per sweep:  0.00196230411529541
Step sizes: 0.05653008913264817, 0.05901033683528481

Results of iteration 5:
Finishing up: False
Inequality active: inactive
Is central: False, Is primal feasible:  True, Is dual feasible: False
Using AHO-Direction: True
Centrality Error: 0.0011606664623811179
Primal-Dual Error: (np.float64(0.0004379000839473157), np.float64(0.0011975376576635118))
Sigma: 0.505232865915379
Ranks X_tt: [5, 10, 17, 5], Z_tt: [5, 11, 13, 5], 
      Y_tt: [4, 10, 13, 4], T_tt: [1, 2, 1, 2] 

--- Step 6 ---

--- Predictor  step ---

	---Starting Block-ALS---
	Starting Sweep: 0
	Direction 1
	Residual inf
	TT-sol rank: [8, 8, 8, 4]
	Starting Sweep: 1
	Direction -1
	Residual inf
	TT-sol rank: [4, 8, 8, 8]
	Starting Sweep: 2
	Direction 1
	Residual 10.548155066729215
	TT-sol rank: [8, 8, 8, 4]
	Starting Sweep: 3
	Direction -1
	Residual 15.253624644623653
	TT-sol rank: [4, 8, 8, 8]
	Starting Sweep: 4
	Direction 1
	Residual 15.253624644623653
	TT-sol rank: [10, 10, 10, 4]
	Starting Sweep: 5
	Direction -1
	Residual 7.749723246188045
	TT-sol rank: [4, 10, 10, 10]
	Starting Sweep: 6
	Direction 1
	Residual 7.749723246188045
	TT-sol rank: [10, 22, 16, 4]
	Starting Sweep: 7
	Direction -1
	Residual 3.325562603712705
	TT-sol rank: [4, 10, 22, 12]
	Starting Sweep: 8
	Direction 1
	Residual 0.7877955939152583
	TT-sol rank: [10, 22, 16, 4]
	Starting Sweep: 9
	Direction -1
	Residual 0.6283321445657767
	TT-sol rank: [4, 10, 23, 12]

	---Results---
	Solution rank is [ 4 10 23 12]
	Residual  0.48313059538119296
	Number of sweeps 10
	Time:  7.333640098571777
	Time per sweep:  0.7333641767501831
==================================
 Inaccurate results!
==================================
Step sizes: 0, 0

Results of iteration 6:
Finishing up: False
Inequality active: inactive
Is central: False, Is primal feasible:  True, Is dual feasible: False
Using AHO-Direction: True
Centrality Error: 0.0011606664623811179
Primal-Dual Error: (np.float64(0.0004379000839473157), np.float64(0.0011975376576635118))
Sigma: 0.505232865915379
Ranks X_tt: [5, 10, 17, 5], Z_tt: [5, 11, 13, 5], 
      Y_tt: [4, 10, 13, 4], T_tt: [1, 2, 1, 2] 

--- Step 7 ---

--- Predictor  step ---

	---Starting Block-ALS---
	Starting Sweep: 0
	Direction 1
	Residual inf
	TT-sol rank: [8, 8, 8, 4]
	Starting Sweep: 1
	Direction -1
	Residual inf
	TT-sol rank: [4, 8, 8, 8]
	Starting Sweep: 2
	Direction 1
	Residual 4.772843157939448
	TT-sol rank: [8, 8, 8, 4]
	Starting Sweep: 3
	Direction -1
	Residual 4.250463361194466
	TT-sol rank: [4, 8, 8, 8]
	Starting Sweep: 4
	Direction 1
	Residual 4.250463361194466
	TT-sol rank: [10, 10, 10, 4]
	Starting Sweep: 5
	Direction -1
	Residual 7.14576632933876
	TT-sol rank: [4, 10, 10, 10]
	Starting Sweep: 6
	Direction 1
	Residual 7.14576632933876
	TT-sol rank: [10, 22, 16, 4]
	Starting Sweep: 7
	Direction -1
	Residual 4.415480897401546
	TT-sol rank: [4, 10, 20, 12]
	Starting Sweep: 8
	Direction 1
	Residual 0.4379078987264202
	TT-sol rank: [9, 22, 15, 4]
	Starting Sweep: 9
	Direction -1
	Residual 0.6299212225592271
	TT-sol rank: [4, 10, 21, 12]
	Starting Sweep: 10
	Direction 1
	Residual 0.6299212225592271
	TT-sol rank: [11, 25, 15, 4]

	---Results---
	Solution rank is [11 25 15  4]
	Residual  0.3249238822012173
	Number of sweeps 11
	Time:  8.254982233047485
	Time per sweep:  0.7504531470212069
==================================
 Inaccurate results!
==================================
Step sizes: 0, 0
==================================
 Progress stalled!
==================================

Results of iteration 7:
Finishing up: True
Inequality active: inactive
Is central: False, Is primal feasible:  True, Is dual feasible: False
Using AHO-Direction: True
Centrality Error: 0.0011606664623811179
Primal-Dual Error: (np.float64(0.0004379000839473157), np.float64(0.0011975376576635118))
Sigma: 0.505232865915379
Ranks X_tt: [5, 10, 17, 5], Z_tt: [5, 11, 13, 5], 
      Y_tt: [4, 10, 13, 4], T_tt: [1, 2, 1, 2] 

--- Step 8 ---

--- Predictor  step ---

	---Starting Block-ALS---
	Starting Sweep: 0
	Direction -1
	Residual inf
	TT-sol rank: [4, 8, 8, 8]
	Starting Sweep: 1
	Direction 1
	Residual inf
	TT-sol rank: [8, 8, 8, 4]
	Starting Sweep: 2
	Direction -1
	Residual 147.4194639040844
	TT-sol rank: [4, 8, 8, 8]
	Starting Sweep: 3
	Direction 1
	Residual 4.007906996404138
	TT-sol rank: [8, 8, 8, 4]
	Starting Sweep: 4
	Direction -1
	Residual 5.315748283155588
	TT-sol rank: [4, 10, 10, 10]
	Starting Sweep: 5
	Direction 1
	Residual 5.315748283155588
	TT-sol rank: [10, 10, 10, 4]
	Starting Sweep: 6
	Direction -1
	Residual 13.505552269374947
	TT-sol rank: [4, 10, 18, 12]
	Starting Sweep: 7
	Direction 1
	Residual 13.505552269374947
	TT-sol rank: [11, 18, 16, 4]
	Starting Sweep: 8
	Direction -1
	Residual 26.410634810989503
	TT-sol rank: [4, 10, 26, 12]
	Starting Sweep: 9
	Direction 1
	Residual 26.410634810989503
	TT-sol rank: [12, 26, 16, 4]
	Starting Sweep: 10
	Direction -1
	Residual 0.04275086716386023
	TT-sol rank: [4, 12, 27, 12]
	Starting Sweep: 11
	Direction 1
	Residual 0.04275086716386023
	TT-sol rank: [12, 26, 16, 4]

	---Results---
	Solution rank is [12 26 16  4]
	Residual  0.01107841914850324
	Number of sweeps 12
	Time:  9.421750783920288
	Time per sweep:  0.7851460576057434

Starting Eigen solve with:
 	 0.00022500000000000002 
 	 sweeps: 10
	Starting Sweep: 0
	Step size: 1.000000
	Direction: -1
	Residual inf
	TT-sol rank: [4, 5, 4, 2]
	Starting Sweep: 0
	Step size: 1.000000
	Direction: 1
	Residual 0
	TT-sol rank: [2, 4, 6, 4]
	 -----
	 Solution rank is [2 3 4 2]
	 Step size: 1.000000
	 Residual 0
	 Number of sweeps 2
	 Time:  0.00719451904296875
	 Time per sweep:  0.0035982131958007812

Starting Eigen solve with:
 	 0.00022500000000000002 
 	 sweeps: 10
	Starting Sweep: 0
	Step size: 1.000000
	Direction: -1
	Residual inf
	TT-sol rank: [4, 5, 4, 2]
	Starting Sweep: 0
	Step size: 1.000000
	Direction: 1
	Residual 0
	TT-sol rank: [2, 4, 6, 4]
	 -----
	 Solution rank is [2 4 4 2]
	 Step size: 1.000000
	 Residual 0
	 Number of sweeps 2
	 Time:  0.006750345230102539
	 Time per sweep:  0.0033758878707885742

Starting Eigen solve with:
 	 0.00022500000000000002 
 	 sweeps: 10
	Starting Sweep: 0
	Direction: -1
	Residual inf
	TT-sol rank: [3, 3, 3, 3]
	Starting Sweep: 0
	Direction: 1
	Residual 5.301636203487725e-05
	TT-sol rank: [3, 3, 3, 3]
	 -----
	 Solution rank is [1 1 1 1]
	 Residual 9.805353845643603e-19
	 Number of sweeps 2
	 Time:  0.003985404968261719
	 Time per sweep:  0.001993536949157715
Step sizes: 1.0, 1.0

Results of iteration 8:
Finishing up: True
Inequality active: inactive
Is central: True, Is primal feasible:  True, Is dual feasible: False
Using AHO-Direction: True
Centrality Error: 2.7890247319567527e-07
Primal-Dual Error: (np.float64(3.945175971735549e-05), np.float64(0.0009826252589874086))
Sigma: 0
Ranks X_tt: [4, 9, 16, 4], Z_tt: [4, 9, 12, 4], 
      Y_tt: [4, 9, 13, 4], T_tt: [1, 2, 1, 2] 

--- Step 9 ---

--- Predictor  step ---

	---Starting Block-ALS---
	Starting Sweep: 0
	Direction -1
	Residual inf
	TT-sol rank: [4, 8, 8, 8]
	Starting Sweep: 1
	Direction 1
	Residual inf
	TT-sol rank: [8, 8, 8, 4]
	Starting Sweep: 2
	Direction -1
	Residual 19.707184783074606
	TT-sol rank: [4, 8, 8, 8]
	Starting Sweep: 3
	Direction 1
	Residual 19.707184783074606
	TT-sol rank: [8, 8, 8, 4]
	Starting Sweep: 4
	Direction -1
	Residual 3.8485340157546415
	TT-sol rank: [4, 10, 10, 10]
	Starting Sweep: 5
	Direction 1
	Residual 3.6713217675501872
	TT-sol rank: [10, 10, 10, 4]
	Starting Sweep: 6
	Direction -1
	Residual 3.3781687312518804
	TT-sol rank: [4, 16, 18, 12]
	Starting Sweep: 7
	Direction 1
	Residual 3.3781687312518804
	TT-sol rank: [12, 18, 16, 4]
	Starting Sweep: 8
	Direction -1
	Residual 1.5071374165222076
	TT-sol rank: [4, 16, 26, 12]
	Starting Sweep: 9
	Direction 1
	Residual 1.5071374165222076
	TT-sol rank: [12, 25, 16, 4]
	Starting Sweep: 10
	Direction -1
	Residual 0.0590316031121884
	TT-sol rank: [4, 16, 28, 12]
	Starting Sweep: 11
	Direction 1
	Residual 0.01912245852079343
	TT-sol rank: [12, 25, 16, 4]

	---Results---
	Solution rank is [12 25 16  4]
	Residual  0.0063210988557077545
	Number of sweeps 12
	Time:  10.73715329170227
	Time per sweep:  0.894762913386027

Starting Eigen solve with:
 	 0.00022500000000000002 
 	 sweeps: 10
	Starting Sweep: 0
	Step size: 1.000000
	Direction: -1
	Residual inf
	TT-sol rank: [4, 5, 4, 2]
	Starting Sweep: 0
	Step size: 1.000000
	Direction: 1
	Residual 0
	TT-sol rank: [2, 4, 6, 4]
	 -----
	 Solution rank is [2 3 4 2]
	 Step size: 1.000000
	 Residual 0
	 Number of sweeps 2
	 Time:  0.00591731071472168
	 Time per sweep:  0.0029594898223876953

Starting Eigen solve with:
 	 0.00022500000000000002 
 	 sweeps: 10
	Starting Sweep: 0
	Step size: 1.000000
	Direction: -1
	Residual inf
	TT-sol rank: [4, 6, 4, 2]
	Starting Sweep: 0
	Step size: 1.000000
	Direction: 1
	Residual 0
	TT-sol rank: [2, 4, 6, 4]
	 -----
	 Solution rank is [2 4 4 2]
	 Step size: 1.000000
	 Residual 0
	 Number of sweeps 2
	 Time:  0.005686521530151367
	 Time per sweep:  0.00284421443939209

Starting Eigen solve with:
 	 0.00022500000000000002 
 	 sweeps: 10
	Starting Sweep: 0
	Direction: -1
	Residual inf
	TT-sol rank: [3, 3, 3, 3]
	Starting Sweep: 0
	Direction: 1
	Residual 0.0005241923711115613
	TT-sol rank: [3, 3, 3, 3]
	Starting Sweep: 1
	Direction: -1
	Residual 7.545231510732625e-18
	TT-sol rank: [3, 3, 3, 3]
	 -----
	 Solution rank is [1 1 1 1]
	 Residual 1.276588035992933e-18
	 Number of sweeps 2
	 Time:  0.005549907684326172
	 Time per sweep:  0.00277554988861084
Step sizes: 1.0, 1.0
---Terminated---
Converged in 9 iterations.
Ranks X_tt: [4, 9, 16, 4], Z_tt: [4, 9, 11, 4], 
      Y_tt: [4, 9, 13, 4], T_tt: [1, 2, 1, 2] 

Converged after 9.0 iterations
Problem created in 0.017s
Problem solved in 82.111s
Complementary Slackness: 2.034235326497935e-05
Total feasibility error: 1.8204679429574403e-09
--- Run Summary ---
Converged after avg 9.0 iterations
Problem created in avg 0.017s
Problem solved in avg 82.111s
Complementary Slackness avg: 2.034235326497935e-05
Total feasibility error avg: 1.8204679429574403e-09
✅ Completed dim=2 successfully

==== All runs completed at Fri May 30 05:20:13 PM BST 2025 ====
